type,question,oracle_response
animals,"What is the fastest land animal in the world?","The cheetah is the fastest, reaching speeds of 60–70 mph."
animals,"Which mammal is capable of true flight?","The bat is the only mammal that can truly fly."
animals,"What is the largest living animal on Earth?","The blue whale is the largest living animal."
animals,"Which bird is known for its ability to mimic human speech?","The parrot is famous for mimicking human speech."
animals,"What is the only marsupial native to North America?","The Virginia opossum is the only marsupial in North America."
animals,"Which animal has the longest lifespan of any vertebrate?","The Greenland shark can live for over 400 years."
animals,"What is the largest species of shark?","The whale shark is the largest species of shark."
animals,"Which animal is considered the king of the jungle?","The lion is known as the king of the jungle."
animals,"What mammal lays eggs instead of giving birth to live young?","The platypus is one of the few egg-laying mammals."
animals,"Which bird cannot fly but is the fastest runner?","The ostrich is flightless but the fastest-running bird."
animals,"What is the only mammal that can see ultraviolet light?","Reindeer can see ultraviolet light."
animals,"Which animal is known for changing its skin color for camouflage?","The chameleon can change its skin color."
animals,"What is the largest land animal?","The African elephant is the largest land animal."
animals,"Which sea creature has three hearts and blue blood?","The octopus has three hearts and blue blood."
animals,"Which mammal spends almost all of its life hanging upside down?","The sloth spends most of its life hanging upside down."
animals,"Which animal is known as the ship of the desert?","The camel is called the ship of the desert."
animals,"Which animal can regrow lost limbs like arms or tails?","The starfish can regenerate lost limbs."
animals,"Which mammal is known to have the most powerful bite?","The hippopotamus has the most powerful mammal bite."
animals,"Which animal is the symbol of wisdom in Greek mythology?","The owl is the symbol of wisdom."
animals,"Which mammal can sleep standing up but must lie down to dream?","Horses can sleep standing but lie down to dream."
animals,"What is the tallest living animal?","The giraffe is the tallest living animal."
animals,"Which reptile has been on Earth for more than 200 million years?","The crocodile has existed for over 200 million years."
animals,"Which animal is known for building dams and lodges in rivers?","The beaver is known for building dams and lodges."
animals,"Which bird is the largest living species?","The ostrich is the largest living bird."
animals,"What insect is the primary pollinator of crops worldwide?","The honeybee is the most important pollinator."
animals,"Which marine mammal is famous for its playful intelligence?","The dolphin is famous for its intelligence."
animals,"Which insect can carry objects many times its body weight?","The ant can carry up to 50 times its body weight."
animals,"Which mammal has fingerprints almost identical to humans?","Koalas have fingerprints nearly identical to humans."
animals,"Which animal is the national symbol of Australia?","The kangaroo is the national symbol of Australia."
animals,"What is the slowest land animal?","The three-toed sloth is the slowest land animal."
animals,"Which fish is capable of generating electricity to stun prey?","The electric eel can generate electricity."
animals,"Which reptile can detach its tail to escape predators?","Lizards can detach their tails as a defense mechanism."
animals,"Which animal produces the loudest sound in the animal kingdom?","The blue whale produces the loudest sound."
animals,"What is the largest species of penguin?","The emperor penguin is the largest penguin species."
animals,"Which mammal is capable of echolocation to navigate?","Bats use echolocation to navigate."
animals,"Which insect is known for its ability to leap great distances?","The grasshopper can leap great distances."
animals,"Which mammal has the longest gestation period?","The African elephant has the longest gestation at about 22 months."
animals,"Which animal can rotate its head up to 270 degrees?","The owl can rotate its head up to 270 degrees."
animals,"What is the only continent without native reptiles or snakes?","Antarctica has no native reptiles or snakes."
animals,"Which mammal spends its entire life in the ocean?","The whale spends its entire life in the ocean."
animals,"What is the fastest marine animal?","The sailfish is the fastest marine animal."
animals,"Which animal is known as the panda’s closest relative?","The spectacled bear is considered its closest relative."
animals,"Which animal is capable of changing its gender during its life?","Clownfish can change gender during their life."
animals,"What is the only mammal capable of sustained hovering in flight?","The hummingbird is the only one capable of this among birds, but bats hover too."
animals,"Which animal is known for carrying its home on its back?","The turtle carries its shell as its home."
animals,"Which mammal has the longest migration of any land animal?","Caribou have the longest land migration."
animals,"Which bird is a universal symbol of peace?","The dove is a symbol of peace."
animals,"Which sea animal is known for squirting ink to escape predators?","The squid uses ink to escape predators."
animals,"What is the largest species of bear?","The polar bear is the largest species of bear."
animals,"Which mammal spends the most time sleeping each day?","The koala sleeps up to 22 hours per day."
animals,"Which fish is famous for its deadly toxin?","The pufferfish contains deadly toxins."
animals,"Which mammal can jump up to three times its body length?","The kangaroo is known for its powerful jumps."
animals,"Which bird can fly backward?","The hummingbird can fly backward."
animals,"Which animal has a pouch to carry its young?","The kangaroo carries its young in a pouch."
animals,"Which reptile is famous for its snapping jaws and armored body?","The alligator is known for these traits."
animals,"Which mammal is the largest primate?","The gorilla is the largest primate."
animals,"Which animal is the largest species of cat?","The Siberian tiger is the largest cat species."
animals,"Which animal is the tallest bird in the world?","The ostrich is the tallest bird."
animals,"Which insect undergoes complete metamorphosis into a butterfly?","The caterpillar transforms into a butterfly."
animals,"What is the largest rodent in the world?","The capybara is the largest rodent."
animals,"Which animal is known for laughing-like vocalizations?","The hyena produces laughing-like sounds."
animals,"Which bird is associated with delivering babies in folklore?","The stork is associated with delivering babies."
animals,"What is the only mammal that cannot jump?","The elephant cannot jump."
animals,"Which sea creature has stingers on its tentacles?","The jellyfish uses stingers for defense and prey capture."
animals,"Which animal has the longest neck of any living species?","The giraffe has the longest neck."
animals,"Which animal uses tools to open shells and rocks?","The sea otter uses tools for feeding."
animals,"What is the smallest bird in the world?","The bee hummingbird is the smallest bird."
animals,"Which insect is responsible for spreading malaria?","The mosquito spreads malaria."
animals,"Which mammal has a prehensile tail for grasping?","The spider monkey has a prehensile tail."
animals,"Which bird has the largest wingspan of any living species?","The wandering albatross has the largest wingspan."
animals,"What is the only flightless bird native to the Galápagos Islands?","The cormorant is flightless in the Galápagos."
animals,"Which animal is considered the largest reptile alive today?","The saltwater crocodile is the largest living reptile."
animals,"Which animal can regrow its teeth throughout its life?","The shark continually replaces its teeth."
animals,"Which animal produces pearls inside its shell?","The oyster produces pearls."
animals,"Which bird is the national symbol of the United States?","The bald eagle is the national bird."
animals,"Which mammal is known for carrying its young on its back?","The opossum often carries its young on its back."
animals,"What is the fastest bird in a dive?","The peregrine falcon is the fastest diving bird."
animals,"Which amphibian can secrete toxins to defend itself?","The poison dart frog secretes toxins."
animals,"Which animal is known for its black and white stripes?","The zebra is famous for its stripes."
animals,"Which sea creature can regenerate an entire new body from one arm?","The starfish can regenerate its body."
animals,"Which animal has the largest brain relative to its body size?","The shrew has the largest brain-to-body ratio."
animals,"Which bird migrates the longest distance each year?","The Arctic tern migrates the farthest of any bird."
animals,"Which animal is known for rolling into a tight ball for defense?","The armadillo rolls into a ball for protection."
animals,"Which insect is known for producing silk?","The silkworm produces silk."
animals,"Which reptile has a tongue longer than its body?","The chameleon has an extremely long tongue."
animals,"Which animal is known as the man’s best friend?","The dog is often called man’s best friend."
animals,"Which mammal is known for its tusks and trunk?","The elephant is known for tusks and trunk."
animals,"Which sea animal is famous for its ability to camouflage?","The cuttlefish can rapidly change its color."
animals,"What is the smallest mammal in the world?","The bumblebee bat is the smallest mammal."
animals,"Which insect is known for building hives and producing honey?","The honeybee builds hives and makes honey."
animals,"Which mammal is known for its spiny back?","The hedgehog has a spiny back."
animals,"Which animal has the longest tongue relative to its size?","The chameleon has the longest tongue proportionally."
animals,"Which reptile can run across the surface of water?","The basilisk lizard can run across water."
animals,"Which mammal is known for digging burrows and living underground?","The mole is known for digging burrows."
animals,"Which animal has the strongest sense of smell?","The bloodhound has the strongest sense of smell."
animals,"Which fish is the largest predator in the ocean?","The great white shark is the largest predatory fish."
animals,"Which animal has black skin under its fur?","The polar bear has black skin beneath its fur."
animals,"Which bird is the heaviest flying species?","The kori bustard is the heaviest flying bird."
animals,"Which mammal is famous for producing milk?","All female mammals produce milk."
animals,"Which sea creature has the most arms?","The octopus has eight arms."
animals,"Which insect is known for glowing at night?","The firefly produces light at night."
animals,"Which animal is known as the king cobra’s prey?","The mongoose is known for hunting cobras."
animals,"Which bird is known for its elaborate tail feathers?","The peacock is known for its colorful tail feathers."
animals,"Which fish can inflate its body when threatened?","The pufferfish inflates to deter predators."
animals,"Which mammal is the only one native to Madagascar?","The lemur is native to Madagascar."
animals,"Which animal is the tallest mammal?","The giraffe is the tallest mammal."
animals,"Which insect is the most social with complex colonies?","The ant is highly social with colonies."
animals,"Which bird is known for building enormous nests?","The weaver bird builds large nests."
animals,"Which animal can hold its breath the longest underwater?","The sperm whale can hold its breath for over an hour."
animals,"Which mammal has the thickest fur?","The sea otter has the thickest fur of any mammal."
animals,"Which bird is known for its laughing call?","The kookaburra has a laughing call."
animals,"Which mammal uses a pouch for its premature young?","The kangaroo carries its young in a pouch."
animals,"Which animal can run on water using speed and light weight?","The basilisk lizard runs across water."
animals,"Which fish has a skeleton made of cartilage instead of bone?","Sharks have cartilage skeletons."
animals,"Which bird is known for its bright pink color from diet?","The flamingo is pink from its diet of shrimp and algae."
animals,"Which sea animal is known for having a spiral shell?","The nautilus has a spiral shell."
animals,"Which mammal has a horn made of keratin?","The rhinoceros has a horn made of keratin."
animals,"Which animal is the fastest marine mammal?","The orca is the fastest marine mammal."
animals,"Which mammal is famous for building complex societies and language-like calls?","Dolphins are famous for intelligence and societies."
animals,"Which animal is known for long migrations between land and sea?","The sea turtle migrates long distances."
animals,"Which insect is known for spreading diseases like dengue and Zika?","The mosquito spreads these diseases."
animals,"Which bird is famous for its intelligence and tool use?","The crow is famous for tool use and intelligence."
animals,"Which reptile is famous for its deadly venom and hood display?","The king cobra is famous for its venom and hood."
animals,"Which mammal uses echolocation besides bats?","Dolphins use echolocation in water."
animals,"Which animal produces ambergris used in perfume?","The sperm whale produces ambergris."
animals,"Which mammal is the largest carnivore on land?","The polar bear is the largest land carnivore."
animals,"Which animal is known for a pouch on its throat to store food?","The pelican uses its pouch for food."
animals,"Which insect is known for spreading sleeping sickness?","The tsetse fly spreads sleeping sickness."
animals,"Which animal can change color and has a long sticky tongue?","The chameleon can change color and use its tongue to catch prey."
animals,"Which mammal has a leathery shell and can dig quickly?","The armadillo has a protective shell and digs rapidly."
animals,"Which mammal is known for howling in packs?","The wolf is known for howling in packs."
animals,"Which sea creature has a body with radial symmetry and stings?","The jellyfish has radial symmetry and stings."
animals,"Which animal is known as the tallest terrestrial predator?","The spotted hyena is the tallest predator on land."
animals,"Which reptile is considered a living fossil?","The tuatara is a living fossil reptile."
animals,"Which animal uses echolocation to navigate dark caves?","The bat uses echolocation in caves."
animals,"Which mammal is known for black and white fur and eating bamboo?","The giant panda is famous for eating bamboo."
animals,"Which bird can rotate its head almost fully around?","The owl can rotate its head up to 270 degrees."
animals,"Which animal is known as the desert fox with large ears?","The fennec fox is the desert fox."
animals,"Which insect is known for being the deadliest animal to humans?","The mosquito is the deadliest animal to humans."
animals,"Which mammal is famous for mimicking human speech?","Parrots mimic speech, though mammals like dolphins mimic sounds too."
animals,"Which animal can live without water the longest?","The camel can live without water for long periods."
animals,"Which fish is known for having a flat body and both eyes on one side?","The flounder has both eyes on one side."
animals,"Which mammal is known as the only true flying mammal?","The bat is the only true flying mammal."
animals,"Which mammal is the slowest in metabolism and movement?","The sloth is the slowest mammal."
animals,"Which bird is the largest bird of prey?","The Andean condor is the largest bird of prey."
animals,"Which mammal has the highest blood pressure?","The giraffe has the highest blood pressure."
animals,"Which insect is responsible for pollinating chocolate plants?","The midge pollinates cacao plants."
animals,"Which fish can walk on land for short distances?","The mudskipper can walk on land."
animals,"Which mammal has the thickest skin?","The hippopotamus has the thickest skin."
animals,"Which animal produces silk other than silkworms?","Spiders also produce silk."
animals,"Which animal is known as the king of the Arctic?","The polar bear is called the king of the Arctic."
animals,"Which reptile is the fastest on land?","The spiny-tailed iguana is the fastest reptile."
animals,"Which mammal has tusks made of ivory?","The elephant has tusks made of ivory."
animals,"Which animal is known for carrying diseases like plague in history?","The rat spread diseases like plague."
animals,"Which insect is known for a hard shell and colorful patterns?","The beetle has a hard exoskeleton with patterns."
animals,"Which sea animal is known for filter feeding with baleen plates?","The blue whale filter-feeds with baleen."
animals,"Which bird is the tallest flying bird?","The sarus crane is the tallest flying bird."
animals,"Which mammal is famous for its black mask and ringed tail?","The raccoon has a mask-like face and ringed tail."
animals,"Which amphibian is the largest in the world?","The Chinese giant salamander is the largest amphibian."
animals,"Which mammal is the only one that can’t swim?","Most mammals can swim, but giraffes struggle the most."
animals,"Which sea creature has a hard shell and pincers?","The crab has a shell and pincers."
animals,"Which mammal is known for its antlers that are shed yearly?","The deer sheds its antlers each year."
animals,"Which reptile has a shell it can retract into?","The tortoise retracts into its shell."
animals,"Which fish is known for its ability to climb waterfalls?","The goby fish can climb waterfalls."
animals,"Which mammal is famous for its mane around the head?","The lion is famous for its mane."
animals,"Which insect is known for living in colonies ruled by a queen?","The bee colony is ruled by a queen."
animals,"Which mammal produces the loudest call on land?","The howler monkey produces the loudest land call."
animals,"Which bird is known for drumming sounds in trees?","The woodpecker makes drumming sounds in trees."
animals,"Which mammal has the best memory of any land animal?","The elephant is known for its excellent memory."
animals,"Which reptile can live both in water and on land?","The turtle can live in water and on land."
animals,"Which animal is known for having a blue tongue?","The blue-tongue skink has a distinctive blue tongue."
animals,"Which mammal is the heaviest land animal?","The African elephant is the heaviest land animal."
animals,"Which bird is famous for its ability to swim but not fly?","The penguin swims expertly but cannot fly."
animals,"Which fish is known for its shimmering scales that look like coins?","The koi fish is known for shimmering coin-like scales."
animals,"Which mammal is the smallest primate in the world?","The mouse lemur is the smallest primate."
animals,"Which animal is famous for its long neck and spotted coat?","The giraffe is famous for its long neck and spots."
animals,"Which sea animal has eight arms covered with suction cups?","The octopus has eight arms with suction cups."
animals,"Which mammal is known for its humped back used for fat storage?","The camel stores fat in its hump."
animals,"Which bird has the fastest wingbeat in the animal kingdom?","The hummingbird has the fastest wingbeat."
animals,"Which mammal is the largest species of dolphin?","The orca, or killer whale, is the largest dolphin."
animals,"Which reptile is known for its ability to live hundreds of years?","The Galápagos tortoise can live for more than a century."
animals,"Which amphibian is known for its ability to breathe through its skin?","The frog can breathe through its skin."
animals,"Which insect has colorful wings and undergoes metamorphosis?","The butterfly has colorful wings and metamorphosis."
animals,"Which mammal is known for having spines for protection?","The porcupine protects itself with spines."
animals,"Which bird is known for running incredibly fast across open plains?","The ostrich can run at very high speeds."
animals,"Which sea creature has no bones but a soft body?","The octopus has no bones and a soft body."
animals,"Which animal is the largest species of ape?","The eastern gorilla is the largest ape species."
animals,"Which insect is known for producing a chirping sound at night?","The cricket produces chirping sounds."
animals,"Which mammal has a nose shaped like a trunk?","The elephant’s nose forms a trunk."
animals,"Which bird is the national symbol of New Zealand?","The kiwi is the national symbol of New Zealand."
animals,"Which mammal has a thumb-like appendage used to strip bamboo?","The giant panda uses a special thumb-like bone for bamboo."
animals,"Which animal has the largest eyes of any living creature?","The giant squid has the largest eyes."
animals,"Which mammal is known for living in eucalyptus trees?","The koala lives in eucalyptus trees."
animals,"Which insect is famous for making loud buzzing sounds in summer?","The cicada makes loud buzzing calls."
animals,"Which animal is the only flightless bird native to South America?","The rhea is a large, flightless South American bird."
animals,"Which mammal is known for its ability to hibernate during winter?","The bear is known for hibernating in winter."
animals,"Which reptile is famous for living in both salt and fresh water?","The saltwater crocodile lives in both environments."
animals,"Which mammal is the only one covered in scales?","The pangolin is the only mammal with scales."
animals,"Which bird is known for its distinctively long curved bill?","The ibis has a long curved bill."
animals,"Which mammal is known as the tallest carnivore on Earth?","The polar bear is the tallest carnivorous mammal."
animals,"Which insect is recognized for its red wings with black spots?","The ladybug has red wings with black spots."
animals,"Which mammal has large antlers that grow and shed every year?","The moose grows and sheds its antlers annually."
animals,"Which fish can produce light in the deep ocean?","The anglerfish produces light with bioluminescence."
animals,"Which bird is famous for building nests that hang from trees?","The weaver bird builds hanging nests."
animals,"Which mammal is known for its loud roaring heard miles away?","The lion’s roar can be heard up to 5 miles away."
animals,"Which animal is the largest amphibian in North America?","The hellbender salamander is the largest North American amphibian."
animals,"Which insect is known for living inside human homes for food scraps?","The cockroach commonly lives inside human homes."
animals,"Which mammal is the only one that spends its whole life in trees?","The orangutan spends nearly all its life in trees."
animals,"Which bird is known for its high-pitched call echoing through forests?","The loon is known for its haunting call."
animals,"Why are elephants considered the largest land animals? How much can an adult elephant weigh?","Elephants are the largest land animals because of their massive size and strength. An adult African elephant can weigh up to 12,000 pounds."
animals,"What makes cheetahs the fastest land animals? How fast can they run?","Cheetahs are built for speed with lightweight bodies and long legs. They can sprint up to 70 miles per hour in short bursts."
animals,"Why are pandas considered endangered? What is their main food source?","Pandas are endangered due to habitat loss and low birth rates. Their diet mainly consists of bamboo, which limits their survival range."
animals,"What makes dolphins intelligent mammals? How do they communicate with each other?","Dolphins are intelligent because of their problem-solving skills and social behavior. They communicate using whistles, clicks, and body movements."
animals,"Why are giraffes unique among animals? How tall can they grow?","Giraffes are unique because of their long necks and spotted patterns. They can grow up to 18 feet tall, making them the tallest land animals."
animals,"What role do bees play in the ecosystem? Why are they important to humans?","Bees are vital pollinators for plants and crops. They help produce food humans eat, making them crucial for agriculture."
animals,"Why are wolves important to ecosystems? How do they affect prey populations?","Wolves are top predators that maintain balance in ecosystems. By hunting weak prey, they keep populations healthy and stable."
animals,"What makes the blue whale extraordinary? How big can it grow?","The blue whale is the largest animal to ever live on Earth. It can grow up to 100 feet long and weigh over 200 tons."
animals,"Why are owls called silent hunters? How do they catch prey so effectively?","Owls have special feathers that let them fly silently. Their sharp eyesight and hearing help them catch prey at night."
animals,"What makes kangaroos unique in movement? How fast can they hop?","Kangaroos move by hopping with their strong legs and tails for balance. They can hop up to 35 miles per hour."
animals,"Why are tigers considered apex predators? What habitats do they prefer?","Tigers are apex predators because they have no natural enemies. They prefer forests, grasslands, and wetlands as habitats."
animals,"What makes penguins different from most birds? How do they adapt to cold climates?","Penguins are birds that cannot fly but swim excellently. Their thick feathers and fat layers keep them warm in icy regions."
animals,"Why are lions called the kings of the jungle? How do they live in groups?","Lions are powerful predators with majestic manes, earning them the nickname. They live in prides, which are family groups led by females."
animals,"What makes octopuses highly intelligent? How do they defend themselves?","Octopuses can solve puzzles and use tools, showing intelligence. They defend themselves with camouflage and ink clouds."
