type,question,oracle_response
animals,"What makes cheetahs unique compared to other big cats? How are they built for speed, and why is this both an advantage and disadvantage? What struggles do they face in the wild?","Cheetahs have lightweight bodies and long legs that let them run up to 70 mph. Their speed is an advantage for hunting but makes them weaker in fights with other predators. They struggle with low genetic diversity and competition for prey."
animals,"Why are penguins adapted to extreme cold? How do they survive as colonies, and why do they take turns in groups? What danger do they face in modern times?","Penguins have thick feathers and fat layers that protect them from cold. They huddle in large colonies and rotate positions to keep warm. Today, melting ice and reduced food supplies are major threats."
animals,"What makes parrots among the most intelligent birds? How do they mimic human speech, and why do scientists link them to problem-solving? What challenges do they face in captivity?","Parrots mimic speech by controlling their vocal organs with precision. Scientists find them capable of solving puzzles and learning patterns. In captivity, they face boredom and stress if not given mental stimulation."
animals,"Why are lions unique among big cats? How do prides work, and what roles do females and males play? What threats do lions face today?","Lions are the only big cats that live in family groups called prides. Females do most of the hunting, while males protect territory. Today, they face threats from habitat loss and human conflict."
animals,"What makes sloths perfectly suited to treetop life? How do they conserve energy, and what role does algae play in their fur? Why does this make them hard to spot?","Sloths move slowly to conserve energy and avoid predators. Their fur grows algae, which gives them camouflage in trees. This makes them difficult for predators to detect in the wild."
animals,"Why are sea turtles considered ancient travelers? How long have they existed, and what migrations do they undertake? Why are conservation efforts so important?","Sea turtles have existed for over 100 million years. They migrate thousands of miles between feeding and nesting grounds. Conservation is vital because they face threats from plastic pollution, poaching, and habitat loss."
animals,"What makes hummingbirds incredible flyers? How do their wings work, and what energy demands do they face? Why are they important for ecosystems?","Hummingbirds can flap their wings up to 80 times per second. This requires constant feeding on nectar to fuel their high metabolism. They are important pollinators that help flowers reproduce."
animals,"Why are rhinoceroses symbols of strength and vulnerability? What makes their horns so valuable, and why is this harmful? How do conservationists protect them?","Rhinos are massive animals with horns used for defense. Sadly, horns are targeted by poachers for black-market trade. Conservationists protect them with anti-poaching patrols and protected reserves."
animals,"What makes wolves masters of communication? How do howls help them, and what other signals do they use? Why do packs rely on this?","Wolves howl to signal location and keep packs united. They also use body language and scent marking to communicate. This teamwork is essential for hunting and survival."
animals,"Why are whales threatened despite their size? What dangers do human activities create, and how do ships affect them? Why are protections necessary?","Whales face dangers from ship strikes, fishing nets, and noise pollution. Human activity disrupts migration and feeding patterns. Protections are necessary to ensure their survival for future generations."