type,question,oracle_response
animals,"Which mammal can store food in cheek pouches? It collects seeds and nuts to eat later. This habit makes it well prepared for winter.","The chipmunk uses cheek pouches to store food."
animals,"Which amphibian secretes toxins from its skin? Its bright colors warn predators of danger. Indigenous people once used these toxins on hunting darts.","The poison dart frog secretes deadly toxins from its skin."
animals,"Which mammal is the only marsupial in North America? It carries its young in a pouch. It is also known for playing dead when threatened.","The Virginia opossum is the only marsupial in North America."
animals,"Which bird is the heaviest capable of flight? It uses powerful wings to lift off. It often spends time walking on the ground searching for food.","The kori bustard is the heaviest bird capable of flight."
animals,"Which insect is the primary pollinator of crops? Without it, many fruits and vegetables would not grow. Its population is vital to ecosystems worldwide.","The honeybee is the most important pollinator."
animals,"Which mammal is known as man’s best friend? It has been domesticated for thousands of years. It is loyal and protective of its human companions.","The dog is called man’s best friend."
animals,"Which reptile has a tongue longer than its body? It uses it to catch insects with incredible speed. It is also famous for its color-changing ability.","The chameleon has a tongue longer than its body."
animals,"Which mammal has the thickest fur of any species? This fur keeps it warm in cold waters. It also uses tools to crack open shellfish.","The sea otter has the thickest fur and uses tools."
animals,"Which mammal is known for being the largest primate? It lives in the forests of Africa. It forms social groups led by dominant males.","The gorilla is the largest primate."
animals,"Which animal is famous for carrying its home on its back? It can retreat into this structure for safety. Its slow pace is well known.","The turtle carries its home as a shell."
animals,"Which sea animal is capable of changing its color rapidly? This ability helps it hide or communicate. It is related to squids and octopuses.","The cuttlefish can change color rapidly."
animals,"Which bird is known for its bright pink color? Its unusual hue comes from its diet. It is often seen standing on one leg.","The flamingo is pink because of its diet of shrimp and algae."
animals,"Which mammal is the largest carnivore on land? It lives in Arctic regions. Its thick fur and fat layers protect it from the cold.","The polar bear is the largest land carnivore."
animals,"Which insect glows at night? Its light attracts mates. This glow is created through a chemical reaction.","The firefly produces light at night."
animals,"Which mammal is known for its long migrations across Africa? It travels in huge herds. These journeys are among the greatest spectacles of nature.","The wildebeest migrates across Africa in massive groups."
animals,"Which bird is unable to fly but is a skilled swimmer? It lives in icy regions. It huddles together for warmth during cold winters.","The penguin cannot fly but is an excellent swimmer."
animals,"Which fish can generate electricity to shock its prey? This ability also helps it navigate. It lives in rivers of South America.","The electric eel generates electricity to shock prey."
animals,"Which mammal is known for digging tunnels underground? It has small eyes and powerful claws. It spends most of its life in the dark.","The mole is known for digging tunnels underground."
animals,"Which reptile has a protective shell it can withdraw into? This makes it safe from predators. It is also one of the longest-living animals.","The tortoise has a protective shell and long lifespan."
animals,"Which bird is known for drumming sounds on trees? It does this to find insects. It also uses the sound to mark territory.","The woodpecker makes drumming sounds on trees."
animals,"Which mammal is famous for its black and white fur? It eats mainly bamboo. It is a symbol of conservation efforts.","The giant panda is famous for its black and white fur."
animals,"Which fish can leap spectacularly out of the water? It sometimes lands in boats accidentally. Its silvery body shines in the sun.","The Asian carp is known for leaping out of the water."
animals,"Which mammal has a horn made of keratin? It uses it for defense. Sadly, it is often hunted illegally.","The rhinoceros has a horn made of keratin."
animals,"Which bird has a wingspan longer than most cars? It soars for hours without flapping. It is known for its long ocean journeys.","The wandering albatross has the longest wingspan."
animals,"Which mammal produces ambergris, used in perfumes? It is a massive marine predator. It dives deep into the ocean for food.","The sperm whale produces ambergris used in perfumes."
animals,"Which reptile is known for basking on rocks to warm its body? It cannot regulate heat internally. Its cold-blooded nature requires the sun.","The lizard basks on rocks to regulate body temperature."
animals,"Which mammal has large antlers that are shed each year? They can grow impressively wide. Males use them to compete for mates.","The moose has large antlers shed annually."
animals,"Which bird has a haunting call across lakes? Its sound is often associated with wilderness. It is a strong diver and swimmer.","The loon is famous for its haunting call."
animals,"Which insect is known for spreading diseases like malaria? It feeds on blood. Its bite can be deadly in tropical regions.","The mosquito spreads malaria and other diseases."
animals,"Which sea animal has a spiral shell? It uses it for protection. Its design is often studied in mathematics.","The nautilus has a spiral shell."
animals,"Which mammal is known for roaring loudly across the savanna? Its roar establishes territory. It is also a symbol of strength.","The lion roars to establish territory and dominance."
animals,"Which bird is famous for its colorful tail feathers? Males display them to attract mates. The feathers shimmer in the sunlight.","The peacock is famous for its colorful tail feathers."
animals,"Which fish has both eyes on one side of its body? It lies flat on the seafloor. Its camouflage helps it ambush prey.","The flounder has both eyes on one side."
animals,"Which reptile is famous for its deadly venom? It spreads its hood when threatened. It can even spit venom into eyes.","The king cobra is famous for its deadly venom."
animals,"Which mammal is the smallest bat and also the smallest mammal? It weighs less than a coin. It can fit into a human thumb.","The bumblebee bat is the smallest mammal."
animals,"Which bird is known for traveling the longest migration distance? It flies from pole to pole each year. This journey covers thousands of miles.","The Arctic tern makes the longest migration of any bird."
animals,"Which mammal is known for its playful nature in the sea? It leaps and spins above the waves. It is also highly intelligent.","The dolphin is playful and intelligent in the sea."
animals,"Which amphibian is the largest in the world? It can grow over a meter long. It lives in rivers and streams of Asia.","The Chinese giant salamander is the largest amphibian."
animals,"Which mammal cannot jump at all? Its weight makes leaping impossible. However, it is still powerful and fast.","The elephant is the only mammal that cannot jump."
animals,"Which insect produces silk used by humans? Its cocoons are harvested for fabric. This practice has existed for centuries.","The silkworm produces silk used in textiles."
animals,"Which sea animal has a mouth shaped like a beak? It uses it to crack open shells. It is highly intelligent and playful.","The dolphin has a beak-like mouth and intelligence."
animals,"Which mammal is famous for its memory? It remembers locations and social bonds for years. This helps it survive in difficult environments.","The elephant is known for its excellent memory."
animals,"Which fish is the top predator of the ocean? It is feared for its sharp teeth. It often appears in films about danger.","The great white shark is the top predator in the ocean."
animals,"Which bird is known for laughing-like calls in Australia? Its sound resembles human laughter. It is also part of local folklore.","The kookaburra makes laughing-like calls."
animals,"Which mammal carries its young in a pouch? This helps the babies survive when born tiny and undeveloped. It hops on strong hind legs.","The kangaroo carries its young in a pouch."
animals,"Which sea animal produces light in the deep ocean? It uses this glow to attract prey. The effect is eerie in the darkness.","The anglerfish produces light with bioluminescence."
animals,"Which insect is known for working tirelessly in colonies? It cooperates to build nests and find food. It can lift many times its own weight.","The ant is known for its hardworking colonies."
animals,"Which mammal is famous for its ringed tail and clever nature? It often scavenges human garbage. Its black mask makes it look mischievous.","The raccoon is famous for its ringed tail and mask."
animals,"Which reptile is the largest species alive today? It can grow longer than a car. It dominates rivers and coastlines.","The saltwater crocodile is the largest reptile today."
animals,"Which bird is flightless and native to New Zealand? It is small and nocturnal. Its long beak helps it find insects.","The kiwi is a flightless bird from New Zealand."
animals,"Which mammal howls to communicate with its pack? Its calls echo through forests. It is a skilled hunter.","The wolf howls to communicate with its pack."
animals,"Which mammal lives only on Madagascar and nowhere else? It has large eyes for night vision. It is an endangered species.","The lemur is found only on Madagascar."
animals,"Which bird is famous for its strong sense of direction? It can return home over hundreds of miles. Humans once used it to carry messages.","The homing pigeon is famous for navigation."
animals,"Which mammal spends most of its life in water but must breathe air? It comes to the surface regularly. It can dive for long periods.","The whale lives in water but breathes air."
animals,"Which reptile can run across the surface of water? This ability has earned it a nickname. It uses speed and light weight to stay above water.","The basilisk lizard is called the Jesus lizard because it runs on water."
animals,"Which bird is a universal symbol of peace? Its image appears in many cultures. It is gentle and graceful.","The dove is a universal symbol of peace."
animals,"Which mammal has a nose so sensitive it can track scents miles away? It is often used by humans in search and rescue. It has one of the strongest senses of smell.","The bloodhound has one of the strongest senses of smell."
animals,"Which sea animal is known for building coral reefs? These structures shelter countless species. They are vital to marine ecosystems.","Coral animals build coral reefs in the ocean."
animals,"Which mammal is the only one with a shell covering its back? It can curl into a ball for defense. Its scales are made of keratin.","The armadillo is the only mammal with a shell-like covering."
animals,"Which bird is famous for delivering babies in folklore? Its long legs and beak make it distinctive. People once believed it brought good luck.","The stork is associated with delivering babies in folklore."
animals,"Which mammal is the largest species of dolphin? It is black and white in color. It is also called the killer whale.","The orca is the largest dolphin species."
animals,"Which reptile is known for shedding its skin regularly? This allows it to grow. It often hides during this vulnerable time.","The snake sheds its skin to grow."
animals,"Which mammal is known for its strong social bonds? It often lives in troops. Grooming is an important behavior.","The monkey is known for social bonds and grooming."
animals,"Which fish can walk short distances on land? It uses its fins for support. It lives in muddy coastal areas.","The mudskipper can walk on land for short distances."
animals,"Which bird is the tallest in the world? It is also the heaviest. It cannot fly but can run at great speeds.","The ostrich is the tallest and heaviest bird."
animals,"Which mammal is the only one native to Antarctica? It survives in extreme cold. It feeds on fish and krill.","The seal is the only native mammal of Antarctica."
animals,"Which sea animal can squirt ink to confuse predators? It uses this as a defense mechanism. It then quickly escapes.","The squid squirts ink to escape predators."
animals,"Which mammal has sharp quills for protection? Predators avoid attacking it. The quills detach easily.","The porcupine uses quills for protection."
animals,"Which insect is the deadliest animal to humans worldwide? It spreads diseases through its bite. Millions of deaths are linked to it.","The mosquito is the deadliest animal to humans."
type,question,oracle_response
animals,"Which mammal is famous for gliding through the air using skin flaps? It cannot truly fly but soars between trees. This ability helps it escape predators.","The flying squirrel glides using skin flaps between its limbs."
animals,"Which bird is known for building elaborate bowers decorated with objects? The males collect colorful items to impress females. These displays are crucial for mating success.","The bowerbird builds decorated bowers to attract mates."
animals,"Which reptile has the ability to regrow its tail after losing it? This adaptation helps it escape predators. The new tail is usually different in color or shape.","Many lizards can regrow their tails after losing them."
animals,"Which mammal has long tusks made of ivory? These tusks can be used for digging, defense, and display. Unfortunately, they also make the animal a target for poachers.","The elephant has tusks made of ivory."
animals,"Which fish has the ability to change from female to male during its life? This change happens within social groups. It ensures reproduction continues when males are scarce.","Clownfish can change from female to male."
animals,"Which bird is known for its ability to recognize itself in a mirror? This shows advanced intelligence. Few animals possess such self-awareness.","The magpie can recognize itself in a mirror."
animals,"Which mammal uses echolocation underwater to find food? It emits clicks that bounce back from objects. This allows it to hunt even in darkness.","The dolphin uses echolocation to navigate and hunt."
animals,"Which amphibian can survive being frozen solid in winter? Its heart stops beating until spring. When thawed, it continues living normally.","The wood frog can survive being frozen solid."
animals,"Which reptile is considered the largest snake in the world by weight? It is a powerful constrictor found in South America. It spends much of its life in swamps and rivers.","The green anaconda is the heaviest snake in the world."
animals,"Which mammal is able to echolocate while flying at night? This helps it hunt insects in complete darkness. It also roosts during the day.","The bat uses echolocation to fly and hunt at night."
animals,"Which bird is the national symbol of India? Its colorful feathers are displayed during courtship dances. Its beauty has made it a cultural icon.","The peacock is the national bird of India."
animals,"Which mammal spends most of its time in water but can also move on land? It is known for its wide mouth and large teeth. It is one of Africa’s most dangerous animals.","The hippopotamus spends much of its time in water."
animals,"Which fish is capable of producing a strong electric shock? It uses this ability to stun prey and defend itself. Its power can reach hundreds of volts.","The electric eel can generate powerful shocks."
animals,"Which insect has existed for over 300 million years? Its body design has changed very little over time. It is considered a living fossil.","The cockroach has existed for more than 300 million years."
animals,"Which bird can sleep while flying long distances? This helps it survive lengthy migrations. It often spends months over the ocean without landing.","The frigatebird can sleep while flying."
animals,"Which mammal is famous for its massive tusks and ability to haul out on ice? It feeds on shellfish on the seafloor. Its whiskers help it locate food.","The walrus is famous for its tusks and whiskers."
animals,"Which sea animal is known for creating coral reefs? These reefs support a huge variety of marine life. They are some of the most important ecosystems on Earth.","Coral polyps build coral reefs in the ocean."
animals,"Which bird can imitate chainsaws, car alarms, and other human noises? Its vocal range is extraordinary. This makes it one of the best mimics in nature.","The lyrebird can imitate many human-made sounds."
animals,"Which mammal is known for its loud howls that carry across miles? These sounds establish territory. They are especially loud at dawn and dusk.","The howler monkey is known for its loud calls."
animals,"Which reptile can live over 150 years in captivity? Its slow metabolism contributes to its longevity. Some individuals have become national treasures.","The Galápagos tortoise can live for over 150 years."
animals,"Which mammal is known for producing large amounts of milk for its calf? This milk is rich in fat and nutrients. It ensures the calf grows quickly.","The whale produces rich milk for its young."
animals,"Which fish is known as the fastest swimmer in the ocean? Its streamlined body reduces drag. It can reach speeds of over 60 miles per hour.","The sailfish is the fastest swimmer in the ocean."
animals,"Which insect creates organized colonies with a queen, workers, and soldiers? Their society is highly structured. They are known for strength and cooperation.","Ants create highly organized colonies."
animals,"Which bird migrates from the Arctic to Antarctica every year? This journey covers tens of thousands of miles. It experiences two summers each year.","The Arctic tern migrates from the Arctic to Antarctica annually."
animals,"Which mammal is famous for using tools to open shells? It often floats on its back while eating. It also has extremely dense fur.","The sea otter uses tools and has dense fur."
animals,"Which reptile has a detachable jaw to swallow large prey? This allows it to eat animals much larger than its head. It is a feared predator worldwide.","The snake can unhinge its jaw to swallow prey."
animals,"Which mammal has the largest brain of any species? Its intelligence includes problem-solving and communication. It also makes deep ocean dives.","The sperm whale has the largest brain."
animals,"Which bird is known for its excellent memory in storing seeds? It hides thousands of seeds for winter. Many are never retrieved and grow into trees.","The jay has excellent memory for seed storage."
animals,"Which mammal can hold its breath the longest underwater? It can dive for over two hours. This ability helps it hunt in deep waters.","The Cuvier’s beaked whale can hold its breath for over two hours."
animals,"Which reptile is known for living both on land and in water? It has webbed feet and a strong shell. It is an ancient group with many species worldwide.","The turtle can live in water and on land."
animals,"Which bird is the largest living species today? It cannot fly but runs swiftly on land. Its eggs are the largest of any bird.","The ostrich is the largest living bird."
animals,"Which mammal is known for its distinctive black and white stripes? These patterns confuse predators. Each individual has a unique stripe pattern.","The zebra is known for its black and white stripes."
animals,"Which insect is known for its role in spreading the plague historically? It transmits disease through its bite. It once caused massive human deaths.","The flea spread the plague in history."
animals,"Which mammal has the ability to live in extremely cold climates? Its thick fur and blubber keep it warm. It is a skilled hunter of seals.","The polar bear thrives in Arctic climates."
animals,"Which fish is known for its sharp teeth and aggressive hunting style? It hunts in packs. Its reputation often makes people fearful.","The piranha is known for its sharp teeth and hunting in groups."
animals,"Which mammal is recognized for its striped coat and powerful roar? It is one of the largest predators on Earth. It is also endangered in the wild.","The tiger is known for its stripes and roar."
animals,"Which bird is known for pounding its chest and loud calls in the jungle? It is one of the most powerful primates. It can be heard from miles away.","The gorilla pounds its chest and calls loudly in the jungle."
animals,"Which mammal is famous for being the tallest animal on Earth? It uses its long neck to eat leaves high in trees. Its legs are also extremely long.","The giraffe is the tallest animal in the world."
animals,"Which reptile can glide from tree to tree using flaps of skin? It spreads its ribs to create wings. This allows it to travel long distances without touching the ground.","The flying dragon lizard glides between trees."
animals,"Which mammal is famous for eating bamboo almost exclusively? It can consume up to 40 pounds a day. It spends most of its time eating or resting.","The giant panda eats mainly bamboo."
animals,"Which bird is known for running fast across deserts? It is smaller than many birds of prey. Its speed helps it escape predators.","The roadrunner is known for its speed in deserts."
animals,"Which insect is known for carrying leaves back to its colony? It cuts and transports them with precision. These leaves are used to grow fungus as food.","The leafcutter ant carries leaves to grow fungus."
animals,"Which mammal is often called the sea cow? It grazes on underwater plants. It is gentle and slow-moving.","The manatee is often called the sea cow."
animals,"Which reptile is the longest living animal species today? Some individuals are more than 180 years old. They inhabit remote islands.","The Aldabra giant tortoise is among the longest-living animals."
animals,"Which bird is famous for its long curved beak? It uses it to probe flowers for nectar. Its rapid wingbeats allow it to hover in place.","The hummingbird has a long curved beak and hovers at flowers."
animals,"Which mammal is known for its loud trumpeting calls? It uses sound to communicate across long distances. It also shows strong social bonds.","The elephant is known for its trumpeting calls and social nature."
animals,"Which fish is known for being able to live both in saltwater and freshwater? It travels great distances to spawn. It is an important food source.","The salmon can live in both salt and freshwater."
animals,"Why are elephants known for their intelligence? How do they use memory in the wild, and what social behaviors show their intelligence? Why do scientists compare them to humans?","Elephants remember water sources and migration routes for years, which helps them survive droughts. They show intelligence by comforting herd members and cooperating in groups. Scientists compare them to humans because they display empathy, problem-solving, and long-term memory."
animals,"What makes octopuses some of the smartest invertebrates? How do they escape danger, and what tricks do they use for survival? Why do divers find them fascinating?","Octopuses can open jars, solve mazes, and even use tools. They escape danger by changing colors and releasing ink to confuse predators. Divers find them fascinating because of their camouflage skills and curious behavior."
animals,"Why are wolves considered ecosystem engineers? How do their hunts affect prey populations, and how does this shape landscapes? What example shows this effect?","Wolves reduce overpopulated deer and elk, preventing overgrazing. Their presence allows plants and rivers to recover, reshaping ecosystems. Yellowstone National Park is a famous example where wolf reintroduction restored balance."
animals,"What makes whales vital to ocean ecosystems? How does their behavior help plankton growth, and why does this matter for climate? How do humans benefit?","Whales spread nutrients through their waste when they surface and dive. This process boosts plankton growth, which absorbs carbon dioxide. Humans benefit because healthy oceans help regulate global climate."
animals,"Why are gorillas called gentle giants? How do they interact within troops, and how do silverbacks lead them? What happens when danger approaches?","Gorillas are peaceful herbivores that use gestures and sounds to communicate. Silverbacks lead groups by protecting, guiding, and keeping order. When danger approaches, the silverback defends the troop with strength and courage."
animals,"What makes dolphins symbols of intelligence? How do they communicate, and why do researchers study them? How do they interact with humans?","Dolphins communicate using whistles, clicks, and body language. Researchers study them to learn about problem-solving and social behavior. They often interact with humans by swimming alongside boats and playing in waves."
animals,"Why are honeybees crucial for human food supply? How do they pollinate, and what percentage of crops depend on them? What risks threaten their survival?","Honeybees transfer pollen between flowers, helping plants reproduce. About 75% of global food crops rely on pollinators like bees. Risks such as pesticides, habitat loss, and disease threaten their survival."
