type,question,oracle_response
animals,"Why are sloths so slow? How does their lifestyle help them survive?","Sloths move slowly to conserve energy and avoid detection by predators. Their slow lifestyle helps them blend into trees."
animals,"What makes eagles powerful birds? How sharp is their vision?","Eagles are powerful because of their strong wings and talons. Their eyesight is about four times sharper than human vision."
animals,"Why are sea turtles endangered? What threats do they face?","Sea turtles are endangered because of habitat loss and poaching. They also face threats from plastic pollution and fishing nets."
animals,"What makes bats unique mammals? How do they help ecosystems?","Bats are unique because they are the only mammals capable of true flight. They help by pollinating plants and controlling insect populations."
animals,"Why are rhinoceroses hunted? What makes them vulnerable?","Rhinoceroses are hunted for their horns, which are wrongly believed to have medicinal value. Their slow reproduction rates make them especially vulnerable."
animals,"What makes horses important to human history? How have they helped civilizations?","Horses have been crucial for transport, farming, and warfare. They helped shape civilizations by enabling trade and travel."
animals,"Why are sharks feared predators? How many teeth can they have?","Sharks are feared because of their sharp teeth and hunting skills. Some species can have up to 3,000 teeth in multiple rows."
animals,"What makes ants successful insects? How do they live in colonies?","Ants are successful because of teamwork and adaptability. They live in colonies with roles like workers, soldiers, and queens."
animals,"Why are zebras covered in stripes? How do stripes help them survive?","Zebra stripes confuse predators and may also repel insects. This camouflage helps them survive in the wild."
animals,"What makes chimpanzees similar to humans? How much DNA do we share?","Chimpanzees are close relatives to humans with complex social behaviors. We share about 98–99% of our DNA with them."
animals,"Why are hippos dangerous animals? How do they spend their days?","Hippos are dangerous due to their size, strength, and aggression. They spend most of their days in water to stay cool."
animals,"What makes parrots special birds? How do they mimic sounds?","Parrots are known for their bright feathers and intelligence. They mimic sounds by controlling their vocal organs with precision."
animals,"Why are crocodiles ancient reptiles? How long have they existed?","Crocodiles have barely changed for millions of years. They have existed since the time of the dinosaurs."
animals,"What makes camels desert survivors? How do they store water?","Camels can survive long without water by storing fat in their humps. This fat can be converted into energy and hydration."
animals,"Why are polar bears strong swimmers? How do they hunt in icy waters?","Polar bears have powerful limbs and thick fur. They hunt seals by waiting near breathing holes in the ice."
animals,"What makes peacocks so beautiful? Why do males have long feathers?","Peacocks have bright, iridescent feathers that attract attention. Males display their long tails to impress females during mating season."
animals,"Why are gorillas gentle giants? How do they live in groups?","Gorillas are large but mostly peaceful herbivores. They live in groups called troops led by a dominant silverback male."
animals,"What makes hummingbirds unique? How fast can they flap their wings?","Hummingbirds are tiny birds that can hover in mid-air. Their wings can flap up to 80 times per second."
animals,"Why are leopards skilled hunters? How do they protect their prey?","Leopards are stealthy predators that stalk quietly before attacking. They often drag prey into trees to keep it safe from scavengers."
animals,"What makes manatees gentle creatures? Where do they live?","Manatees are peaceful, slow-moving sea mammals. They live in warm coastal waters, rivers, and springs."
animals,"Why are kangaroo joeys carried in pouches? How long do they stay there?","Joeys are carried in pouches for protection and feeding. They stay there for about six to eight months."
animals,"What makes bees able to produce honey? How do they store it?","Bees collect nectar from flowers and transform it into honey. They store it in honeycombs to feed their colony."
animals,"Why are flamingos pink? What gives them their color?","Flamingos are pink because of the food they eat. Their diet of shrimp and algae contains pigments that color their feathers."
animals,"What makes wolves communicate effectively? How do they use howls?","Wolves howl to communicate with their pack across long distances. They also use body language and scent marking."
animals,"Why are dolphins playful animals? How do they interact with humans?","Dolphins are playful because they enjoy social behavior. They often ride waves and interact with boats and swimmers."
animals,"What makes koalas tree dwellers? What do they eat?","Koalas spend most of their lives in eucalyptus trees. Their diet consists almost entirely of eucalyptus leaves."
animals,"Why are crocodiles ambush hunters? How do they catch prey?","Crocodiles hide in water and wait for prey to approach. They strike quickly with powerful jaws to capture their food."
animals,"What makes owls nocturnal hunters? How do their eyes help them?","Owls are active at night and rely on vision. Their large eyes allow them to see well in low light."
animals,"Why are sloths covered in algae? How does this help them?","Sloths’ fur grows algae because of humidity. This provides camouflage and helps them blend with trees."
animals,"What makes penguins skilled swimmers? How do they move underwater?","Penguins use their wings like flippers to swim. They can dive and glide swiftly to catch fish."
animals,"Why are elephants social animals? How do they show care?","Elephants live in herds led by females. They show care by protecting calves and comforting each other."
animals,"What makes cheetahs different from leopards? How can you tell them apart?","Cheetahs have slender bodies and black tear marks on their faces. Leopards are stockier with rosette-shaped spots."
animals,"Why are whales important to oceans? How do they affect ecosystems?","Whales contribute nutrients through their waste, supporting plankton. This process helps regulate marine ecosystems and carbon cycles."
animals,"What makes frogs unique amphibians? How do they live in two worlds?","Frogs can live both in water and on land. They start as tadpoles in water and later grow into adults that breathe air."
animals,"Why are ants strong compared to their size? How much can they carry?","Ants are incredibly strong for their body size. Some can carry objects up to 50 times their weight."
animals,"Why are cheetah populations declining? What threats do they face?","Cheetahs are declining due to habitat loss and poaching. They also face threats from human conflict and declining prey."
animals,"What makes parrots long-lived birds? How long can some species survive?","Parrots live long lives due to their strong health and diet. Some species can live up to 80 years in captivity."
animals,"Why are wolves symbols of teamwork? How do they hunt?","Wolves work together in packs to hunt larger prey. Their teamwork allows them to take down animals much bigger than themselves."
animals,"What makes whales communicate across long distances? How do they use sound?","Whales use low-frequency sounds that travel far underwater. These sounds help them communicate and navigate the oceans."
animals,"Why are pandas slow breeders? What challenges does this cause?","Pandas have short breeding windows and give birth to very few cubs. This makes it difficult for populations to recover."
animals,"What makes eagles symbols of strength? How do they hunt?","Eagles are strong birds of prey with sharp talons. They swoop down quickly to catch fish or small animals."
animals,"Why are sharks important for oceans? How do they maintain balance?","Sharks control populations of smaller fish. This balance keeps marine ecosystems healthy."
animals,"What makes dolphins social animals? How do they live together?","Dolphins live in groups called pods. They work together to hunt and protect each other."
animals,"Why are rhinos called megafauna? How much do they weigh?","Rhinos are massive land mammals with thick skin. Some species can weigh over 5,000 pounds."
animals,"What makes ants farmers of the insect world? How do they grow food?","Some ant species farm fungi underground. They carefully grow and harvest it as their main food source."
animals,"Why are giraffes’ tongues so long? How do they use them?","Giraffes have tongues up to 20 inches long. They use them to grab leaves from tall trees."
animals,"What makes wolves loyal to their packs? How do they show it?","Wolves stay with their packs for life. They show loyalty by protecting and sharing food with each other."
animals,"Why are flamingos social birds? How do they live together?","Flamingos live in large colonies for safety. Their group lifestyle helps them find food and protect against predators."
animals,"What makes polar bears dependent on sea ice? How do they hunt there?","Polar bears use sea ice as platforms to hunt seals. Without ice, it is harder for them to find food."
animals,"Why are kangaroos native only to Australia? What makes them unique there?","Kangaroos evolved in Australia’s landscapes. They are unique because no other continent has such large hopping mammals."
animals,"What makes honeybees able to dance? How do they use it?","Honeybees perform a waggle dance to share food locations. This helps the hive find nectar efficiently."
animals,"Why are crocodiles called living fossils? How old is their lineage?","Crocodiles have changed little over millions of years. Their lineage dates back to the time of dinosaurs."
animals,"What makes owls rotate their heads so far? How far can they turn?","Owls have flexible necks with extra vertebrae. They can rotate their heads up to 270 degrees."
animals,"Why are elephants known for memory? How does it help them?","Elephants remember places and individuals for many years. This helps them find water and recognize threats."
animals,"What makes penguins loyal partners? How do they raise chicks?","Many penguin species mate for life with one partner. Both parents take turns caring for the eggs and chicks."
animals,"Why are lions the only social big cats? How do prides work?","Lions live in prides led by females. They hunt together and protect their cubs as a group."
animals,"What makes snakes shed their skin? How often do they do it?","Snakes shed skin to grow and remove parasites. Young snakes shed more often than older ones."
animals,"Why are gorillas endangered? What threats do they face?","Gorillas are endangered due to poaching and deforestation. Diseases also threaten their survival."
animals,"What makes sloths excellent swimmers? How do they move in water?","Sloths are surprisingly good swimmers. They move by paddling with their long arms."
animals,"Why are bats active at night? How do they find food?","Bats hunt at night to avoid predators. They use echolocation to find insects in the dark."
animals,"What makes whales migrate long distances? Why do they travel?","Whales migrate to breed in warm waters and feed in cold seas. These long journeys are vital for survival."
animals,"Why are zebras important to the savanna? How do they help ecosystems?","Zebras graze on grasses that grow quickly. This opens space for other animals to feed."
animals,"What makes eagles top predators? How do they protect nests?","Eagles guard their nests high in cliffs or trees. Their sharp talons and beaks scare away intruders."
animals,"Why are cheetahs built for speed? What adaptations help them?","Cheetahs have lightweight bodies and large lungs. These features allow them to sprint faster than any land animal."
animals,"What makes jellyfish ancient creatures? How long have they existed?","Jellyfish have existed for over 500 million years. They are among the oldest animals on Earth."
animals,"Why are parrots colorful? What purpose do their feathers serve?","Parrots’ bright feathers attract mates. Their colors also help them blend into tropical forests."
animals,"What makes wolves important in myths? How are they seen by humans?","Wolves appear in stories as symbols of strength and danger. Different cultures view them with fear or respect."
animals,"Why are penguins grouped by species? How do they differ?","There are about 18 species of penguins. They differ in size, color, and habitats."
animals,"What makes dolphins playful? How do they use play?","Dolphins play with seaweed, waves, and even other animals. Play helps them learn and bond with their pods."
animals,"Why are rhinos protective mothers? How do they raise calves?","Rhino mothers care for calves for years. They guard them fiercely from predators."
animals,"What makes elephants communicate through vibrations? How does it work?","Elephants use low-frequency sounds that travel through the ground. Other elephants sense these vibrations with their feet."
animals,"Why are lions powerful hunters? How do females contribute?","Lionesses do most of the hunting in prides. Their teamwork helps bring down large prey."
animals,"What makes frogs sensitive to pollution? How are they indicators?","Frogs have thin skin that absorbs toxins. Their health shows the quality of the environment."
animals,"Why are giraffes peaceful animals? How do they avoid fights?","Giraffes rarely fight unless necessary. They use their height to watch for predators instead."
animals,"What makes whales important for climate? How do they store carbon?","Whales absorb carbon in their bodies. When they die, this carbon sinks to the ocean floor."
animals,"Why are ants organized? How do colonies function?","Ant colonies work with clear roles for each member. This organization makes them efficient and resilient."
animals,"What makes wolves adaptable? Where can they live?","Wolves adapt to forests, tundras, and grasslands. They survive in many environments around the world."
animals,"Why are sea turtles long-distance travelers? Where do they go?","Sea turtles migrate thousands of miles to nest. They often return to the same beach where they hatched."
animals,"What makes gorillas strong? How powerful are they?","Gorillas are incredibly muscular primates. They can lift more than ten times their body weight."
animals,"Why are camels patient travelers? How far can they walk?","Camels can walk for days without water. Their endurance makes them perfect for deserts."
animals,"What makes hummingbirds fast feeders? How do they drink nectar?","Hummingbirds use long beaks and tongues to sip nectar. They feed quickly while hovering near flowers."
animals,"Why are crocodiles excellent hunters? How do they ambush prey?","Crocodiles wait silently in water for prey to approach. They strike with powerful jaws in an instant."
animals,"What makes wolves symbols of wilderness? How do they shape nature?","Wolves regulate prey populations in the wild. This makes them symbols of untamed ecosystems."
animals,"Why are leopards solitary? How do they live alone?","Leopards prefer to hunt and roam alone. They mark territories to avoid other leopards."
animals,"What makes elephants use trunks? How many functions do trunks have?","Elephant trunks are used for drinking, eating, and smelling. They also serve as tools and weapons."
animals,"Why are flamingos graceful? How do they feed?","Flamingos filter food from water with their beaks. Their long legs let them wade gracefully in shallow lakes."
animals,"What makes bees tireless workers? How do they keep hives alive?","Bees gather nectar and pollen all day. Their work keeps the hive strong and productive."
animals,"Why are dolphins known for teamwork? How do they hunt together?","Dolphins circle schools of fish to trap them. They share food after the hunt."
animals,"What makes rhinos solitary animals? How do they interact?","Rhinos prefer to live alone except during mating. They use scent to mark territories and communicate."
animals,"Why are gorillas gentle leaders? How do silverbacks guide?","Silverback males lead by protecting and guiding the troop. They rarely fight unless threatened."
animals,"What makes whales giants of the sea? How large are they?","Whales are the biggest animals alive today. Blue whales can reach lengths over 100 feet."
animals,"Why are sloths tree dwellers? How do they survive in treetops?","Sloths live in trees for food and safety. Their claws help them hang from branches."
animals,"What makes eagles patient hunters? How do they catch fish?","Eagles wait and watch from high perches. They swoop down quickly to grab fish with their talons."
animals,"Why are penguins expert divers? How deep can they go?","Penguins dive to hunt for fish and krill. Some species can dive over 500 meters deep."
animals,"What makes wolves vocal animals? How do they use howling?","Wolves howl to communicate over long distances. It helps keep their packs together."
animals,"Why are giraffes vulnerable to predators? How do they defend themselves?","Giraffes are targets for lions and hyenas. They defend themselves with powerful kicks."
animals,"What makes dolphins acrobatic? Why do they leap?","Dolphins leap to communicate and play. Sometimes they leap to scan the water or remove parasites."
animals,"Why are tigers solitary hunters? How do they stalk prey?","Tigers hunt alone to avoid competition. They stalk quietly before launching a surprise attack."
animals,"What makes whales graceful swimmers? How do they move?","Whales move with strong tail flukes. Their streamlined bodies let them glide smoothly through water."
animals,"Why are ants global survivors? How many species exist?","Ants live almost everywhere on Earth. Scientists have identified over 12,000 species."
animals,"What makes frogs good jumpers? How far can they leap?","Frogs have strong back legs for leaping. Some can jump more than 20 times their body length."
animals,"Why are gorillas intelligent? How do they use tools?","Gorillas can learn and use simple tools. They sometimes use sticks to test water depth."
animals,"What makes rhinos armored? How does their skin help?","Rhinos have thick, protective skin. It shields them from bites and injuries."
animals,"Why are elephants emotional animals? How do they mourn?","Elephants show grief when herd members die. They may touch bones and stay near the body."
animals,"What makes cheetahs vulnerable? Why do they lose food?","Cheetahs are fast but not very strong. Larger predators often steal their kills."
animals,"Why are parrots talkative? How do they mimic?","Parrots imitate sounds from their environment. They mimic human speech with their vocal organs."
animals,"What makes whales migrate yearly? What seasons guide them?","Whales move with the seasons for food and breeding. They travel thousands of miles between regions."
animals,"Why are wolves hunters of teamwork? How do they plan?","Wolves work together to chase and trap prey. Their strategy increases their hunting success."
animals,"What makes penguins resilient? How do they survive cold?","Penguins huddle together for warmth. Their thick feathers protect them from freezing waters."
animals,"Why are camels adapted to deserts? How do they cope?","Camels store fat in humps for energy. They also conserve water efficiently."
animals,"What makes flamingos filter feeders? How do they eat?","Flamingos strain food through their beaks. They eat shrimp, algae, and other small organisms."
animals,"Why are gorillas shy despite size? How do they react?","Gorillas usually avoid conflict with humans. They prefer calm environments and peaceful lives."
animals,"What makes bees vital to food supply? How much do they pollinate?","Bees pollinate around 75% of food crops. Without them, food systems would collapse."
animals,"Why are tigers striped? How do stripes help?","Tigers’ stripes camouflage them in forests. This helps them stalk prey unnoticed."
animals,"What makes sloths algae-covered? How does it help?","Sloths’ fur hosts algae for camouflage. It makes them blend into green trees."
animals,"Why are dolphins playful hunters? How do they train calves?","Dolphins teach young to hunt by playing. This prepares calves for survival."
animals,"What makes elephants matriarchal? Who leads herds?","Elephant herds are led by older females. Matriarchs guide families to food and water."
animals,"Why are wolves endurance hunters? How long do they chase?","Wolves chase prey for miles until it tires. Their stamina makes them effective hunters."
animals,"What makes whales essential for oceans? How do they cycle nutrients?","Whales spread nutrients when they surface and dive. This supports plankton growth and ocean health."
animals,"Why are rhinos territorial? How do they mark land?","Rhinos mark territories with dung and urine. This warns others to stay away."
animals,"What makes parrots intelligent? How do they solve problems?","Parrots can solve puzzles and learn tasks. Their brains are advanced among birds."
animals,"Why are giraffes spotted? How do patterns help?","Each giraffe’s spots are unique. They provide camouflage in woodlands."
animals,"What makes lions roar? How far can it travel?","Lions roar to mark territory and warn rivals. Their roar can be heard up to five miles away."
animals,"Why are ants successful builders? How do they make nests?","Ants dig tunnels and chambers underground. These nests house large colonies efficiently."
animals,"Which animal is known as the fastest on land? It can sprint across the savanna in short bursts. Its speed allows it to catch prey with incredible efficiency.","The cheetah is the fastest land animal, reaching up to 70 mph."
animals,"Which mammal is the only one capable of true flight? It hunts insects at night with remarkable agility. It also uses echolocation to navigate in the dark.","The bat is the only mammal capable of true flight."
animals,"What is the largest animal ever known to live on Earth? It inhabits the oceans and feeds primarily on tiny shrimp-like creatures. Its size surpasses even the largest dinosaurs.","The blue whale is the largest animal ever known."
animals,"Which bird is famous for mimicking human voices? It can also copy sounds from its surroundings. This ability makes it popular as a pet.","The parrot is famous for mimicking human voices and sounds."
animals,"Which animal is called the ship of the desert? It can survive for long periods without water. Its hump stores fat that provides energy.","The camel is known as the ship of the desert."
animals,"Which mammal is known for spending nearly its entire life upside down? It moves slowly through the trees in Central and South America. It even sleeps while hanging from branches.","The sloth spends nearly all of its life upside down."
animals,"Which reptile is considered a living fossil? It has changed very little over millions of years. Its closest relatives have long gone extinct.","The tuatara of New Zealand is considered a living fossil."
animals,"What animal uses its long sticky tongue to catch insects? It can blend into its surroundings by changing color. Its eyes can move independently of each other.","The chameleon uses its long tongue and camouflage skills to hunt insects."
animals,"Which mammal is known for its trunk, a versatile organ used for many tasks? It uses it to drink, grab food, and communicate. It is also one of the most intelligent land animals.","The elephant is famous for its trunk and intelligence."
animals,"Which sea animal has three hearts and blue blood? It is also a master of disguise. Its intelligence rivals that of many mammals.","The octopus has three hearts, blue blood, and remarkable intelligence."
animals,"Which mammal has the longest gestation period? The pregnancy can last nearly two years. This ensures the baby is large and strong at birth.","The African elephant has the longest gestation period at about 22 months."
animals,"Which fish is known for its deadly toxin? When threatened, it inflates its body. Its poison can be lethal to humans.","The pufferfish can inflate its body and has a deadly toxin."
animals,"Which bird is the fastest in a dive? It can reach speeds faster than a car on the highway. It hunts other birds midair with precision.","The peregrine falcon is the fastest diving bird."
animals,"Which animal is famous for laughing-like calls? These sounds can be heard across the African savanna. They are actually signals to members of their group.","The hyena is famous for its laughing-like calls."
animals,"Which mammal has fingerprints almost identical to humans? They are so similar they can confuse forensic experts. This makes them unique among animals.","Koalas have fingerprints nearly identical to humans."
animals,"Which sea animal is known for its stinging tentacles? They float through the oceans like umbrellas. Some species can be deadly to humans.","The jellyfish uses its stinging tentacles to catch prey and defend itself."
animals,"Which reptile has existed since the time of the dinosaurs? It is one of the most dangerous predators in rivers. Its powerful jaws can snap shut with immense force.","The crocodile has existed since dinosaur times and is a powerful predator."
animals,"Which animal can regrow lost arms or legs? If one limb is cut off, a new one eventually grows back. This makes it one of the most resilient creatures.","The starfish can regrow its lost arms."
animals,"Which bird is the national symbol of the United States? It is admired for its strength and beauty. It is also a powerful predator.","The bald eagle is the national bird of the United States."
