type,question,oracle_response
law,What is Regulation FD?,"Regulation Fair Disclosure requires public companies to disclose material information to all investors simultaneously rather than selectively disclosing it to certain analysts or investors first."
law,What is a prospectus in securities law?,"A prospectus is a formal legal document required by the SEC that describes a securities offering to prospective investors, including financial statements and risk factors."
law,What is an initial public offering?,"An IPO is the first sale of a company's stock to the public. The company registers the offering with the SEC and must comply with ongoing disclosure requirements as a public company."
law,What is a short sale in securities regulation?,"A short sale is the sale of a borrowed security with the expectation that its price will fall, allowing the seller to repurchase it at a lower price. Abusive short selling is regulated by the SEC."
law,What is market manipulation?,"Market manipulation involves artificially inflating or deflating the price of a security through deceptive trading practices, false statements, or coordinated activity."
law,What is the Sherman Antitrust Act?,"The Sherman Act prohibits contracts, combinations, or conspiracies in restraint of trade and prohibits monopolization or attempts to monopolize commerce."
law,What is price fixing?,"Price fixing is an agreement between competitors to set, raise, lower, or stabilize prices. It is a per se violation of antitrust law regardless of the price set."
law,What is market allocation?,"Market allocation is an agreement among competitors to divide markets by geography, customers, or products. Like price fixing it is a per se violation of antitrust law."
law,What is predatory pricing?,"Predatory pricing involves setting prices below cost to eliminate competition with the intent of raising prices once competitors are driven out of the market."
law,What is a consent decree in antitrust law?,"A consent decree is a settlement between a government antitrust agency and a defendant in which the defendant agrees to specific conduct or structural changes without admitting wrongdoing."
law,What is the Clayton Act?,"The Clayton Act supplements the Sherman Act by prohibiting mergers that substantially lessen competition, price discrimination, tying arrangements, and exclusive dealing contracts."
law,What is tying in antitrust law?,"Tying is the practice of conditioning the sale of one product on the purchase of another. It can violate antitrust law when the seller has market power in the tying product."
law,What is cartel behavior?,"A cartel is a group of independent market participants who coordinate to fix prices, restrict output, or divide markets. Cartel behavior is illegal under antitrust law in most jurisdictions."
law,What is the Federal Trade Commission?,"The FTC is an independent federal agency that enforces antitrust laws and consumer protection statutes, preventing unfair business practices and deceptive advertising."
law,What is net neutrality and its legal basis?,"Net neutrality requires internet service providers to treat all internet traffic equally. Its legal basis has been contested, with the FCC's authority debated in federal courts."
law,What is the Computer Fraud and Abuse Act?,"The CFAA is a federal statute criminalizing unauthorized access to computer systems, used to prosecute hacking, identity theft, and other cybercrime."
law,What is the Electronic Communications Privacy Act?,"The ECPA restricts government access to electronic communications and data, requiring warrants for stored emails and intercepting live communications."
law,What is the General Data Protection Regulation?,"The GDPR is a European Union regulation governing data privacy and protection, requiring organizations to protect personal data and uphold data subjects' rights."
law,What is the California Consumer Privacy Act?,"The CCPA gives California residents rights over their personal information, including the right to know what data is collected, to delete it, and to opt out of its sale."
law,What is cybersquatting?,"Cybersquatting is registering, trafficking in, or using a domain name with bad-faith intent to profit from another's trademark. It is addressed by the Anticybersquatting Consumer Protection Act."
law,What is digital millennium copyright act?,"The DMCA updates copyright law for the digital age, creating safe harbors for online service providers from copyright infringement liability if they promptly remove infringing content upon notice."
law,What is online defamation?,"Online defamation is the publication of false statements of fact on the internet that harm another's reputation. Section 230 of the Communications Decency Act generally shields platforms from liability for user content."
law,What is Section 230 of the Communications Decency Act?,"Section 230 provides that online platforms are not treated as publishers or speakers of third-party content, shielding them from liability for most user-generated content."
law,What is an amicus curiae brief?,"An amicus curiae (friend of the court) brief is filed by a non-party with an interest in the outcome of a case, providing additional legal arguments or factual information for the court's consideration."
law,What is legal formalism versus legal realism?,"Legal formalism holds that law is a closed logical system and judges apply rules mechanically. Legal realism argues that law is shaped by social context and judges are influenced by policy and extra-legal factors."
law,What is critical legal studies?,"Critical legal studies is a movement arguing that law is not neutral but reflects and reinforces existing power structures and social inequalities."
law,What is natural law theory?,"Natural law theory holds that there are universal moral principles inherent in nature that provide the basis for law, and that unjust laws lack moral authority."
law,What is legal positivism?,"Legal positivism holds that law is a set of rules enacted by proper authority regardless of moral content. Law's validity depends on its source, not its moral merit."
law,What is ADR (alternative dispute resolution)?,"ADR encompasses processes for resolving disputes outside of court, including negotiation, mediation, arbitration, and collaborative law, often faster and less expensive than litigation."
law,What is collaborative law?,"Collaborative law is a dispute resolution process in which parties and their attorneys commit to resolving disputes without litigation, using cooperative negotiation and problem-solving."
law,What is online dispute resolution?,"Online dispute resolution uses technology to facilitate the resolution of disputes without in-person proceedings, including virtual mediation and arbitration platforms."
law,What is a statute?,"A statute is a formal written law enacted by a legislative body such as Congress or a state legislature, distinct from regulations, common law, or constitutional provisions."
law,What is codification of law?,"Codification is the process of collecting and systematically organizing laws into a structured legal code, such as the US Code or state penal codes."
law,What is legislative history in statutory interpretation?,"Legislative history refers to materials such as committee reports, floor debates, and prior drafts that courts may examine to interpret ambiguous statutory language."
law,What is the plain meaning rule in statutory interpretation?,"The plain meaning rule directs courts to interpret statutory language according to its ordinary meaning without looking to external sources when the text is unambiguous."
law,What is a canon of statutory construction?,"Canons are principles or presumptions courts use to interpret statutes, such as giving effect to every word, resolving ambiguity against the drafter, and interpreting exceptions narrowly."
law,What is administrative law?,"Administrative law governs the activities of administrative agencies, including rulemaking, adjudication, and enforcement, and the judicial review of agency actions."
law,What is the Administrative Procedure Act?,"The APA establishes procedures for federal agency rulemaking and adjudication and the standards for judicial review of agency actions, requiring agencies to follow notice-and-comment procedures."
law,What is Chevron deference?,"Chevron deference required courts to defer to an agency's reasonable interpretation of ambiguous statutes it administers. The Supreme Court overruled this doctrine in Loper Bright Enterprises v. Raimondo in 2024."
law,What is a regulatory agency?,"A regulatory agency is a government body with authority to create and enforce rules in a specific area such as banking, environment, communications, or securities."
law,What is an administrative hearing?,"An administrative hearing is a formal proceeding before an administrative agency adjudicating a dispute, similar to a court trial but with somewhat less formal procedures."
law,What is judicial deference to agency interpretation?,"Judicial deference is when courts give weight to an agency's interpretation of laws it administers. After Loper Bright (2024), courts no longer automatically defer but exercise independent judgment."
law,What is a consent order in regulatory law?,"A consent order is a settlement agreement between a regulatory agency and a regulated entity resolving alleged violations without a formal hearing or admission of wrongdoing."
law,What is the right to privacy?,"The right to privacy is not explicitly in the Constitution but has been recognized by the Supreme Court through the due process clause, protecting decisions regarding personal autonomy and family life."
law,What is Roe v. Wade?,"Roe v. Wade (1973) established a constitutional right to abortion under the right to privacy. It was overruled by Dobbs v. Jackson Women's Health Organization in 2022, returning abortion regulation to states."
law,What is Obergefell v. Hodges?,"Obergefell v. Hodges (2015) is the Supreme Court decision holding that the Fourteenth Amendment requires states to license and recognize same-sex marriages."
law,What is Brown v. Board of Education?,"Brown v. Board of Education (1954) held that racial segregation in public schools violates the Equal Protection Clause of the Fourteenth Amendment, overruling Plessy v. Ferguson."
law,What is Marbury v. Madison?,"Marbury v. Madison (1803) established the principle of judicial review, holding that the Supreme Court has the authority to strike down laws that conflict with the Constitution."
law,What is Miranda v. Arizona?,"Miranda v. Arizona (1966) held that suspects must be informed of their rights before custodial interrogation, leading to the Miranda warning requirement."
law,What is Citizens United v. FEC?,"Citizens United v. FEC (2010) held that political spending by corporations and other organizations is a form of protected free speech under the First Amendment, striking down limits on independent political expenditures."
law,What is the full faith and credit clause?,"The Full Faith and Credit Clause requires each state to recognize and give effect to the public acts, records, and judicial proceedings of other states."
law,What is the privileges and immunities clause?,"The Privileges and Immunities Clause prohibits states from discriminating against citizens of other states in matters of fundamental importance such as practicing a profession or accessing courts."
law,What is the Dormant Commerce Clause?,"The Dormant Commerce Clause doctrine prevents states from passing laws that discriminate against or unduly burden interstate commerce, even without congressional action."
law,What is preemption in constitutional law?,"Preemption is the doctrine that federal law supersedes conflicting state law under the Supremacy Clause. Express preemption is stated in the statute; implied preemption arises from conflict or the comprehensiveness of federal regulation."
law,What is the necessary and proper clause?,"The Necessary and Proper Clause grants Congress the power to make all laws necessary and proper for executing its enumerated powers, providing broad flexibility in legislation."
law,What is incorporation doctrine?,"The incorporation doctrine holds that most Bill of Rights protections apply to state governments through the Fourteenth Amendment's Due Process Clause."
law,What is substantive due process?,"Substantive due process protects fundamental rights from government interference regardless of the procedures used, including privacy, family decisions, and other liberties deeply rooted in tradition."
law,What is procedural due process?,"Procedural due process requires the government to follow fair procedures before depriving a person of life, liberty, or property, typically including notice and a meaningful opportunity to be heard."
law,What is intermediate scrutiny in constitutional law?,"Intermediate scrutiny requires laws to be substantially related to an important government interest. It applies to sex-based classifications and some First Amendment cases."
law,What is strict scrutiny in constitutional law?,"Strict scrutiny is the most demanding constitutional standard, requiring laws to be narrowly tailored to serve a compelling government interest. It applies to race-based classifications and fundamental rights."
law,What is rational basis review?,"Rational basis review is the most deferential constitutional standard, requiring only that a law be rationally related to a legitimate government interest. Most economic and social legislation survives this test."
