type,question,oracle_response
law,What is the right of confrontation?,"The Sixth Amendment Confrontation Clause gives criminal defendants the right to cross-examine witnesses who testify against them. It restricts the use of out-of-court testimonial statements."
law,What is plea of nolo contendere?,"A nolo contendere (no contest) plea means the defendant does not contest the charges but does not admit guilt. It results in conviction but the plea generally cannot be used as an admission in civil proceedings."
law,What is expungement?,"Expungement is a court-ordered process sealing or destroying records of a criminal arrest or conviction, allowing the person to legally deny the incident in most contexts."
law,What is a consent decree?,"A consent decree is a court order reflecting an agreement between parties, often used to resolve civil rights lawsuits in which the government or institution agrees to specific reforms."
law,What is the Foreign Intelligence Surveillance Act?,"FISA establishes procedures for the surveillance of foreign powers and their agents within the United States for national security purposes, overseen by the FISA Court."
law,What is the Patriot Act?,"The USA PATRIOT Act expanded government surveillance powers after the 9/11 attacks, allowing broader monitoring of communications and financial transactions in terrorism investigations."
law,What is civil forfeiture?,"Civil forfeiture allows law enforcement to seize property believed to be connected to criminal activity, even without charging the owner with a crime. The owner must prove the property's innocence to reclaim it."
law,What are Miranda warnings required for?,"Miranda warnings are required before custodial interrogation — when a suspect is in custody (not free to leave) and being questioned by law enforcement about a crime."
law,What is the exclusion of juveniles from adult criminal penalties?,"Courts have held that certain harsh penalties such as the death penalty and mandatory life without parole cannot be applied to juvenile offenders based on Eighth Amendment and developmental considerations."
law,What is a consent search?,"A consent search occurs when a person voluntarily allows law enforcement to search their person or property without a warrant. The consent must be voluntary and not coerced."
law,What is the automobile exception to the warrant requirement?,"The automobile exception allows police to search a vehicle without a warrant if they have probable cause to believe it contains evidence of a crime, based on the vehicle's inherent mobility."
law,What is a Terry stop?,"A Terry stop is a brief investigative detention based on reasonable articulable suspicion that a person is involved in criminal activity, allowing police to briefly stop and pat down for weapons."
law,What is reasonable suspicion?,"Reasonable suspicion is a lower standard than probable cause, requiring specific articulable facts that lead an officer to reasonably suspect criminal activity is afoot."
law,What is the good faith exception to the exclusionary rule?,"The good faith exception allows evidence obtained through an unconstitutional search to be admitted if law enforcement reasonably relied on a facially valid warrant that later proved defective."
law,What is the plain view doctrine?,"The plain view doctrine allows law enforcement to seize evidence without a warrant if they are lawfully present at the location and the incriminating nature of the item is immediately apparent."
law,What is an arraignment versus a preliminary hearing?,"An arraignment formally charges a defendant and takes a plea. A preliminary hearing determines whether there is probable cause to hold the defendant for trial, typically in felony cases."
law,What rights do crime victims have?,"Crime victims' rights vary by jurisdiction but often include the right to be notified of proceedings, present a victim impact statement at sentencing, and receive restitution from the offender."
law,What is restitution in criminal law?,"Restitution is a court-ordered payment by a convicted defendant to compensate crime victims for their losses, such as medical expenses, property damage, or lost wages."
law,What is the statute of frauds?,"The statute of frauds requires certain contracts to be in writing to be enforceable, including contracts for real estate, goods over a specified value, and agreements that cannot be performed within one year."
law,What is an offer in contract law?,"An offer is a clear proposal to enter into a contract on specific terms, communicated to the offeree with the intention that it will become binding upon acceptance."
law,What is acceptance in contract law?,"Acceptance is an unambiguous agreement to all the terms of an offer. It must mirror the offer exactly (mirror image rule) and be communicated to the offeror to form a contract."
law,What is the mailbox rule in contracts?,"The mailbox rule provides that acceptance of an offer is effective when it is dispatched (mailed), not when received, as long as the offeree uses a reasonable means of communication."
law,What is promissory estoppel?,"Promissory estoppel prevents a party from going back on a promise when another party has reasonably relied on that promise to their detriment, even without formal consideration."
law,What is liquidated damages in contract law?,"Liquidated damages are a predetermined amount agreed upon in the contract to be paid in the event of breach. Courts enforce them if they are a reasonable estimate of actual damages."
law,What is the difference between express and implied terms in a contract?,"Express terms are explicitly stated in the contract. Implied terms are not stated but are incorporated by law, custom, or the obvious intent of the parties."
law,What is a conditions precedent in a contract?,"A condition precedent is an event that must occur before a party's contractual obligation becomes due. If the condition does not occur, the obligated party is not required to perform."
law,What is force majeure?,"Force majeure is a contract clause excusing a party from performance when extraordinary events beyond their control — such as natural disasters or war — prevent fulfillment of obligations."
law,What is the difference between assignment and delegation in contract law?,"Assignment transfers contractual rights to a third party. Delegation transfers contractual duties. Some contracts prohibit assignment or delegation without consent."
law,What is novation in contract law?,"Novation is the substitution of a new contract or party for an old one, extinguishing the original obligation. All parties must agree to the novation."
law,What is material breach versus minor breach of contract?,"A material breach goes to the heart of the contract, allowing the non-breaching party to treat the contract as terminated and sue for damages. A minor breach entitles the non-breaching party to damages but not termination."
law,What is anticipatory breach?,"Anticipatory breach occurs when a party clearly indicates before performance is due that they will not perform their contractual obligations, allowing the other party to treat the contract as breached immediately."
law,What is the duty to mitigate in contract law?,"The non-breaching party has a duty to take reasonable steps to reduce their losses after a breach. Failure to mitigate can reduce the damages they are entitled to recover."
law,What is equitable relief?,"Equitable relief refers to court remedies beyond monetary damages, including injunctions, specific performance, constructive trusts, and rescission. Courts grant it when monetary relief is inadequate."
law,What is a constructive trust?,"A constructive trust is an equitable remedy imposed by a court requiring a person who wrongfully holds property to transfer it to the rightful owner, preventing unjust enrichment."
law,What is the principle of proportionality in criminal sentencing?,"The proportionality principle requires that criminal sentences be proportionate to the severity of the offense. Grossly disproportionate sentences may violate the Eighth Amendment."
law,What is the difference between aggravated and simple assault?,"Simple assault is an intentional act creating reasonable apprehension of imminent harmful or offensive contact. Aggravated assault involves a weapon, serious injury, or other aggravating factors that elevate the severity."
law,What is battery in tort law?,"Battery is an intentional harmful or offensive touching of another person without their consent. Unlike assault which involves apprehension, battery requires actual physical contact."
law,What is false imprisonment?,"False imprisonment is the intentional confinement of a person without lawful authority and without their consent. It can occur without physical restraint through threats or barriers."
law,What is intentional infliction of emotional distress?,"Intentional infliction of emotional distress (IIED) occurs when a defendant engages in extreme and outrageous conduct intentionally or recklessly causing severe emotional distress to the plaintiff."
law,What is trespass to land?,"Trespass to land is the intentional physical invasion of another's land without permission. Even minimal interference can constitute trespass regardless of whether harm results."
law,What is nuisance in property law?,"A nuisance is an interference with the use and enjoyment of land. Private nuisance affects a specific person's property rights; public nuisance affects the general public."
law,What is comparative negligence?,"Comparative negligence apportions fault between the parties based on their relative degrees of negligence, reducing the plaintiff's damages proportionally to their share of fault."
law,What is contributory negligence?,"Under contributory negligence, a plaintiff who is even slightly at fault for their own injury may be completely barred from recovery. Most states have replaced this with comparative negligence."
law,What is assumption of risk?,"Assumption of risk is a defense in negligence claims arguing the plaintiff voluntarily encountered a known risk, which can bar or reduce recovery for resulting injuries."
law,What is res ipsa loquitur?,"Res ipsa loquitur (the thing speaks for itself) allows negligence to be inferred when an accident is of a type that ordinarily would not occur without negligence and the defendant had control."
law,What is a dram shop act?,"Dram shop acts impose liability on bars and liquor stores that serve alcohol to visibly intoxicated persons who then cause injury to third parties."
law,What is a Good Samaritan law?,"Good Samaritan laws protect people who provide emergency assistance from civil liability, encouraging bystanders to help without fear of being sued for unintentional harm."
law,What is medical malpractice?,"Medical malpractice occurs when a healthcare provider deviates from the standard of care in their profession and causes harm to a patient. Plaintiffs must typically prove the standard of care through expert testimony."
law,What is informed consent in healthcare law?,"Informed consent requires healthcare providers to disclose material risks, benefits, and alternatives of a proposed treatment before a patient agrees to it. Violation can give rise to malpractice claims."
law,What is HIPAA?,"The Health Insurance Portability and Accountability Act protects the privacy and security of patients' medical information, restricting when and how healthcare providers can share health data."
law,What is the Americans with Disabilities Act's public accommodation requirement?,"The ADA requires places of public accommodation such as restaurants, hotels, and theaters to make reasonable modifications and provide auxiliary aids for people with disabilities."
law,What is the Fair Housing Act?,"The Fair Housing Act prohibits discrimination in the sale, rental, and financing of housing based on race, color, national origin, religion, sex, familial status, and disability."
law,What is predatory lending?,"Predatory lending involves imposing unfair, deceptive, or abusive loan terms on borrowers, often targeting vulnerable populations with high fees and interest rates."
law,What is a class in family law?,A class in family law generally refers to the category of heirs who share proportionally in a decedent's estate under intestacy or trust terms when the named beneficiary predeceases the decedent.
law,What is legal capacity to contract?,"Legal capacity to contract requires a party to be of legal age (generally 18) and mentally competent. Contracts with minors or the mentally incapacitated may be voidable."
law,What is emancipation of a minor?,"Emancipation is a legal process by which a minor is granted legal independence from their parents before reaching the age of majority, allowing them to enter contracts and make decisions independently."
law,What is a guardian ad litem?,"A guardian ad litem is a person appointed by the court to represent the interests of a minor or incapacitated person in legal proceedings."
law,What is the difference between guardianship and conservatorship?,"Guardianship gives authority over a person's physical care and decisions. Conservatorship gives authority over a person's financial affairs. A person can be subject to both."
law,What is an annulment?,"An annulment is a legal declaration that a marriage is void or voidable as if it never legally existed, unlike divorce which ends a valid marriage."
law,What is the uniform commercial code?,"The UCC is a standardized set of laws governing commercial transactions in the US, including the sale of goods, secured transactions, and negotiable instruments, adopted in some form by all states."
law,What is a negotiable instrument?,"A negotiable instrument is a written document guaranteeing payment of a specific amount of money, transferable from one party to another. Examples include checks, promissory notes, and bills of exchange."
law,What is a promissory note?,"A promissory note is a written promise to pay a specific sum of money to a named party or bearer at a specified time. It is a common instrument in lending transactions."
law,What is a lien?,"A lien is a legal right or claim against a debtor's property as security for a debt or obligation. Common examples include mechanic's liens, tax liens, and mortgage liens."
law,What is a UCC financing statement?,"A UCC-1 financing statement is a document filed by a secured creditor to publicly notify others of their security interest in a debtor's personal property collateral."
law,What is priority in secured transactions?,"Priority determines which creditor has the superior claim to collateral when multiple creditors have security interests in the same property. Generally the first to perfect their interest has priority."
law,What is perfection of a security interest?,"Perfection is the legal process by which a creditor's security interest becomes enforceable against third parties, typically by filing a UCC financing statement or taking possession of collateral."
law,What is the rule against perpetuities?,"The rule against perpetuities voids property interests that might not vest within a life in being plus 21 years, preventing property from being tied up indefinitely by dead-hand control."
law,What is a fee simple in property law?,"A fee simple is the most complete form of property ownership, giving the owner full rights to use, sell, or transfer the property without any time limitation or conditions."
law,What is a life estate?,"A life estate is a property interest lasting only for the lifetime of the holder (life tenant). Upon death the property passes to a remainderman designated in the original conveyance."
law,What is a joint tenancy?,"Joint tenancy is a form of co-ownership with right of survivorship, meaning when one owner dies their share passes automatically to the surviving joint tenants outside of probate."
law,What is tenancy in common?,"Tenancy in common is a form of co-ownership where each owner holds a distinct share of the property that can be transferred independently. There is no right of survivorship."
law,What is community property?,"Community property is a marital property system where most assets and debts acquired during marriage are jointly owned by both spouses. It exists in nine US states."
law,What is a quitclaim deed?,"A quitclaim deed transfers whatever interest the grantor has in property to the grantee without warranty of title. It is often used between family members or to clear title defects."
law,What is title insurance?,"Title insurance protects property buyers and lenders against losses arising from disputes over property ownership, liens, or other title defects that existed before the purchase."
law,What is a recording act in property law?,"Recording acts determine priority when the same property is sold to multiple buyers. Race statutes prioritize whoever records first; notice statutes protect subsequent buyers without notice; race-notice requires both."
law,What is the implied warranty of habitability?,"The implied warranty of habitability requires landlords to maintain rental units in a livable condition with essential services such as heat, water, and structural soundness."
law,What is constructive eviction?,"Constructive eviction occurs when a landlord's failure to maintain habitable conditions forces a tenant to abandon the property. The tenant may be relieved of the obligation to pay rent."
law,What is a security deposit?,"A security deposit is money paid by a tenant at the start of a lease to cover potential unpaid rent or damages. Landlords must typically return it within a specified period with an itemized accounting of deductions."
law,What is the Americans with Disabilities Act's employment provisions?,"The ADA prohibits employers with 15 or more employees from discriminating against qualified individuals with disabilities and requires reasonable accommodations unless they cause undue hardship."
law,What is a hostile work environment?,"A hostile work environment is workplace harassment that is severe or pervasive enough to create an abusive working environment based on a protected characteristic such as race, sex, or religion."
law,What is retaliation in employment law?,"Retaliation is adverse employment action taken against an employee for engaging in protected activity such as filing a discrimination complaint, whistleblowing, or taking FMLA leave."
law,What is the Equal Pay Act?,"The Equal Pay Act prohibits paying different wages to men and women for substantially equal work performed under similar conditions in the same establishment."
law,What is the Age Discrimination in Employment Act?,"The ADEA prohibits employment discrimination against persons 40 years of age or older and applies to employers with 20 or more employees."
law,What is a hostile environment versus quid pro quo harassment?,"Quid pro quo harassment conditions employment benefits on submission to sexual advances. Hostile environment harassment involves pervasive unwelcome conduct that alters working conditions."
law,What is ERISA?,"The Employee Retirement Income Security Act regulates employer-sponsored retirement and health plans, setting minimum standards for plan management, funding, and participants' rights."
law,What is the National Labor Relations Act?,"The NLRA protects employees' rights to organize, form unions, bargain collectively, and engage in concerted activities for mutual aid and protection."
law,What is collective bargaining?,"Collective bargaining is the negotiation process between an employer and a union representing employees to establish wages, hours, and working conditions through a collective bargaining agreement."
law,What is an unfair labor practice?,"An unfair labor practice is an action by an employer or union that violates the NLRA, such as interfering with employees' organizing rights or refusing to bargain in good faith."
law,What is OSHA?,"The Occupational Safety and Health Administration sets and enforces workplace safety standards, requiring employers to provide a safe working environment free from recognized hazards."
law,What is whistleblower protection?,"Whistleblower protection laws protect employees from retaliation for reporting illegal activities, safety violations, or other misconduct by their employer to authorities."
law,What is the False Claims Act?,"The False Claims Act imposes liability on persons who defraud the government and allows private citizens (whistleblowers) to file suits on the government's behalf and share in any recovery."
law,What is qui tam?,"Qui tam is a provision allowing private individuals (relators) to file lawsuits on behalf of the government against parties that have defrauded it, with the relator receiving a portion of any recovery."
law,What is RICO?,"The Racketeer Influenced and Corrupt Organizations Act allows prosecution and civil suits against organizations involved in a pattern of racketeering activity such as fraud, bribery, or extortion."
law,What is wire fraud?,"Wire fraud is the use of electronic communications — telephone, email, or internet — to execute a scheme to defraud another of money or property."
law,What is mail fraud?,"Mail fraud involves using the postal system as part of a scheme to defraud another of money or property. It is a federal crime regardless of the amount involved."
law,What is a Ponzi scheme?,"A Ponzi scheme is a fraudulent investment operation in which returns paid to earlier investors are funded by money from new investors rather than legitimate business profits."
law,What is a pyramid scheme?,"A pyramid scheme is a fraudulent business model recruiting members who pay fees that are used to pay earlier participants rather than generating legitimate revenue."
law,What is the Dodd-Frank Act?,"The Dodd-Frank Wall Street Reform and Consumer Protection Act was enacted after the 2008 financial crisis to increase financial regulation, improve consumer protections, and reduce systemic risk."
law,What is the Consumer Financial Protection Bureau?,"The CFPB is a federal agency established by Dodd-Frank to protect consumers from unfair, deceptive, and abusive practices in financial products such as mortgages, credit cards, and student loans."
law,What is a usury law?,"Usury laws set maximum interest rates lenders may charge on loans. Charging interest above the legal limit is called usury and may result in the loan being voided or the lender being penalized."
law,What is the Truth in Lending Act?,"TILA requires lenders to disclose the terms and costs of credit, including the annual percentage rate and total cost of the loan, enabling consumers to compare credit offers."
law,What is the Fair Debt Collection Practices Act?,"The FDCPA prohibits abusive, deceptive, and unfair debt collection practices by third-party debt collectors, including harassment, false statements, and contacting debtors at inappropriate times."
law,What is legal standing for a corporation?,"Corporations have legal standing as separate legal entities and can sue and be sued in their own name, enter contracts, own property, and bear legal rights and responsibilities."
law,What is a merger in corporate law?,"A merger is a transaction in which two corporations combine, with one surviving and absorbing the other, resulting in the surviving corporation assuming all assets and liabilities."
law,What is an acquisition?,"An acquisition is the purchase of one company by another, which can be structured as a stock purchase or asset purchase. The acquirer gains control of the target company."
law,What is due diligence in mergers and acquisitions?,"Due diligence is the comprehensive investigation of a target company's financial, legal, and operational status conducted by the acquirer before completing a merger or acquisition."
law,What is a leveraged buyout?,"A leveraged buyout is the acquisition of a company using a significant amount of borrowed money, with the target company's assets often used as collateral for the loans."
law,What is a shareholder derivative suit?,"A shareholder derivative suit is brought by shareholders on behalf of the corporation to enforce claims the corporation has failed to pursue, typically against directors or officers for breach of duty."
law,What is the business judgment rule?,"The business judgment rule presumes that corporate directors act on an informed basis in good faith and in the best interests of the company, shielding them from liability for reasonable business decisions."
law,What is piercing the corporate veil?,"Piercing the corporate veil holds shareholders personally liable when the corporate form is used to perpetrate fraud or when corporate formalities are so disregarded that the entity is an alter ego of the shareholder."
law,What is a shareholder agreement?,"A shareholder agreement is a contract among a company's shareholders governing their rights and obligations, including voting arrangements, transfer restrictions, and dispute resolution."
law,What is a board of directors?,"A board of directors is the governing body of a corporation, elected by shareholders to oversee management, make major policy decisions, and act in the best interests of the corporation."
law,What is an independent director?,"An independent director has no material relationship with the company that could impair their judgment. They are important for audit, compensation, and nominating committees."
law,What is a proxy vote?,"A proxy vote allows a shareholder to authorize another person to vote their shares at a corporate meeting. Proxy solicitation is regulated by the SEC."
law,What is insider trading based on material nonpublic information?,"Insider trading involves trading securities based on material information that is not available to the public, violating the duty of confidentiality owed to the company or its shareholders."
