type,question,oracle_response
law,What is a void contract versus a voidable contract?,"A void contract has no legal effect from the beginning, such as one with illegal subject matter. A voidable contract is initially valid but may be voided by one party due to factors like fraud or duress."
law,What is fraudulent misrepresentation in contract law?,"Fraudulent misrepresentation occurs when a party makes a false statement of fact knowingly or recklessly to induce the other party to enter a contract, making the contract voidable."
law,What is duress in contract law?,"Duress is improper pressure or threats used to coerce someone into entering a contract. A contract formed under duress is generally voidable by the pressured party."
law,What is undue influence in contract law?,"Undue influence occurs when one party uses a position of power or trust to override another party's free will in entering a contract. It makes the contract voidable."
law,What is the parol evidence rule?,"The parol evidence rule limits the use of prior oral or written statements to contradict or modify the terms of a fully integrated written contract."
law,What is an implied contract?,"An implied contract is formed by the conduct of the parties rather than explicit words. The law implies the terms based on the circumstances and the parties' behavior."
law,What is a quasi-contract?,"A quasi-contract is not a true contract but a legal fiction imposed by courts to prevent unjust enrichment, requiring a party who benefited from another's services to pay for them."
law,What is unjust enrichment?,"Unjust enrichment occurs when one party benefits at another's expense without legal justification. Courts may impose a quasi-contract requiring restitution."
law,What is agency law?,"Agency law governs relationships in which one person (the agent) acts on behalf of and under the control of another (the principal), creating legal relationships with third parties."
law,What is apparent authority?,"Apparent authority arises when a principal's conduct leads a third party to reasonably believe an agent has authority to act, even if no actual authority was granted."
law,What is a fiduciary duty?,"A fiduciary duty is a legal obligation to act in another party's best interest. It applies to relationships of trust such as attorney-client, trustee-beneficiary, and corporate officer-shareholder."
law,What is a breach of fiduciary duty?,"A breach of fiduciary duty occurs when a person in a position of trust fails to act in the best interests of the party they represent, such as self-dealing or misappropriating funds."
law,What is corporate law?,"Corporate law governs the formation, operation, and dissolution of corporations, including issues of governance, shareholder rights, mergers, and regulatory compliance."
law,What is limited liability in corporations?,"Limited liability means shareholders of a corporation are generally not personally responsible for the company's debts or legal obligations beyond the amount they invested."
law,What is piercing the corporate veil?,"Piercing the corporate veil is a court action holding shareholders personally liable for corporate debts when the corporation has been used fraudulently or the corporate form has been abused."
law,What is a partnership?,"A partnership is a business arrangement between two or more individuals who share ownership, profits, losses, and liabilities. General partners have unlimited personal liability."
law,What is a limited liability company (LLC)?,"An LLC is a business structure combining the limited liability of a corporation with the tax benefits and flexibility of a partnership. Members are generally protected from personal liability."
law,What is securities law?,"Securities law regulates the issuance and trading of stocks, bonds, and other financial instruments to protect investors and ensure fair and transparent markets."
law,What is insider trading?,"Insider trading is the buying or selling of a publicly traded company's stock by someone with material, nonpublic information about the company. It is illegal under securities law."
law,What is the Securities and Exchange Commission?,"The SEC is the federal agency responsible for enforcing securities laws, regulating the securities industry, and protecting investors in the United States."
law,What is antitrust law?,"Antitrust law prohibits business practices that restrict competition, such as price fixing, monopolization, and mergers that significantly reduce competition in a market."
law,What is a monopoly in legal terms?,"A monopoly is when a single company dominates a market to the extent that it can control prices and exclude competition. Illegally obtaining or maintaining a monopoly violates antitrust law."
law,What is a non-disclosure agreement?,"An NDA is a contract in which parties agree to keep certain information confidential. It is commonly used in business relationships to protect trade secrets and proprietary information."
law,What is a trade secret?,"A trade secret is confidential business information that provides a competitive advantage and is protected from disclosure. Misappropriation of trade secrets can lead to civil and criminal liability."
law,What is bankruptcy?,"Bankruptcy is a legal process allowing individuals or businesses unable to repay debts to seek relief from some or all of their obligations under the supervision of a federal court."
law,What is Chapter 7 bankruptcy?,"Chapter 7 bankruptcy liquidates a debtor's non-exempt assets to pay creditors and discharges remaining eligible debts, giving the debtor a fresh financial start."
law,What is Chapter 13 bankruptcy?,"Chapter 13 bankruptcy allows individuals with regular income to keep their assets while repaying debts through a court-approved repayment plan over three to five years."
law,What is immigration law?,"Immigration law governs who may enter, reside in, work in, and become a citizen of a country. It covers visas, green cards, asylum, deportation, and naturalization."
law,What is asylum?,"Asylum is protection granted to individuals who have fled their home country due to persecution based on race, religion, nationality, political opinion, or membership in a particular social group."
law,What is naturalization?,"Naturalization is the legal process by which a non-citizen acquires citizenship of a country. In the US it typically requires permanent residence, good moral character, and passing civics and language tests."
law,What is deportation?,"Deportation is the formal removal of a foreign national from a country for violating immigration laws or other legal grounds. It is ordered by immigration courts."
law,What is the right to vote?,"The right to vote is protected by multiple constitutional amendments. The 15th prohibits denying it based on race, the 19th based on sex, and the 26th sets the voting age at 18."
law,What is the Voting Rights Act?,"The Voting Rights Act of 1965 prohibits discriminatory voting practices that had been used to disenfranchise Black voters, especially in Southern states."
law,What is gerrymandering?,"Gerrymandering is the manipulation of electoral district boundaries to favor a particular political party or group. Racial gerrymandering that dilutes minority voting power may violate the Voting Rights Act."
law,What is a civil rights violation?,"A civil rights violation occurs when a government or individual unlawfully deprives a person of rights guaranteed by law, such as equal protection, free speech, or due process."
law,What is Section 1983?,"Section 1983 of the Civil Rights Act allows individuals to sue state and local government officials who have violated their constitutional rights under color of state law."
law,What is qualified immunity?,"Qualified immunity shields government officials from civil liability unless they violated a clearly established statutory or constitutional right that a reasonable person would have known."
law,What is legal standing?,"Standing is the right to bring a legal claim. A plaintiff must have suffered an actual injury, the injury must be traceable to the defendant's conduct, and the court must be able to redress it."
law,What is the difference between an attorney and a lawyer?,"In the US the terms are used interchangeably. Technically a lawyer is anyone trained in law, while an attorney is a lawyer who is licensed to practice and represent clients in court."
law,What is attorney-client privilege?,"Attorney-client privilege protects confidential communications between a client and their lawyer from disclosure. It encourages clients to share all relevant information with their attorney."
law,What is legal malpractice?,"Legal malpractice occurs when an attorney's negligent or intentional misconduct causes harm to a client, such as missing deadlines, making errors, or failing to follow client instructions."
law,What is a conflict of interest in law?,"A conflict of interest arises when an attorney's representation of a client is materially limited by duties to another client, third party, or the attorney's own interests."
law,What is the Bar Association?,"A bar association is a professional organization for lawyers. State bar associations license and regulate attorneys, enforce ethics rules, and can discipline or disbar attorneys for misconduct."
law,What is disbarment?,"Disbarment is the most severe professional sanction for attorneys, revoking their license to practice law for serious misconduct such as fraud, theft, or egregious ethical violations."
law,What is restorative justice?,"Restorative justice is an approach to criminal justice that focuses on rehabilitating offenders through reconciliation with victims and the community rather than punishment alone."
law,What is the death penalty in the United States?,"The death penalty is legal in some US states and federally for the most serious crimes. The Supreme Court has placed constitutional limits on its application, prohibiting it for juveniles and the intellectually disabled."
law,What constitutional amendments have been used to challenge the death penalty?,"The Eighth Amendment's prohibition on cruel and unusual punishment and the Fourteenth Amendment's equal protection and due process clauses have been used to challenge the death penalty."
law,What is parole?,"Parole is the conditional release of a prisoner before their sentence is completed. The parolee must comply with specific conditions, and violation can result in return to prison."
law,What is probation?,"Probation is a court-ordered period of supervision in the community as an alternative or supplement to incarceration, requiring the offender to meet certain conditions."
law,What is the difference between jail and prison?,"Jail is a local facility for short-term detention of people awaiting trial or serving sentences under one year. Prison is a state or federal facility for those serving longer sentences."
law,What is money laundering?,"Money laundering is the process of making illegally obtained money appear legitimate by passing it through complex transactions to disguise its criminal origin."
law,What is fraud?,"Fraud is an intentional deception for personal gain that causes harm to another party. It includes misrepresentation of facts, concealment of information, or false promises."
law,What is the Foreign Corrupt Practices Act?,"The FCPA prohibits US companies and individuals from bribing foreign government officials to obtain or retain business and requires accurate record-keeping of company transactions."
law,What is international law?,"International law is a set of rules and agreements governing relations between sovereign states and other international actors, covering areas such as trade, human rights, and armed conflict."
law,What is a treaty?,"A treaty is a formal and binding written agreement between two or more sovereign states. In the US treaties are negotiated by the president and must be ratified by two-thirds of the Senate."
law,What is the Geneva Convention?,"The Geneva Conventions are international treaties establishing standards for humanitarian treatment during armed conflict, protecting wounded soldiers, prisoners of war, and civilians."
law,What is the rule of law?,"The rule of law is the principle that all individuals and institutions are accountable to laws that are publicly promulgated, equally enforced, and independently adjudicated."
law,What is common law?,"Common law is a body of law derived from judicial decisions and precedents rather than statutes. It originated in England and forms the basis of legal systems in the US and other former British colonies."
law,What is stare decisis?,"Stare decisis is the legal doctrine that courts should follow precedents established by prior decisions. It promotes consistency and predictability in the law."
law,What is statutory law?,"Statutory law consists of written laws enacted by legislative bodies, as distinguished from case law developed by courts. Statutes take precedence over conflicting common law."
law,What is regulatory law?,"Regulatory law consists of rules issued by executive agencies pursuant to authority delegated by legislatures. Administrative agencies like the EPA and FCC create regulations with the force of law."
law,What is constitutional law?,"Constitutional law interprets and applies the provisions of the US Constitution, governing the structure of government and protecting fundamental rights of individuals."
law,What is the Bill of Rights?,"The Bill of Rights is the first ten amendments to the US Constitution, ratified in 1791. They protect fundamental individual liberties including free speech, religion, right to bear arms, and due process."
law,What is the Second Amendment?,"The Second Amendment protects the right to keep and bear arms. The Supreme Court has held it protects an individual's right to possess firearms for traditionally lawful purposes such as self-defense."
law,What is the Eighth Amendment?,"The Eighth Amendment prohibits excessive bail, excessive fines, and cruel and unusual punishment. It has been used to challenge prison conditions and the death penalty."
law,What is legal ethics?,"Legal ethics are the professional standards governing attorneys' conduct, including duties of competence, confidentiality, loyalty, and candor to the court."
law,What is the duty of confidentiality for attorneys?,"Attorneys have a duty not to disclose information relating to the representation of a client without the client's informed consent, except in limited circumstances such as preventing serious harm."
law,What is a class of shares in corporate law?,"Different classes of shares can have different rights, such as voting rights, dividend preferences, or liquidation priorities. Common and preferred stock are the most typical classes."
law,What are shareholder rights?,"Shareholders have rights including voting on major corporate decisions, receiving dividends, inspecting corporate records, and suing for breach of fiduciary duty by directors."
law,What is a hostile takeover?,"A hostile takeover is an acquisition of a company opposed by its management and board of directors, typically accomplished by buying shares directly from shareholders or through a proxy fight."
law,What is the duty of care for corporate directors?,"Directors must act in good faith and with the care of a reasonably prudent person in making business decisions. The business judgment rule protects directors who make informed, rational decisions."
law,What is the duty of loyalty for corporate directors?,"Directors must act in the best interests of the corporation and its shareholders, avoiding conflicts of interest and not profiting at the corporation's expense."
law,What is a derivative lawsuit?,"A derivative lawsuit is filed by a shareholder on behalf of a corporation to enforce a legal right that the corporation has failed to assert, such as a breach of fiduciary duty by directors."
law,What is environmental law?,"Environmental law governs human interaction with the natural environment, regulating pollution, conservation, wildlife protection, and sustainable resource use."
law,What is the Clean Air Act?,"The Clean Air Act is federal legislation authorizing the EPA to regulate air pollutants and set national air quality standards to protect public health and the environment."
law,What is the Endangered Species Act?,"The Endangered Species Act provides for the conservation of species threatened with extinction and the habitats they depend on, prohibiting activities that harm listed species."
law,What is tort reform?,"Tort reform refers to changes in civil justice systems to reduce litigation or damages awarded, often by capping punitive damages or imposing stricter standards for filing lawsuits."
law,What is a legal brief?,"A legal brief is a written argument submitted to a court explaining a party's position, citing relevant laws and cases, and arguing why the court should rule in their favor."
law,What is precedent in law?,"Precedent is a prior court decision that serves as a guide for deciding future cases with similar facts and legal issues. Courts are generally bound to follow precedent under stare decisis."
law,What is the difference between civil and criminal court?,"Criminal courts handle cases brought by the government for violations of criminal law. Civil courts handle disputes between private parties seeking monetary or other remedies."
law,What is the role of a judge?,"A judge presides over court proceedings, ensures the law is followed, rules on motions and objections, instructs the jury, and in bench trials renders the verdict."
law,What is the role of a jury?,"A jury is a group of citizens who evaluate the facts presented at trial and render a verdict based on the evidence and the law as explained by the judge."
law,What is voir dire?,"Voir dire is the process of questioning prospective jurors to select an impartial jury, during which attorneys can challenge jurors for cause or use peremptory challenges."
law,What is a peremptory challenge?,"A peremptory challenge allows an attorney to dismiss a prospective juror without stating a reason, subject to the limitation that challenges may not be used to discriminate based on race or sex."
law,What is the difference between malice aforethought and heat of passion?,"Malice aforethought is the intent to kill or cause serious harm, required for murder. Heat of passion is a sudden emotional disturbance that can reduce murder to voluntary manslaughter."
law,What is the felony murder rule?,"The felony murder rule holds a person liable for murder if a death occurs during the commission of an inherently dangerous felony, even if the death was unintentional."
law,What is conspiracy in criminal law?,"Conspiracy is an agreement between two or more persons to commit a crime. Most jurisdictions also require at least one overt act in furtherance of the agreement."
law,What is attempt in criminal law?,"Criminal attempt is taking a substantial step toward committing a crime with the intent to complete it, even if the crime is not ultimately completed."
law,What is solicitation in criminal law?,"Solicitation is the act of requesting, encouraging, or inducing another person to commit a crime with the intent that the crime be committed."
law,What is aiding and abetting?,"Aiding and abetting is assisting or encouraging another person to commit a crime. Those who aid and abet are generally held as liable as the principal offender."
law,What is the difference between robbery and burglary?,"Robbery is taking property from a person using force or intimidation. Burglary is unlawfully entering a building with intent to commit a crime inside, typically theft."
law,What is extortion?,"Extortion is obtaining money or property from another through coercion, threats, or abuse of authority. It is distinct from robbery in that the threat is often future harm rather than immediate force."
law,What is embezzlement?,"Embezzlement is the fraudulent appropriation of property by a person entrusted with it, such as an employee stealing from their employer."
law,What is tax evasion?,"Tax evasion is the illegal non-payment or underpayment of taxes through deliberate misrepresentation of income or assets. It is distinguished from tax avoidance which is legal."
law,What is obstruction of justice?,"Obstruction of justice involves actions that impede, influence, or hinder the administration of justice, such as tampering with evidence, threatening witnesses, or lying to investigators."
law,What is bribery?,"Bribery is the offering, giving, receiving, or soliciting of something of value to influence the actions of an official in the discharge of public or legal duties."
law,What is the purpose of sentencing guidelines?,"Sentencing guidelines provide a framework for judges to impose consistent and proportional sentences based on the severity of the offense and the offender's criminal history."
law,What is mandatory minimum sentencing?,"Mandatory minimum sentencing laws require judges to impose a fixed minimum prison term for specific crimes, removing judicial discretion to impose lighter sentences."
law,What is the role of the Supreme Court?,"The Supreme Court is the highest court in the US, with final authority on constitutional interpretation. It hears appeals on significant legal questions and its decisions are binding on all lower courts."
law,What is original jurisdiction versus appellate jurisdiction?,"Original jurisdiction is the authority to hear a case for the first time. Appellate jurisdiction is the power to review decisions of lower courts. The Supreme Court has limited original but broad appellate jurisdiction."
law,What is a writ of certiorari?,"A writ of certiorari is an order issued by the Supreme Court to a lower court to send up the record of a case for review. The Court grants certiorari selectively based on significance of legal issues."
law,What is legal pluralism?,"Legal pluralism is the existence of multiple legal systems or norms within a single political territory, such as federal and state law, or the coexistence of formal law with customary or religious law."
law,What is the Vienna Convention on the Law of Treaties?,"The Vienna Convention codifies the rules governing treaties between states, including formation, validity, interpretation, termination, and the principle that treaties must be performed in good faith."
law,What is the International Court of Justice?,"The ICJ is the principal judicial organ of the United Nations, settling legal disputes between states and giving advisory opinions on legal questions referred to it by UN bodies."
law,What is extradition?,"Extradition is the formal process by which one country or state surrenders a person accused or convicted of a crime to another jurisdiction where the crime occurred."
law,What is diplomatic immunity?,"Diplomatic immunity is a principle of international law granting foreign diplomats protection from civil and criminal prosecution in the host country."
law,What is a legal remedy?,"A legal remedy is the means by which a court enforces a right or redresses a wrong, including money damages, injunctions, specific performance, and declaratory judgments."
law,What is declaratory judgment?,"A declaratory judgment is a court ruling that determines the legal rights of parties without ordering any specific action, commonly used to clarify rights before a dispute escalates."
law,What is res judicata?,"Res judicata (claim preclusion) is a doctrine preventing parties from relitigating claims that were already decided in a final judgment by a court of competent jurisdiction."
law,What is collateral estoppel?,"Collateral estoppel (issue preclusion) prevents a party from relitigating a specific factual or legal issue that was already decided in prior litigation."
law,What is the American rule for attorney's fees?,"Under the American rule each party pays their own attorney's fees regardless of outcome, unlike many other countries where the losing party pays. Exceptions exist by statute or contract."
law,What is legal aid?,"Legal aid provides free or low-cost legal services to individuals who cannot afford an attorney in civil matters such as housing, family law, and benefits disputes."
law,What is a pro se litigant?,"A pro se litigant is a person who represents themselves in court without an attorney. Courts often give some leniency to pro se litigants regarding procedural rules."
law,What is a motion in limine?,"A motion in limine is a pretrial motion asking the court to exclude certain evidence from being presented at trial, typically because it is irrelevant, prejudicial, or inadmissible."
law,What is hearsay in evidence law?,"Hearsay is an out-of-court statement offered to prove the truth of the matter asserted. It is generally inadmissible unless it falls within one of many recognized exceptions."
law,What is chain of custody in evidence?,"Chain of custody documents the continuous transfer of evidence from collection to court to ensure it has not been tampered with or contaminated, which is critical for admissibility."
law,What is expert testimony?,"Expert testimony is evidence given by a witness with specialized knowledge or expertise relevant to the case. Courts apply standards such as Daubert or Frye to assess admissibility."
law,What is circumstantial evidence?,"Circumstantial evidence is indirect evidence from which a fact may be inferred. It requires the trier of fact to draw an inference, as opposed to direct evidence witnessed firsthand."
law,What is the Daubert standard?,"The Daubert standard is used by federal courts to assess the admissibility of expert testimony, requiring the judge to determine whether the methodology is scientifically valid and reliably applied."
