type,question,oracle_response
law,What is the difference between civil law and criminal law?,"Civil law deals with disputes between private parties and remedies are typically monetary, while criminal law involves the state prosecuting individuals for offenses against society with penalties including fines or imprisonment."
law,What does 'beyond a reasonable doubt' mean in criminal trials?,"It is the highest standard of proof in law, requiring the jury to be firmly convinced of the defendant's guilt with no significant doubt remaining based on the evidence."
law,What is a contract?,A contract is a legally binding agreement between two or more parties that creates mutual obligations enforceable by law. It requires offer, acceptance, consideration, and mutual intent.
law,What are the elements required to form a valid contract?,"A valid contract requires an offer, acceptance of that offer, consideration (something of value exchanged), capacity of the parties to contract, and legality of the subject matter."
law,What is consideration in contract law?,"Consideration is something of value exchanged between parties to a contract, such as money, services, or a promise to act or refrain from acting. It distinguishes a contract from a gift."
law,What is the statute of limitations?,The statute of limitations is the time period within which a legal claim must be filed. After this period expires the claim is generally barred and cannot be pursued in court.
law,What is habeas corpus?,"Habeas corpus is a legal writ requiring a person in custody to be brought before a court to determine whether the detention is lawful. It is a fundamental protection against unlawful imprisonment."
law,What is due process of law?,"Due process requires the government to respect all legal rights owed to a person. It includes procedural due process (fair procedures) and substantive due process (protection of fundamental rights)."
law,What is the difference between a felony and a misdemeanor?,"A felony is a serious crime typically punishable by imprisonment of more than one year, while a misdemeanor is a less serious offense punishable by fines or imprisonment of up to one year."
law,What is tort law?,"Tort law covers civil wrongs that cause harm or loss to another person, allowing the injured party to seek compensation. Common torts include negligence, defamation, and trespass."
law,What is negligence in law?,"Negligence is a failure to exercise the standard of care that a reasonably prudent person would exercise in similar circumstances, resulting in harm to another person."
law,What are the elements of negligence?,"The four elements of negligence are: duty (the defendant owed a duty of care), breach (the duty was breached), causation (the breach caused the injury), and damages (actual harm resulted)."
law,What is strict liability?,"Strict liability holds a party responsible for damages caused by their actions or products regardless of fault or intent. It commonly applies to ultrahazardous activities and defective products."
law,What is the Fourth Amendment?,"The Fourth Amendment to the US Constitution protects citizens against unreasonable searches and seizures, generally requiring law enforcement to obtain a warrant based on probable cause."
law,What is probable cause?,"Probable cause is a reasonable basis to believe that a crime has been committed or that evidence of a crime will be found in a specific location. It is required for arrests and search warrants."
law,What is the exclusionary rule?,"The exclusionary rule prohibits the use of evidence obtained in violation of the Fourth Amendment in criminal proceedings. Evidence gathered through illegal searches is deemed inadmissible."
law,What is Miranda rights?,"Miranda rights are warnings police must give suspects before custodial interrogation, including the right to remain silent, that statements may be used against them, and the right to an attorney."
law,What is the Fifth Amendment?,"The Fifth Amendment protects against self-incrimination, double jeopardy, and taking of private property without just compensation. It also guarantees due process in federal proceedings."
law,What is double jeopardy?,"Double jeopardy prohibits a person from being tried twice for the same offense after acquittal or conviction. This protection is guaranteed by the Fifth Amendment."
law,What is the Sixth Amendment?,"The Sixth Amendment guarantees criminal defendants the right to a speedy and public trial by an impartial jury, the right to counsel, and the right to confront witnesses against them."
law,What is plea bargaining?,"Plea bargaining is a negotiation between the prosecutor and defendant where the defendant agrees to plead guilty to a lesser charge or receive a lighter sentence in exchange for avoiding trial."
law,What is an arraignment?,"An arraignment is a court proceeding in which a defendant is formally charged with a crime, informed of their rights, and asked to enter a plea of guilty, not guilty, or no contest."
law,What is bail?,"Bail is the temporary release of a defendant from custody before trial, usually requiring the payment of money as security to ensure the defendant will appear for court proceedings."
law,What is a grand jury?,"A grand jury is a group of citizens convened to review evidence presented by prosecutors and determine whether there is sufficient cause to formally charge a person with a crime."
law,What is an indictment?,"An indictment is a formal accusation issued by a grand jury charging a person with a crime. It is used in federal cases and some state felony cases."
law,What is the difference between murder and manslaughter?,"Murder involves the intentional killing of another person with malice aforethought, while manslaughter is an unlawful killing without premeditation, often involving heat of passion or negligence."
law,What is first-degree murder?,"First-degree murder is the intentional, premeditated killing of another person. It is the most serious homicide charge and typically carries the harshest penalties."
law,What is self-defense in criminal law?,"Self-defense is a legal justification for using force when a person reasonably believes they are in imminent danger of unlawful bodily harm. The force used must be proportionate to the threat."
law,What is the castle doctrine?,"The castle doctrine allows a person to use force, including deadly force, to protect themselves in their home without the duty to retreat when facing an intruder or attacker."
law,What is stand your ground law?,"Stand your ground laws allow a person to use force in self-defense in any place they are lawfully present without a duty to retreat when they reasonably believe they face imminent harm."
law,What is an affirmative defense?,"An affirmative defense is a legal argument in which the defendant admits the act but argues there are legal reasons why they should not be held liable, such as self-defense or insanity."
law,What is the insanity defense?,"The insanity defense argues that a defendant should not be held criminally responsible for their actions due to a severe mental illness that prevented them from understanding the nature or wrongfulness of their conduct."
law,What is mens rea?,"Mens rea refers to the criminal intent or mental state required to be found guilty of a crime. It distinguishes intentional crimes from accidents and is a core element of criminal liability."
law,What is actus reus?,"Actus reus is the physical act of committing a crime. Along with mens rea (criminal intent), it is a fundamental element required to establish criminal liability."
law,What is the presumption of innocence?,"The presumption of innocence means a defendant is considered innocent until proven guilty beyond a reasonable doubt. The burden of proof lies with the prosecution, not the defendant."
law,What is a search warrant?,"A search warrant is a court order authorizing law enforcement to search a specific location for evidence related to a crime. It must be supported by probable cause."
law,What is the right to an attorney?,"The Sixth Amendment guarantees criminal defendants the right to an attorney. If a defendant cannot afford counsel, the government must provide a public defender."
law,What is a public defender?,"A public defender is a government-appointed attorney who represents criminal defendants who cannot afford to hire private counsel. They provide legal representation as required by the Sixth Amendment."
law,What is an appeal in the legal system?,"An appeal is a request to a higher court to review and change the decision of a lower court. It is typically based on claims of legal error rather than a re-examination of the facts."
law,What is the difference between an appeal and a retrial?,An appeal asks a higher court to review legal errors in the original trial without re-examining facts. A retrial is a completely new trial before a new jury after the original verdict is set aside.
law,What is a class action lawsuit?,"A class action lawsuit allows a group of people with similar legal claims to sue as a collective. It is efficient for cases where many individuals have suffered the same harm from the same defendant."
law,What is a subpoena?,"A subpoena is a legal order requiring a person to appear in court or produce documents. Failure to comply with a subpoena can result in contempt of court."
law,What is contempt of court?,"Contempt of court is behavior that disrespects or disobeys the authority or orders of a court. It can be punished by fines or imprisonment."
law,What is perjury?,"Perjury is the crime of knowingly making false statements under oath in a judicial proceeding. It is a serious offense because it undermines the justice system."
law,What is an injunction?,"An injunction is a court order requiring a party to do or refrain from doing a specific act. Violations of injunctions can result in contempt of court."
law,What is a restraining order?,"A restraining order is a court order directing a person to stop specific actions or to stay away from another person. It is commonly used in domestic violence and harassment cases."
law,What is property law?,"Property law governs the ownership, use, and transfer of real and personal property. It covers topics such as title, easements, mortgages, landlord-tenant relations, and zoning."
law,What is the difference between real property and personal property?,"Real property refers to land and anything permanently attached to it, such as buildings. Personal property includes all other movable assets like vehicles, furniture, and money."
law,What is an easement?,"An easement is a legal right to use another person's land for a specific and limited purpose, such as a right-of-way or utility access, without owning the property."
law,What is adverse possession?,"Adverse possession allows a person who openly, continuously, and exclusively uses another's land for a statutory period to potentially claim legal ownership of that land."
law,What is eminent domain?,"Eminent domain is the government's power to take private property for public use, provided just compensation is paid to the property owner. It is authorized by the Fifth Amendment."
law,What is a deed?,"A deed is a legal document that transfers ownership of real property from one party to another. It must be signed, witnessed, and typically recorded with the local government."
law,What is a mortgage?,"A mortgage is a loan used to purchase real property in which the property serves as collateral. Failure to repay the loan can result in foreclosure by the lender."
law,What is foreclosure?,"Foreclosure is the legal process by which a lender takes possession of a property when the borrower fails to make mortgage payments, typically resulting in the sale of the property."
law,What is a lease?,"A lease is a contract between a landlord and tenant that grants the tenant the right to use property for a specified period in exchange for payment of rent."
law,What are tenant rights?,"Tenant rights include the right to habitable housing, protection from discrimination, proper notice before eviction, return of security deposits, and privacy from unreasonable landlord entry."
law,What is an eviction?,"An eviction is the legal process by which a landlord removes a tenant from a rental property, typically for nonpayment of rent or violation of the lease terms."
law,What is zoning law?,"Zoning law divides land into zones with specific permitted uses such as residential, commercial, or industrial, regulating how property can be developed and used."
law,What is intellectual property law?,"Intellectual property law protects creations of the mind including inventions, literary works, designs, and trademarks through patents, copyrights, and trademarks."
law,What is a patent?,"A patent is a government-granted exclusive right to an inventor to make, use, and sell an invention for a limited period, typically 20 years, in exchange for public disclosure."
law,What is a trademark?,"A trademark is a distinctive sign, symbol, or name used to identify goods or services of a particular source and distinguish them from those of others."
law,What is a copyright?,"Copyright is the legal right granted to the creator of original works giving them exclusive rights to reproduce, distribute, and adapt the work for a limited period."
law,What is fair use in copyright law?,"Fair use is a doctrine that permits limited use of copyrighted material without permission for purposes such as criticism, commentary, news reporting, teaching, and research."
law,What is employment law?,"Employment law governs the relationship between employers and employees, covering areas such as wages, discrimination, wrongful termination, workplace safety, and labor unions."
law,What is at-will employment?,"At-will employment means either the employer or employee can terminate the employment relationship at any time for any legal reason or no reason at all without liability."
law,What is wrongful termination?,"Wrongful termination occurs when an employee is fired for an illegal reason such as discrimination, retaliation for whistleblowing, or in violation of an employment contract."
law,What is workplace discrimination?,"Workplace discrimination is treating employees or job applicants unfairly based on protected characteristics such as race, gender, age, disability, religion, or national origin."
law,What is Title VII of the Civil Rights Act?,"Title VII prohibits employment discrimination based on race, color, religion, sex, and national origin. It applies to employers with 15 or more employees and is enforced by the EEOC."
law,What is sexual harassment in the workplace?,"Sexual harassment is unwelcome conduct of a sexual nature that creates a hostile work environment or results in employment decisions based on acceptance or rejection of the conduct."
law,What is the Americans with Disabilities Act?,The ADA prohibits discrimination against people with disabilities in employment and public life and requires employers to provide reasonable accommodations to qualified individuals with disabilities.
law,What is workers' compensation?,"Workers' compensation is a system providing wage replacement and medical benefits to employees injured on the job, in exchange for giving up the right to sue the employer for negligence."
law,What is FMLA?,"The Family and Medical Leave Act allows eligible employees to take up to 12 weeks of unpaid, job-protected leave for qualifying family or medical reasons without losing their job or benefits."
law,What is the minimum wage?,"The minimum wage is the lowest hourly rate an employer is legally permitted to pay workers. The federal minimum wage is set by the Fair Labor Standards Act, but states may set higher rates."
law,What is overtime pay?,"Overtime pay is compensation at a higher rate, typically 1.5 times the regular hourly wage, for hours worked beyond 40 hours per week under the Fair Labor Standards Act."
law,What is a non-compete agreement?,"A non-compete agreement is a contract in which an employee agrees not to work for competitors or start a competing business for a specified period and geographic area after leaving employment."
law,What is family law?,"Family law governs legal matters related to family relationships including marriage, divorce, child custody, adoption, and domestic violence."
law,What is the difference between legal separation and divorce?,"Legal separation allows spouses to live apart with court orders on finances and custody while remaining legally married. Divorce permanently ends the marriage."
law,What factors determine child custody?,"Courts determine child custody based on the best interests of the child, considering factors such as each parent's relationship with the child, living situation, stability, and the child's preferences."
law,What is child support?,"Child support is a court-ordered payment made by a non-custodial parent to the custodial parent to help cover a child's living expenses, education, and healthcare."
law,What is alimony?,"Alimony is financial support paid by one former spouse to the other after divorce to help maintain their standard of living. The amount and duration depend on factors like income and length of marriage."
law,What is a prenuptial agreement?,"A prenuptial agreement is a contract between prospective spouses that establishes the division of assets, debts, and other financial matters in the event of divorce or death."
law,What is adoption?,"Adoption is the legal process by which a person assumes the parental rights and responsibilities for a child who is not their biological offspring, creating a permanent parent-child relationship."
law,What is a will?,A will is a legal document expressing a person's wishes regarding the distribution of their assets and the care of any minor children after their death.
law,What is a trust?,"A trust is a legal arrangement in which one party holds assets for the benefit of another. It can be used to manage assets during a person's lifetime and distribute them after death while avoiding probate."
law,What is probate?,"Probate is the court-supervised process of administering a deceased person's estate, including validating the will, paying debts, and distributing assets to beneficiaries."
law,What is intestate succession?,"Intestate succession refers to the laws that determine how a deceased person's assets are distributed when they die without a valid will. Assets typically pass to the closest surviving relatives."
law,What is a power of attorney?,"A power of attorney is a legal document authorizing one person to act on behalf of another in legal, financial, or medical matters. It can be general or limited to specific acts."
law,What is an advance healthcare directive?,"An advance healthcare directive is a legal document stating a person's wishes about medical treatment if they become incapacitated, including who can make decisions on their behalf."
law,What is the First Amendment?,"The First Amendment protects freedom of speech, religion, press, assembly, and petition. It prohibits the government from making laws that abridge these fundamental freedoms."
law,What are the limits of free speech?,"Free speech is not absolute. Exceptions include true threats, incitement to imminent lawless action, defamation, obscenity, and speech that creates a clear and present danger of harm."
law,What is defamation?,"Defamation is a false statement of fact communicated to a third party that injures another's reputation. Spoken defamation is slander; written defamation is libel."
law,What must a plaintiff prove in a defamation case?,"A plaintiff must show the defendant made a false statement of fact, published it to a third party, acted negligently or with malice, and caused damages to the plaintiff's reputation."
law,What is freedom of religion under the First Amendment?,"The First Amendment contains two religion clauses: the Establishment Clause prohibiting government from establishing religion, and the Free Exercise Clause protecting individuals' religious practices."
law,What is the Equal Protection Clause?,"The Equal Protection Clause of the Fourteenth Amendment requires states to provide equal protection under the law to all persons, prohibiting discriminatory laws targeting specific groups."
law,What is the Fourteenth Amendment?,"The Fourteenth Amendment grants citizenship to all persons born or naturalized in the US, and prohibits states from denying any person due process or equal protection of the law."
law,What is judicial review?,"Judicial review is the power of courts to examine government actions and declare laws or executive actions unconstitutional. It was established in Marbury v. Madison in 1803."
law,What is the separation of powers?,"The separation of powers divides government authority among the legislative, executive, and judicial branches, each with distinct functions and checks and balances on the others."
law,What are checks and balances?,"Checks and balances is a system where each branch of government can limit the powers of the others to prevent any single branch from gaining too much power."
law,What is the Commerce Clause?,"The Commerce Clause grants Congress the power to regulate commerce among foreign nations, between states, and with Native American tribes. It is one of the broadest sources of federal legislative power."
law,What is federalism?,"Federalism is the division of power between the national government and state governments, where each level has sovereign authority in certain domains."
law,What is the Supremacy Clause?,"The Supremacy Clause establishes that the US Constitution and federal laws are the supreme law of the land, meaning state laws that conflict with federal law are preempted."
law,What is sovereign immunity?,"Sovereign immunity is the legal doctrine shielding governments from lawsuits without their consent. The federal government and states have waived immunity in many contexts through legislation."
law,What is a class action?,A class action is a lawsuit where many plaintiffs with similar claims sue as a group. Courts certify the class when common questions predominate and class resolution is more efficient than individual suits.
law,What is arbitration?,"Arbitration is an alternative dispute resolution process in which a neutral third party hears both sides and renders a binding decision, often used as an alternative to litigation."
law,What is mediation?,"Mediation is a voluntary dispute resolution process in which a neutral mediator facilitates negotiations between parties to help them reach a mutually acceptable settlement."
law,What is the difference between arbitration and mediation?,"In arbitration the arbitrator makes a binding decision for the parties. In mediation the mediator helps parties communicate and negotiate but does not impose a decision."
law,What is a deposition?,"A deposition is sworn out-of-court testimony given by a witness during the discovery phase of litigation, used to gather information and preserve testimony for trial."
law,What is discovery in litigation?,"Discovery is the pre-trial process in which parties exchange information and evidence relevant to the lawsuit through tools such as depositions, interrogatories, and document requests."
law,What is summary judgment?,"Summary judgment is a court ruling that resolves a case without a full trial because the undisputed facts show that one party is entitled to judgment as a matter of law."
law,What is a motion to dismiss?,"A motion to dismiss asks a court to throw out a case before trial, arguing that even if the facts alleged are true, they do not constitute a valid legal claim."
law,What is the burden of proof in civil cases?,"In civil cases the burden of proof is typically preponderance of the evidence, meaning the plaintiff must show it is more likely than not that the defendant is liable."
law,What is a settlement in a lawsuit?,"A settlement is an agreement between parties to resolve a lawsuit without a full trial, typically involving payment or other remedies in exchange for dropping the claims."
law,What is punitive damages?,"Punitive damages are compensation awarded beyond actual losses to punish a defendant for particularly egregious conduct and deter similar behavior in the future."
law,What is compensatory damages?,"Compensatory damages are monetary awards intended to compensate an injured party for actual losses suffered, including medical expenses, lost wages, and pain and suffering."
law,What is vicarious liability?,"Vicarious liability holds one party responsible for the wrongful actions of another party, such as an employer being liable for torts committed by an employee within the scope of employment."
law,What is product liability?,"Product liability holds manufacturers, distributors, and sellers responsible for injuries caused by defective or dangerous products. Liability may arise from design defects, manufacturing defects, or failure to warn."
law,What is a breach of contract?,"A breach of contract occurs when one party fails to fulfill their obligations under a valid contract without a legal excuse, entitling the other party to seek remedies."
law,What remedies are available for breach of contract?,"Remedies include compensatory damages to cover losses, consequential damages for foreseeable indirect losses, specific performance requiring the party to fulfill the contract, and rescission voiding the contract."
law,What is specific performance?,"Specific performance is a court order requiring a party to fulfill their contractual obligations, typically awarded when monetary damages are inadequate, such as in contracts involving unique property."
law,What is an unconscionable contract?,"An unconscionable contract is one that is so unfair or one-sided that a court will refuse to enforce it. Courts look at both procedural unfairness (how the contract was formed) and substantive unfairness (the terms)."
