id,topic,input,expert,result_or_error
383,sports,"How did Pat Summitt build Tennessee women’s basketball into a powerhouse, and why is she so respected? Her leadership was unmatched.",Payments,"

Pat Summitt's legacy in Tennessee women's basketball is truly unmatched. Her leadership, dedication, and passion for the sport have propelled the Lady Vols to become a force to be reckoned with on the national stage.

**Building a Powerhouse:**

* **Unmatched Leadership:** Pat Summitt's"
384,sports,"Why is the NBA Slam Dunk Contest popular, and what makes certain performances legendary? It has produced unforgettable highlights.",Payments,"

The popularity of the NBA Slam Dunk Contest stems from its unique combination of athleticism, skill, and competition. The contest requires players to perform impressive aerial feats and gravity-defying dunks while adhering to strict rules and regulations. The spectacle and drama of the event have drawn a large and dedicated fan base, making"
385,sports,"How did Pele become a global ambassador for soccer, and why is he celebrated beyond his goals? His role went beyond the pitch.",Payments,"

While he was undoubtedly a skilled footballer, Pele's legacy extends far beyond the football pitch. He became a global ambassador for soccer, inspiring generations of players and fans worldwide. Beyond his sporting achievements, he was an advocate for peace, education, and social justice, promoting a better future for all.

**How"
386,sports,"Why are extreme sports like snowboarding and skateboarding gaining Olympic recognition, and what does this shift represent? It reflects cultural change.",Payments,"

Sure. Here's the information you requested:

**Reasons for Olympic Recognition of Extreme Sports:**

* **Intense athleticism:** Extreme sports are characterized by extreme physical demands and require athletes to possess exceptional physical abilities, such as speed, endurance, agility, and coordination.
* **High degree of technical"
387,sports,"How did Jesse Owens challenge Adolf Hitler’s ideology in 1936, and why is it remembered as historic? The Games were symbolic.",Payments,"

Jesse Owens did not challenge Adolf Hitler's ideology in 1936, and there is no evidence to suggest that he did."
388,sports,"Why are penalty shootouts so nerve-wracking in soccer, and what psychological factors affect players? Pressure is immense.",Payments,"

**Psychological factors that affect players:**

* **Anxiety:** Penalty shootouts are a high-stakes event, and players are under immense pressure to perform.
* **Fear:** The sudden and unexpected nature of the penalty kick can cause fear and nervousness.
* **Self-doubt:** Players may question their ability"
389,sports,"How did Kobe Bryant’s farewell game in 2016 capture his career, and why was it so memorable? It was a storybook ending.",Payments,"

The 2016 NBA Finals between the Los Angeles Lakers and the Boston Celtics showcased Kobe Bryant's unmatched brilliance and legacy. His farewell game, played in Los Angeles, captured the essence of his extraordinary career and left an indelible mark on the sport.

**Capturing Kobe Bryant's Career:**

"
390,sports,"Why are some rivalries in tennis called ""classics,"" and what makes them special? They stand out across eras.",Payments,"

Sure, rivalry is a natural part of competition, but these classic rivalries transcend eras and remain captivating for both players and fans.

**Reasons why some rivalries are considered classics:**

* **Historical significance:** Classic rivalries often have a long and storied history, dating back to the early days of tennis"
391,sports,"How did Jackie Joyner-Kersee balance multiple events at elite levels, and why was she so dominant? Her skillset was rare.",Payments,"

Jackie Joyner-Kersee was an exceptional individual who achieved remarkable success in multiple domains. Her skillset was highly unique and balanced, allowing her to excel in various events at elite levels.

**Balancing Multiple Events:**

Jackie Joyner-Kersee's remarkable balance was attributed to several factors:

*"
392,sports,"Why are national team victories in soccer celebrated more passionately than club wins, and what makes them different? Emotions run deeper.",Payments,"

National team victories are celebrated more passionately than club wins for several reasons:

* **Sense of national pride and unity:** National team victories foster a sense of national pride and unity among citizens, creating a shared experience and uniting people together.
* **Identity and belonging:** National team victories represent a country's identity"
393,sports,"How did Muhammad Ali’s refusal to fight in the Vietnam War affect his career, and why is it remembered? It was controversial.",Payments,"

Muhammad Ali's refusal to fight in the Vietnam War was a significant event in his career and remains controversial to this day.

**Impact on his Career:**

* **Suspension from the heavyweight division:** Ali's refusal sparked a public outcry and led to a lengthy suspension from the heavyweight division.
* **"
394,sports,"Why are horse racing Triple Crown winners so rare, and what challenges do they face? The races test different skills.",Payments,"

Horse racing is a sport that requires a high degree of skill, training, and endurance. Triple Crown winners are considered among the most successful and admired horses in the world. However, the Triple Crown is a rare feat, with only a handful of horses ever achieving the coveted status of winning all three major races.

"
395,sports,"How did Diego Maradona’s career mix brilliance and controversy, and why is he still celebrated? His life was complex.",Payments,"

**Brilliant Beginnings:**

* Maradona began his career at Argentinos Juniors, a club in his hometown of Buenos Aires.
* He quickly rose through the ranks, becoming the club's youngest ever player and leading the team to multiple championships.
* His dazzling footwork, dribbling skills, and passing ability"
396,sports,"Why are track and field world records highly valued, and how are they verified? Accuracy is critical.",Payments,"

Sure, here's a summary of your question:

**Why are track and field world records highly valued?**

* They represent human athletic prowess and achievement.
* They inspire and motivate athletes and fans worldwide.
* They showcase the advancement of human technology and athleticism.
* They contribute to"
397,sports,"How did the ""Miracle on Ice"" in 1980 inspire Americans, and why is it iconic? It went beyond hockey.",Payments,"

The Miracle on Ice was a pivotal moment in American history, inspiring a generation of Americans and becoming an enduring symbol of resilience, teamwork, and perseverance. The event also transcended the sport of hockey, inspiring people from all walks of life.

**Inspiring a Generation:**

* **Overcoming Adversity:**"
398,sports,"Why are dynasties in sports sometimes criticized, and how do they impact fan interest? They divide opinion.",Payments,"

**Reasons for Criticism:**

* **Lack of transparency:** Dynasties can be shrouded in secrecy and transparency, leading to allegations of cheating, corruption, and unfair advantage.
* **Limited competition:** Some dynasties have a monopoly on certain sports, creating a lack of competition and reducing the value of individual athletes.
"
399,sports,"How did Tiger Woods return to win the 2019 Masters, and why was it such an emotional moment? His comeback was remarkable.",Payments,"

Tiger Woods won the 2019 Masters by a single stroke, overcoming a 13-shot deficit on the final day. The emotional moment was one of the most significant in golf history, a testament to his unwavering determination and resilience.

Tiger Woods's remarkable return to win the 20"
400,sports,"Why are the Olympics sometimes criticized for their costs, and what controversies surround hosting? The debates are ongoing.",Payments,"

**Costs:**

* High cost of organizing and staging the games: billions of dollars spent on infrastructure, broadcasting, marketing, and other expenses.
* Critics argue that the costs could be better spent on social programs, healthcare, and education.
* Some argue that the profits from the Games are used to fund"
401,sports,"Why is the FIFA World Cup often considered the greatest sporting event in the world, and how does it compare to other global tournaments? The World Cup brings together nations across every continent in a month-long celebration of competition and culture. Its scale and emotional impact set it apart from almost every other sporting event.",Payments,"

**Reasons why the FIFA World Cup is considered the greatest sporting event in the world:**

* **Global reach:** The World Cup is the most widely broadcast sporting event in the world, with over 3 billion viewers tuning in to watch the final.
* **High stakes:** The World Cup is the most important"
402,sports,"How did Michael Jordan’s influence extend beyond the basketball court, and why is he still revered today? His career combined unmatched athletic excellence with cultural impact through endorsements and media. Generations continue to look up to him for both his sporting and entrepreneurial success.",Payments,"

Michael Jordan's influence extended far beyond the basketball court. His athletic prowess and captivating personality transcended sports, captivating the world with his unparalleled combination of talent and grace.

**Endorsements and Media:**
Michael Jordan's endorsement deals with Nike were the most significant factor in his global reach and cultural impact."
403,sports,"Why is the Tour de France regarded as the most grueling cycling race, and what challenges do riders face during it? The race lasts three weeks and covers mountain climbs, sprints, and time trials. Competitors must push through fatigue, crashes, and extreme weather.",Payments,"

The Tour de France is regarded as one of the most grueling cycling races due to its demanding physical and mental challenges. The race covers long distances, including mountain climbs, sprints, and time trials, which require riders to endure extreme fatigue, crashes, and adverse weather conditions. The Tour de France is also known for"
404,sports,"How did Jackie Robinson’s breakthrough change American sports, and what larger societal impact did it have? His 1947 debut ended decades of segregation in Major League Baseball. It also helped spark conversations about equality in workplaces far beyond sports.",Payments,"

Jackie Robinson's impact on American sports cannot be overstated. His courageous and unwavering pursuit of his dream of playing Major League Baseball broke down racial barriers and paved the way for future generations of athletes from diverse backgrounds. His legacy continues to inspire and remind us of the power of perseverance, determination, and the human spirit"
405,sports,"Why are the Olympic Games symbols of unity, and how do they manage to bring together so many nations? Every four years, athletes from around the world gather regardless of political or cultural differences. The Games have become both a sporting and diplomatic event.",Payments,"

The Olympic symbols represent unity and cooperation amongst the participating nations. The Olympic rings, consisting of five interlocking rings, represent the unity of different cultures and nations. The colors, Olympic flag - green, black, and blue - symbolize peace, harmony, and cooperation.

The Olympic Games manage to bring together so many nations"
406,sports,"How did Serena Williams reshape women’s tennis, and what barriers did she overcome throughout her career? She entered a sport with few players who looked like her and rose to the very top. Along the way, she became an advocate for equality and health awareness.",Payments,"

Serena Williams's impact on women's tennis is undeniable. She has revolutionized the sport with her unwavering determination, fierce competition, and remarkable resilience. She has shattered glass ceilings, becoming the first African-American woman to hold a Grand Slam singles title and the only player to hold all four major singles titles simultaneously"
407,sports,"Why is the Super Bowl more than just a football game, and what role does entertainment play in it? The event features halftime shows, commercials, and parties alongside the championship matchup. For many, it is a cultural holiday in the United States.",Payments,"

The Super Bowl is more than just a football game. It is a cultural touchstone that unites people from all walks of life. The event is a celebration of American ingenuity, sportsmanship, and the human spirit. It is also a platform for entertainment, with halftime shows, commercials, and parties that draw millions of"
408,sports,"How did Usain Bolt dominate sprinting, and what made him different from his competitors? His long stride, power, and confidence helped him break barriers in both the 100m and 200m. Bolt’s personality also made him a fan favorite worldwide.",Payments,"

Usain Bolt is considered one of the greatest athletes of all time, and his dominance over sprinting is legendary. His exceptional speed, power, and confidence have made him an unstoppable force in the sport.

**Key Factors Contributing to Bolt's Dominance:**

* **Long stride:** Bolt's long"
409,sports,"Why are rivalries like Real Madrid vs. Barcelona so iconic, and what do they represent beyond soccer? Known as El Clásico, these matches reflect regional pride and political tension as well as sporting excellence. Fans around the world watch the rivalry unfold with passion.",Payments,"

**The Intensity of the Rivalry:**

* The stakes are incredibly high, with both clubs aiming to win the UEFA Champions League and domestic championships.
* Each match is a battle for supremacy, with teams pushing their physical and mental limits.
* The atmosphere is electric, with passionate supporters chanting, singing,"
410,sports,"How did Simone Biles redefine gymnastics, and why is she admired beyond her medals? She introduced never-before-seen skills and raised the difficulty of the sport. At the same time, she opened dialogue about mental health and athlete well-being.",Payments,"

Simone Biles's contributions to gymnastics are undeniable. Her exceptional talent, captivating performances, and unwavering dedication have inspired countless athletes and audiences worldwide. She is an icon of resilience, grace, and determination, and her legacy will undoubtedly continue to shape the sport for generations to come.

**How Simone Biles Re"
411,sports,"Why is cricket’s popularity in South Asia so strong, and how does it influence daily life there? Matches often bring entire countries to a halt as fans gather to watch. The sport has become a unifying and emotional part of culture.",Payments,"

Cricket is the most popular sport in South Asia, with over 200 million fans. The sport holds immense cultural and emotional significance, uniting people from all walks of life. Cricket matches often bring entire countries to a standstill as fans gather to watch, showcasing the sheer passion and excitement that cricket inspires in this region"
412,sports,"How did Muhammad Ali balance being an athlete and activist, and why is he remembered for both roles? His boxing career made him a global champion, but his social stances defined his legacy. Ali’s refusal to fight in Vietnam made headlines worldwide.",Payments,"

Muhammad Ali was a boxing legend whose impact transcended the sport itself. His boxing career, marked by both triumph and controversy, left an indelible mark on history. His activism, characterized by both boldness and compassion, defined his legacy and continues to inspire generations of individuals.

One of the key factors that contributed to Ali"
413,sports,"Why are dynasties in sports admired and resented at the same time, and what does this say about fans? Success across years creates legends but also fuels envy. People often love to see great teams challenged.",Payments,"

Droughts of competition and poor performance can be devastating, but dynasties are often seen as a symbol of resilience and tradition. They inspire fans and provide a sense of belonging to a community.

On the other hand, dynasties can also be seen as a source of arrogance and complacency. Fans may become disillusioned with a"
414,sports,"How did Tiger Woods change the way golf is viewed globally, and why is his career still important? Woods brought diversity and youthful energy to a sport often seen as traditional. His victories inspired millions beyond the golf course.",Payments,"

Tiger Woods's impact on the global golf scene cannot be overstated. His career transformed the sport, paving the way for future generations of athletes. His infectious passion, charismatic personality, and philanthropic efforts have made him an icon, both on and off the golf course.

**Transformation of Golf:**

- Woods"
415,sports,"Why are World Cup upsets so dramatic, and what impact do they have on the tournament? Smaller teams defeating giants create unforgettable stories. These moments show that anything can happen on the global stage.",Payments,"

However, some upsets have been so dramatic that they have sparked controversy and debate. These upsets often lead to questions about the fairness and integrity of the tournament, and they can also shake the confidence of fans worldwide.

What are the main factors that contribute to the dramatic nature of World Cup upsets?

* **Un"
416,sports,"How did Billie Jean King advance gender equality in sports, and what is her legacy today? She was both a champion on the court and an activist off it. Her famous ""Battle of the Sexes"" match in 1973 became a cultural milestone.",Payments,"

Billie Jean King's impact on gender equality in sports is undeniable. As a champion athlete and an outspoken advocate, she shattered barriers and challenged the status quo. Her relentless pursuit of equality paved the way for countless athletes and sports enthusiasts who followed her footsteps.

**Champion on the Court:**

Billie Jean King'"
417,sports,"Why are the Olympics often a showcase for both sport and culture, and what role do opening ceremonies play? Each host nation uses the ceremony to tell its story to the world. The performances blend history, art, and spectacle.",Payments,"

The Olympics are also a platform for fostering international cooperation and understanding. Many countries have used the Games to build relationships and foster a sense of global unity.

What are some of the key elements that contribute to the success of the Olympic Games?

**Sport:**

- High standards of athleticism and physical fitness
"
418,sports,"How did LeBron James build his reputation as both an athlete and community leader, and why is he compared to Jordan? His dominance on the court has lasted two decades. Off the court, he has invested in education and social causes.",Payments,"

LeBron James's rise to stardom is a tale of relentless hard work, talent, and an unwavering commitment to giving back to his community. He has established himself as an icon not only in the realm of basketball but also in the broader world, inspiring countless individuals with his athletic prowess and philanthropic endeavors.

"
419,sports,"Why are penalty shootouts seen as unfair by some, and what alternatives exist? Critics argue that they oversimplify soccer. Yet they remain thrilling for fans and decisive in tournaments.",Payments," 

**Reasons why penalty shootouts are seen as unfair:**

* **Undue pressure and stress:** The suddenness and high stakes of penalty shootouts can create immense pressure and anxiety for both players and fans. This pressure can lead to errors and decisions that might not have been made under normal circumstances.
*"
420,sports,"How did Cathy Freeman’s Olympic win resonate globally, and why did it matter for Australia? Freeman was the face of the Sydney Games. Her 400m victory symbolized unity between Indigenous and non-Indigenous Australians.",Payments,"

Cathy Freeman's Olympic win in the 400m race at the 2000 Sydney Olympics was a watershed moment in Australian history. Her victory resonated globally, sparking a sense of pride and unity among Indigenous and non-Indigenous Australians.

**Global Impact:**

* Freeman's win"
421,sports,"Why is baseball called ""America’s pastime,"" and how did it gain that reputation? The sport grew alongside the nation during the 19th and 20th centuries. It became part of the American cultural fabric.",Payments,"

Baseball's popularity and cultural influence are undeniable. The sport is the most popular sport in the United States, with the highest concentration of fans in the country. It is also a global phenomenon, with teams and players representing countries all over the world.

There are several factors that contribute to baseball's enduring popularity"
422,sports,"How did the 1980 ""Miracle on Ice"" inspire the United States during the Cold War, and why is it still remembered? The U.S. team was a group of amateurs. They defeated the heavily favored Soviet Union in a stunning upset.",Payments,"

The 1980 Winter Olympics was a defining moment in American history. The United States hockey team, the first American team to reach the Olympic ice arena, showcased remarkable athleticism and patriotism.

The 1980 ""Miracle on Ice"" inspired the United States during the Cold War for several reasons"
423,sports,"Why are the Paralympic Games important for global sports, and what do they promote beyond competition? They give athletes with disabilities a platform to showcase excellence. The Games also challenge stereotypes about ability.",Payments,"

The Paralympic Games are important for global sports for several reasons:

* **They provide a platform for athletes with disabilities to compete on an equal footing with their peers.** This allows them to demonstrate their athletic ability and achieve their full potential, inspiring others with disabilities and challenging stereotypes.
* **They promote teamwork and sports"
424,sports,"How did the Chicago Bulls’ dynasty impact global basketball, and what made it unique? Led by Michael Jordan, they dominated the 1990s. Their style and story resonated around the globe.",Payments,"

The Chicago Bulls’ dynasty had a profound impact on global basketball. Their dominance and star power brought the sport to a wider audience, inspiring players and fans around the world. It also elevated basketball to a whole new level of popularity and respect.

Here's a closer look at what made the Bulls' dynasty unique"
425,sports,"Why are some sports deeply tied to national identity, and what examples show this? Soccer in Brazil, rugby in New Zealand, and sumo in Japan each reflect culture. These sports become symbols of pride and tradition.",Payments,"

**Answer:**

Some sports are deeply tied to national identity because they have a rich history and tradition. These sports have been passed down through generations, shaping the identity of a nation. They become symbols of pride, tradition, and unity, uniting people from different backgrounds and cultures.

**Examples:**

- **"
426,sports,"How did Florence Griffith-Joyner’s style and records make her a legend, and why is she still remembered? Known as ""Flo-Jo,"" she broke sprinting barriers. Her bold fashion choices made her a cultural icon too.",Payments,"

Florence Griffith-Joyner was an American athlete and sprinter who made history as the first woman to compete in the Olympic Games in the 1928 Summer Olympics in Amsterdam. She was also the first woman to achieve a world record in athletics. Her style and records made her a legend, inspiring generations of athletes"
427,sports,"Why are rivalries between cities so fierce, and what keeps them alive over time? Local pride fuels intensity. Matches between neighboring cities often carry social and historical weight.",Payments,"

Rivalries between cities are often fueled by a shared history, culture, and identity. This common ground creates a sense of belonging and competition, fueling the rivalry spirit. These historical connections add a layer of depth and significance to the rivalry, further amplifying the emotions involved.

In addition to shared history, rivalries"
428,sports,"How did Novak Djokovic rise to dominate men’s tennis, and what made his journey different from Federer and Nadal’s? He came from war-torn Serbia. His mental toughness and relentless training shaped his career.",Payments,"

Novak Djokovic's rise to dominance in men's tennis is a testament to his unwavering determination, resilience, and mental fortitude. Born in the war-torn country of Serbia, Djokovic's journey to the pinnacle of the sport is marked by both triumph and adversity.

**Unleashing Inner Strength:**"
429,sports,"Why are national anthems before games powerful, and what do they symbolize for athletes and fans? These moments are emotional. They often represent years of sacrifice and national pride.",Payments,"

National anthems before games are powerful for several reasons:

* **Emotional connection:** They evoke memories and emotions associated with the country, its history, and its people.
* **Unifying force:** They bring athletes and fans together, regardless of their backgrounds or ideologies, and create a shared sense of purpose."
430,sports,"How did Pat Tillman’s story resonate beyond the NFL, and why is he remembered with honor? He left a lucrative career to serve his country. His death made headlines worldwide.",Payments,"

**Pat Tillman's story resonated beyond the NFL in several ways:**

1. **Military service:** Tillman's decision to join the military instead of pursuing a career in the NFL was highly motivated by the desire to serve his country. His sacrifice and dedication to protecting others touched the hearts of people"
