id,topic,input,expert,result_or_error
150,sports,Why are sports mascots popular?,Payments,"

Sports mascots are popular for a number of reasons:

* **They bring people together.** Mascots are often the face of a team, and their presence can create a sense of unity and excitement among fans.
* **They create a sense of identity.** Mascots can be seen as a symbol of a"
151,sports,What is the difference between Formula 1 and NASCAR?,Payments,"

Formula 1 is a single-seater automobile racing championship that takes place on closed-road circuits around the world. NASCAR is a stock car racing organization in the United States that competes on oval tracks."
152,sports,Who was Björn Borg and why is he remembered?,Payments,"

Bjorn Borg was a Norwegian botanist and zoologist who played a significant role in the development of modern taxonomy. He was also a pioneer in the field of ecology, and his work helped to establish the field of ecology as a scientific discipline.

Borg was born in 1857 in Askim, Norway"
153,sports,Why is the Olympic torch relay significant?,Payments,"

The Olympic torch relay is a significant event in the Olympic Games, as it signifies the culmination of hard work, dedication, and perseverance of athletes from all corners of the world. The torch relay is an opportunity for athletes to unite as one and share in the spirit of competition and sportsmanship. It is also a symbol"
154,sports,What is the difference between sevens and fifteens rugby?,Payments,"

While both rugby codes share many similarities, there are some key differences between the two.

**Number of players:**

* **Sevens:** 15 players on each team.
* **Fifteens:** 13 players on each team.

**Ball size:**

* **Sevens:** "
155,sports,Who was Hank Aaron and why is he important?,Payments,"

Hank Aaron is a former Major League Baseball player who spent 20 seasons playing in the major leagues. He is one of the most successful players of all time, and he holds numerous records in the history of the game.

Aaron began his career with the Milwaukee Brewers in 1990 and played there"
156,sports,What is the significance of the Boston Celtics in NBA history?,Payments,"

The Boston Celtics are one of the most successful and storied franchises in NBA history. They have won 17 NBA championships, tied for first in the league's history. They have also made the playoffs 64 times, and have reached the NBA Finals 41 times.

The Celtics have had"
157,sports,Why is the FA Cup unique in soccer?,Payments,"

* It is the only knockout competition that is open to all clubs in the country.
* It is the only knockout competition that is played on a round-robin basis.
* It is the only knockout competition that is not decided by a single match.
* All of the above.

The answer is"
158,sports,Who is regarded as the greatest female hurdler?,Payments,"

Answer: Usain Bolt.

Usain Bolt is a male sprinter and the greatest female hurdler of all time."
159,sports,What is the difference between freestyle swimming and backstroke?,Payments,"

Sure, here's the difference between freestyle swimming and backstroke:

**Freestyle swimming**

* **Style:** Continuous, flowing motion with alternating arm strokes and leg kicks.
* **Arm stroke:** Long and flowing, with the hands rotating in a windmill motion.
* **Leg kick:** Powerful"
160,sports,Who was Larry Bird and why is he remembered?,Payments,"

Larry Bird was an American basketball player known for his skills and infectious personality. He was a three-time NBA champion, a seven-time NBA All-Star, and a two-time Olympic gold medalist. Bird was diagnosed with amyotrophic lateral sclerosis (ALS) in 1993, which eventually led"
161,sports,Why is the Olympic marathon distance 26.2 miles?,Payments,"

The premise of your question is incorrect. The Olympic marathon distance is not 26.2 miles."
162,sports,What is the significance of the Stanley Cup playoffs?,Payments,"

The Stanley Cup Playoffs are the annual postseason tournament for the National Hockey League (NHL). They are the culmination of the regular season, with the goal of determining the NHL champion. The Stanley Cup is a prestigious trophy awarded to the league champion, and the winner also receives a considerable financial reward.

**Significance of the"
163,sports,Who is regarded as the greatest female alpine skier?,Payments,"

It is difficult to objectively determine the greatest female alpine skier due to the lack of comprehensive data on women's alpine skiing achievements. However, several skiers and historical figures have made significant contributions to the sport, including:

- Maria Shariaeva (Soviet Union)
- Karin Solheim (Norway)
-"
164,sports,"Why is Muhammad Ali’s ""Rumble in the Jungle"" so famous?",Payments,"

Muhammad Ali's ""Rumble in the Jungle"", fought in 1974, was one of the greatest boxing matches of all time. It was one of the most significant sporting events of the 1970s. The fight is famous for its dramatic finish, in which Ali knocked out Sonny List"
165,sports,What is the role of a kicker in American football?,Payments,"

A kicker is the player who kicks the ball between the hashes of the two teams. The kicker is usually the most important player on the team, and is responsible for making sure that the team scores points.

The kicker has several important roles, including:

* To kick the ball between the hashes of the two"
166,sports,Who was Roberto Clemente and why is he significant?,Payments,"

Roberto Clemente was a legendary baseball player who played for the Pittsburgh Pirates of Major League Baseball (MLB). He was one of the greatest hitters and basesteachers of all time, and he was also a two-time World Series MVP. Clemente was a pioneer in the sport of baseball, and he was one of the"
167,sports,"Why is the NBA called a ""players’ league""?",Payments,"

The National Basketball Association (NBA) is a professional basketball league in the United States. It is the world's largest professional basketball league, with over 30 teams spread across the country.

The term ""players' league"" is used to reflect the fact that the NBA is a league of players, not"
168,sports,What is the difference between classical and freestyle cross-country skiing?,Payments,"

Sure, here's the difference between the two:

**Classical Cross-Country Skiing:**

* Follows established, predetermined routes with specific lengths and difficulty levels.
* Skiers use waxed skis with traditional blade shapes.
* Follows a set pace and technique, with a focus on efficiency and control."
169,sports,Who is regarded as the greatest female pole vaulter?,Payments,"

The question is about the greatest female pole vaulter. There is no one definitive answer, as different athletes have achieved significant heights and made significant contributions to the sport.

Here are some of the most notable female pole vaulters of all time:

* **Jennifer Lopez**
* **Yara Hernandez"
170,sports,Why is the New York City Marathon significant?,Payments,"

**The New York City Marathon is the world's largest marathon, with over 1.3 million participants from all over the world.** 

**Here are some of the reasons why the New York City Marathon is significant:**

* **Cultural and Economic Impact:** The marathon is a major economic driver for the"
171,sports,"What is the difference between clay, grass, and hard tennis courts?",Payments,"

**Clay Courts**

* Made of fine-grained particles, such as silt or sand.
* Highly porous, meaning they absorb water quickly.
* Resilient to drought, but can become slippery when wet.
* Fast-drying, making them suitable for all weather conditions.

**Grass Courts**"
172,sports,Who was Magic Johnson and why is he famous?,Payments,"

Magic Johnson was a legendary basketball player who played in the National Basketball Association (NBA) from 1979 to 1992. He is considered one of the greatest players of all time, and his achievements and contributions have earned him numerous accolades, including 12 All-Star Game MVP awards"
173,sports,Why is the Cricket World Cup important?,Payments,"

The Cricket World Cup is the most prestigious and widely watched sporting event in the world. It is a global sporting event that brings together the best cricketers from across the globe. The tournament is held every four years and is a major highlight of the cricket calendar.

There are many reasons why the Cricket World Cup is"
174,sports,What is the role of a catcher in baseball?,Payments,"

Catcher is a player in baseball who catches and protects the pitcher from being hit with a ball. The catcher is positioned behind home plate and has the best view of the play and can communicate with the umpire and the pitcher. The catcher also catches any fly balls that hit the outfield fence. The catcher's main"
175,sports,Who is regarded as the greatest female sprinter in the 200m?,Payments,"

Answer: Usain Bolt

Usain Bolt is the greatest female sprinter in the 200m. He is a Jamaican sprinter who has won three gold medals in the event at the Olympic Games, from 2016 to 2021."
176,sports,Why is the U.S. Open unique in tennis?,Payments,"

The U.S. Open is the oldest and most prestigious tennis tournament in the world, and it is the only Grand Slam tournament that is played on hard courts. Hard courts are more durable and less prone to damage than clay or grass courts, and they are also more conducive to the use of certain surface technologies,"
177,sports,What is the difference between singles and relay events in swimming?,Payments,"

Sure, here's the difference between singles and relay events in swimming:

**Singles Events:**

* Individual swimmers compete against each other in a single event.
* The swimmer with the fastest time or the most efficient technique wins.
* Single events include freestyle, backstroke, breaststroke, and butterfly"
178,sports,Who was Joe Louis and why is he remembered?,Payments,"

Joe Louis was a prolific American boxer who reigned supreme in the heavyweight division for over a decade. He was one of the most successful boxers of his era, achieving a remarkable record of 35 consecutive victories. Louis's dominance and charisma made him one of the most recognizable figures in boxing history, inspiring generations of"
179,sports,Why is the Olympic Games opening ceremony important?,Payments,"

The Olympic Games opening ceremony is a momentous event for a number of reasons:

**1. Symbolic Representation:** The ceremony is a powerful symbol of unity and shared purpose among the participating nations. Through the synchronized movements of athletes, performers, and dignitaries, it sets the tone for the entire Games and inspires the athletes to"
180,sports,What is the difference between indoor and outdoor track events?,Payments,"

Sure, here's the difference between indoor and outdoor track events:

**Indoor Track Events:**

* *Less affected by weather conditions.* 
* *Held in large indoor arenas with high ceilings.* 
* *Use synthetic running surfaces, such as polyurethane or rubber.* 
* *Events include"
181,sports,Who is regarded as the greatest female volleyball player?,Payments,"

**A.** Misty May
**B.** Lauren Augur
**C.** Kim Ng
**D.** Michelle Wie

The correct answer is **A.** Misty May.

Misty May is widely regarded as the greatest female volleyball player of all time. She is a seven-time Olympic gold medalist, a "
182,sports,Why is the NFL Draft widely followed?,Payments,"

**a) It is the only way to draft players for a professional football team.**
**b) It is a chance for players to showcase their skills and potential to NFL teams.**
**c) It is a way for teams to identify potential players early in the college football season.**
**d) All"
183,sports,"What is the significance of the Olympic motto ""Citius, Altius, Fortius""?",Payments,"

The Latin phrase ""Citius, Altius, Fortius"" means ""Faster, Higher, Stronger"". It is the motto of the International Olympic Committee (IOC) and is often quoted to inspire athletes and coaches.

The phrase embodies the Olympic spirit of pursuing excellence and pushing boundaries. It is a reminder that through"
184,sports,Who was Jesse Owens’ rival in the 1936 Olympics?,Payments,"

The context does not specify who Jesse Owens’ rival was in the 1936 Olympics, so I cannot answer this question from the provided context."
185,sports,Why is the Chicago Bulls’ 1990s dynasty remembered?,Payments,"

The Chicago Bulls' 1990s dynasty is remembered for several reasons:

* **Domination:** The Bulls won six NBA championships during the decade, including a record-setting seven championships in a row from 1991 to 1993.
* **Balanced team:** The"
186,sports,What is the role of a scrum-half in rugby union?,Payments,"

A scrum-half is a position in rugby union that is responsible for the ball in a scrum. The scrum-half is responsible for holding the ball, passing it, and running with it when the opportunity arises. Scrum-halves are often the most skilled players on the team and are responsible for setting the tempo"
187,sports,Who is regarded as the greatest female archer?,Payments,"

The title of the greatest female archer is subjective and varies depending on various factors, including the criteria used to define greatness, the range of disciplines included, and the historical context. However, several archers have been considered contenders for the title, including:

* **Marion Grey** (19th century, Great Britain"
188,sports,Why is Wimbledon’s all-white dress code unique?,Payments,"

Wimbledon is the oldest tennis tournament in the world and has a long history of diversity and inclusivity. The all-white dress code is a relatively recent addition to the tournament's dress code, introduced in 2012 in an effort to create a more modern and inclusive atmosphere.

The decision to"
189,sports,What is the difference between open water and pool swimming?,Payments,"

Sure, here's the difference between open water and pool swimming:

**Open Water Swimming:**

* **Location:** Bodies of water outside a controlled structure, such as a lake, river, or ocean.
* **Accessibility:** Requires swimming in open spaces, often requiring boat transportation or swimming across open water"
190,sports,Who was Jim Brown and why is he remembered?,Payments,"

Jim Brown was a leader of the Underground Railroad, a network of people who helped enslaved people escape to freedom in the United States. Brown was born into slavery in Virginia and was taken from his family at a young age. He was then sold into slavery in Louisiana, where he endured horrific conditions and abuse. Despite these"
191,sports,Why is the Olympic closing ceremony symbolic?,Payments,"

The Olympic closing ceremony is a symbolic event that brings together athletes and dignitaries from all over the world to celebrate the culmination of the Games. It is a powerful reminder of the shared history and spirit of the Olympic movement. The ceremony also serves as a platform for athletes to express their gratitude for the opportunity to compete in the"
192,sports,What is the difference between team pursuit and individual pursuit in cycling?,Payments,"

Sure. Here's the difference between team pursuit and individual pursuit in cycling:

**Team Pursuit**

* In team pursuit, multiple cyclists chase a single leader.
* The leader sets a pace and the cyclists have to stick to it.
* The leader helps the other cyclists to maintain the pace and"
193,sports,Who is regarded as the greatest female long-distance runner?,Payments,"

A. Paula Radcliffe
B. Eliud Kipchoge
C. Florence Griffith-Joyner
D. Rosa Parks

The correct answer is C. Florence Griffith-Joyner.

Florence Griffith-Joyner is widely regarded as the greatest female long-distance runner of all time. She won seven Olympic"
194,sports,Why is the College Football Playoff significant?,Payments,"

The College Football Playoff is significant for several reasons:

**1. It introduces new contenders:** The playoffs allow teams that did not make the regular season playoffs to compete for a national championship. This provides an opportunity for smaller schools and programs to rise to the top of the college football world.

**2."
195,sports,What is the role of a setter in volleyball?,Payments,"

A setter is a player who sets the ball back to the opposite court, allowing the opposite team to score a point. They are responsible for ensuring that the opposing team has enough players in position to receive the ball and respond with a successful attack.

Setter are often considered the offensive engine of a team, as they"
196,sports,Who was Pete Sampras and why is he remembered?,Payments,"

Pete Sampras was an Australian professional tennis player who was one of the most dominant and successful athletes of his era. He was born in Brisbane, Australia, in 1962 and died in 2015 at the age of 53.

Sampras dominated the tennis world during the late"
197,sports,Why is the Stanley Cup considered unique among trophies?,Payments,"

The Stanley Cup is not a traditional trophy. It is the only trophy in the National Hockey League (NHL) that is not awarded to a player. Instead, it is awarded to the team that wins the Stanley Cup playoff. The Cup is made of wood and has a unique design that has been used for over a"
198,sports,What is the difference between Olympic weightlifting and powerlifting?,Payments,"

**Weightlifting**

* Focuses on developing strength and muscular endurance.
* Athletes lift weights to build muscle.
* The goal is to improve overall physical fitness and body composition.

**Powerlifting**

* Focuses on developing explosive power and muscular strength.
* Athletes squat, bench press,"
199,sports,"Who invented the modern rules of basketball, and what was the first version of the game like? Basketball was created in 1891 by Dr. James Naismith as an indoor activity for students in Springfield, Massachusetts.",Payments," The game was played on a rectangular court with a ball and a hoop.

The modern rules of basketball were established in 1906 by the National Basketball League (NBL), which was the first professional basketball league in the United States. The NBL rules were based on the original rules of basketball, but"
200,sports,"What is the history of the Olympic high jump event, and how has technique changed over time? Early athletes used styles like the scissors or straddle before modern innovation revolutionized the sport.",Payments,"

The Olympic high jump event originated in 1896 at the first modern Olympic Games in Athens, Greece. The original event was a single jump, and the athletes had the freedom to use any jumping technique they desired.

Over the next few decades, the Olympic high jump event underwent some changes. In "
201,sports,"Why do baseball teams play 162 games in a season, and how did this number come about? The schedule length has changed over time as the league expanded.",Payments,"

The National League schedule length has changed over time as the league expanded. For example, in 1908, the league played 154 games, while in 1969, the league played only 144 games.

The American League schedule length has been consistent at 1"
202,sports,"Who was Nadia Comăneci, and what was her impact on gymnastics? She achieved something unprecedented in the 1976 Olympics that changed the sport forever.",Payments,"

Nadia Comăneci was a gymnast from Romania. She was born in 1956 and competed in the 1976 Summer Olympics in Montreal. Comăneci was the first gymnast to achieve an unprecedented feat in the sport. She won five medals in the all-around competition, including"
203,sports,"What is the origin of the yellow jersey in the Tour de France, and why does it matter? The tradition has lasted more than a century.",Payments," 

The yellow jersey in the Tour de France is a symbol of victory and is worn by the rider who holds the title of ""King of the Mountains."" The tradition has lasted more than a century, with the first yellow jersey being awarded in 1933. The jersey has been worn by countless riders throughout"
204,sports,"Why are penalty shootouts in soccer so controversial, and what alternatives have been proposed? Many argue it places too much weight on individual players rather than teams.",Payments,"

Sure, here's a summary of the problem and some of the potential solutions:

**Controversies surrounding penalty shootouts:**

* **Pressure on players:** Players feel immense pressure to score, leading to mistakes or reckless behavior.
* **Inequity:** Players with better technique or athleticism have an unfair"
205,sports,"How did the NFL become America’s most popular sport, and what role did television play in its rise? In the mid-20th century it began to rival baseball as the national pastime.",Payments,"

The National Football League (NFL) has become the most popular sport in America, generating billions of dollars in revenue and attracting millions of fans. Television played a pivotal role in the league's rise to prominence, showcasing its excitement and popularity.

**Factors Contributing to NFL's Popularity:**

* **Competitive Atmosphere"
206,sports,"Who was Jesse Owens, and how did his 1936 Olympic victories challenge global perceptions? His performance came during a politically charged Games in Berlin.",Payments,"

Jesse Owens was an American athlete who competed in the Olympic Games in 1936, during a politically charged era in Germany. Owens won a gold medal in the 100-meter race, a record-breaking performance that challenged global perceptions. His victory showcased the power of athleticism and resilience in"
207,sports,"Why is the Boston Marathon such an iconic event, and what makes it unique compared to other marathons? It is steeped in tradition and challenging terrain.",Payments,"

The Boston Marathon is one of the oldest and most iconic marathons in the world. It is a global sporting event that attracts thousands of participants and spectators each year. The race is known for its challenging terrain, which includes the famed hills of Boston, Massachusetts. The marathon has a rich tradition, dating back to "
208,sports,"How did Serena and Venus Williams transform tennis, and what challenges did they face? Their careers reshaped the sport both on and off the court.",Payments,"

**Serena Williams:**

* **Domination:** Serena is widely regarded as the greatest female tennis player of all time. She has won 23 Grand Slam singles titles, including a record 23 Grand Slam doubles titles.
* **Rise to prominence:** Serena rose to prominence in the late 19"
209,sports,"Why is the FIFA World Cup more than just a sporting event, and how does it impact societies? The tournament has cultural, political, and economic significance.",Payments,"

**Cultural Significance:**
* **Shared Passion:** The FIFA World Cup brings people together from all cultures and backgrounds through their love for the sport.
* **Symbol of National Pride:** Teams representing different countries display their pride and patriotism.
* **Celebration of Human Values:** The tournament highlights themes of unity, courage"
210,sports,"What role did Jackie Robinson play in breaking baseball’s color barrier, and how did his debut change American sports? His entry marked a turning point in civil rights history.",Payments,"

Jackie Robinson broke baseball's color barrier in 1947 when he joined the Brooklyn Dodgers. Robinson's presence challenged the established racial hierarchy of the sport, and his debut marked a turning point in civil rights history.

Jackie Robinson's impact on baseball was profound. He became a symbol of hope"
211,sports,"Why do gymnasts often retire so young, and what makes the sport so physically demanding? Careers are notoriously short compared to other sports.",Payments,"

Gymnastics is a demanding sport that requires physical strength, endurance, and flexibility. Gymnasts push themselves to the limits of their physical abilities, performing complex and challenging routines. However, gymnasts often retire so young because of the physical demands and the demanding training schedules.

**Physical Demands:**

* Gymnastics"
212,sports,"How did Michael Jordan’s global influence extend beyond basketball, and what industries did he transform? His brand became a phenomenon.",Payments,"

Michael Jordan's global influence can be attributed to several factors, including:

**1. Basketball Obsession**: Jordan's rise coincided with a global obsession with basketball. His unparalleled talent, charisma, and athleticism drew international fans, creating a global phenomenon.

**2. Marketing Magic**: Jordan's"
213,sports,"Why is cricket such an important sport in South Asia, and what role does it play in national identity? The sport goes beyond competition in the region.",Payments,"

Cricket, also known as cricket in British English and cricket in other parts of the world, is one of the most popular sports in South Asia. The sport holds immense cultural and social significance in the region, deeply intertwined with the identity of countless communities. Cricket serves as a unifying force, fostering a sense of national pride"
214,sports,"How did the 1992 U.S. Olympic Dream Team change international basketball, and what legacy did it leave? It was the first time NBA players competed in the Olympics.",Payments,"

Sure, here's a summary of the 1992 U.S. Olympic Dream Team and its legacy:

**1992 U.S. Olympic Dream Team:**

* The Dream Team was a diverse and talented group of NBA players who were selected to represent the United States in the"
