id,topic,input,expert,result_or_error
270,sports,"How did Pat Tillman’s story transcend football, and why is he remembered? His life was unique.",Payments,"

Pat Tillman was an American football player who served in the United States Army National Guard during the Iraq War. He was a highly decorated soldier, receiving numerous awards and accolades for his bravery and service. However, what set Pat Tillman apart from other soldiers was his decision to leave the military and pursue a career in"
271,sports,"Why are the Olympic rings interlocked, and what do they symbolize? Their design is deliberate.",Payments,"

The Olympic rings are a symbol of unity and cooperation between the nations of the world. They are interlocked to represent the interconnectedness of all human beings and the shared journey of life. The rings are also designed to be visually appealing and engaging, with each ring representing a different country or region.

The intricate design"
272,sports,"How did Kobe Bryant build his legacy, and why is the ""Mamba Mentality"" famous? His influence continues after his career.",Payments,"

**Building his Legacy**

* **Dominating the NBA:** Kobe Bryant established himself as one of the greatest basketball players of all time. He won five NBA championships, made 18 All-Star Game appearances, and was named the NBA MVP twice.
* **Team success:** Alongside LeBron James, Bryant"
273,sports,"Why is track and field called athletics in most of the world, and what does it encompass? The terminology differs by region.",Payments,"

Track and field is called athletics in most of the world, owing to its historical and cultural significance. The term has evolved over time to encompass various athletic disciplines, but its core elements remain consistent.

**Historical Origins:**

- Track and field emerged in ancient civilizations, with the earliest evidence dating back to Mesopotamia ("
274,sports,"How did the New England Patriots dominate the 2000s and 2010s, and what factors contributed? Their success was sustained.",Payments,"

The New England Patriots are one of the most successful franchises in the National Football League (NFL). They have won 6 Super Bowl championships, from 2002 to 2019. They have also made the AFC Championship 14 times during that period.

What factors contributed to the Patriots"
275,sports,"Why is boxing scored by rounds, and how do judges decide points? The system can be controversial.",Payments,"

Because boxing is a combat sport, it is not scored by rounds. Instead, it is scored by judges on a point system. A point is awarded to a boxer when he or she successfully lands a blow, and is deducted from the boxer when he or she is knocked down or when he or she is unable to"
276,sports,"How did Cathy Freeman’s Olympic victory in 2000 inspire Australia, and why was it historic? It symbolized more than sport.",Payments,"

Cathy Freeman's Olympic victory in 2000 was a watershed moment for Australia. It was the country's first gold medal in the Olympics since 1900, a feat that ignited a sense of national pride and unity. The victory also served as a powerful symbol of hope and resilience,"
277,sports,"Why is Formula 1 considered the pinnacle of motorsport, and what makes it unique? Its prestige is unmatched.",Payments,"

Formula 1 is widely considered the pinnacle of motorsport due to its extreme speed, high intensity, and unique driving conditions. The sport is known for its technicality, precision, and skill of the drivers, who must navigate treacherous circuits at high speeds while maintaining control and precision.

**Key characteristics of Formula 1"
278,sports,"How did Shaquille O’Neal dominate the NBA, and why was he nearly unstoppable? His size and skill were rare.",Payments,"

**Answer:**

Shaquille O'Neal dominated the NBA due to his immense size, athleticism, and basketball IQ. Here's a breakdown of why he was nearly unstoppable:

**Size:** Shaq was the third tallest player in NBA history when he entered the league, standing at 7'1"""
279,sports,"Why are sports documentaries so popular, and what do they provide fans? They reveal more than highlights.",Payments,"

**Reasons for Popularity:**

* **Engaging storytelling:** Sports documentaries go beyond the highlights, providing a deeper and more intimate look into the lives of athletes, teams, and communities.
* **Unveiling hidden stories:** Many documentaries reveal stories of perseverance, triumph, and adversity, highlighting the human side of"
280,sports,"Why is the NBA Finals considered the ultimate stage for basketball, and how does it affect player legacies? The series often defines careers and cements reputations.",Payments,"

The NBA Finals are considered the ultimate stage for basketball because they are the culmination of a season's hard work, dedication, and competition. The series brings together the best players from across the league, creating a fierce competition that pushes both teams to be their best. The intensity and drama of the games create a captivating"
281,sports,"How did the original Olympic Games in ancient Greece begin, and what role did they play in society? The tradition dates back thousands of years.",Payments,"

**Origins and Evolution of the Olympic Games:**

The origins of the Olympic Games stretch back thousands of years, with evidence suggesting participation dating back to the Neolithic period (c. 10,000 BCE). Early forms of games were likely focused on athleticism and survival, with the ultimate goal of maintaining"
282,sports,"Why is baseball unique for not having a game clock, and how does that change its strategy? Unlike most sports, innings determine the flow.",Payments,"

Baseball is unique in that it does not have a game clock. This allows the game to flow naturally, with each team having a limited amount of time to bat and throw before the next team takes the field. This gives players more flexibility and allows them to adjust their strategies accordingly.

The lack of a game clock"
283,sports,"How did Lionel Messi finally win the World Cup in 2022, and why was it significant for his career? The victory came late but cemented his status.",Payments,"

Lionel Messi finally won the FIFA World Cup in 2022 after a long and illustrious career. However, his triumph came in a rather unconventional fashion.

In the final of the 2022 FIFA World Cup, Argentina faced France in a thrilling encounter. The match ended in a draw, resulting"
284,sports,"Why do athletes use altitude training, and what benefits does it provide for performance? The science behind it involves oxygen levels.",Payments,"

**Benefits of Altitude Training:**

* **Enhanced performance:** Studies have shown that altitude training can significantly improve endurance, VO2 max, and overall performance in sports such as running, cycling, and swimming.
* **Muscle hypertrophy and strength:** Exposure to high altitude increases the production of growth hormone, which promotes muscle"
285,sports,"How did the 1972 Munich Olympics become infamous, and why is it remembered with tragedy? The event was overshadowed by violence.",Payments,"

The 1972 Munich Olympics were a significant event in history, but they are remembered with tragedy due to the violent takeover of the city by the Nazi Party and their collaborators. The atrocities committed during the Olympics were a stark reminder of the horrors that can occur when extremism and hatred prevail.

The events of"
286,sports,"Why are Super Bowl commercials so expensive, and what makes them iconic? They have become part of the spectacle itself.",Payments,"

Super Bowl commercials are among the most expensive advertising investments in the world, with some spending up to $1 billion per spot. This is due to the high demand for commercial time during the Super Bowl, as well as the premium pricing associated with the event.

There are a number of factors that contribute to the high"
287,sports,"How did Roger Bannister break the four-minute mile barrier, and why was it historic? Many thought it was impossible at the time.",Payments,"

Roger Bannister, a British athlete, achieved a remarkable feat by breaking the four-minute mile barrier in 1969. This historic accomplishment challenged the prevailing scientific consensus that it was impossible to run a mile in under four minutes. Bannister's historic run had a profound impact on both the sporting world"
288,sports,"Why are chess and esports sometimes considered sports, and what arguments support this view? Both require skill and training.",Payments,"

While the lines between sports and esports can be blurry, they share some characteristics that make them appear to be sports. Here are a few:

* **Competition:** Both chess and esports involve competition between individuals or teams.
* **Training:** Both require skill and training to be successful.
* **Physical effort"
289,sports,"How did Larry Bird and Magic Johnson’s rivalry reshape the NBA, and why is it still remembered? Their battles defined the 1980s era.",Payments,"

The rivalry between Larry Bird and Magic Johnson is a seminal chapter in NBA history. Their battles defined the 1980s era, showcasing the unmatched talent and competitive spirit of two superstars.

**How their rivalry shaped the NBA:**

1. **Increased Competition:** Bird and Johnson's fierce competition pushed"
290,sports,"Why are goalkeepers sometimes seen as the most unique players in soccer, and how does their role differ? They play under special rules.",Payments,"

Goalkeepers are often regarded as the most unique players on the soccer pitch. Their role is different from that of any other player, as they are responsible for preventing the opposing team from scoring goals. This uniqueness stems from several factors, including the physical demands of the position, the specialized equipment they use, and the special"
291,sports,"How did the All-Star Game evolve in Major League Baseball, and why is it called the ""Midsummer Classic""? It remains a cherished tradition.",Payments,"

**Evolution of the All-Star Game:**

* **Origins:** The first All-Star Game was played in 1911 between the National League and American League.
* **Expansion:** The game grew in popularity, becoming an annual event in 1921.
* **Shifting"
292,sports,"Why do figure skating routines include both technical and artistic scores, and how are they judged? The system balances different skills.",Payments,"

Figure skating routines consist of both technical and artistic scores, each contributing to the overall presentation and scoring of a performance.

**Technical Score:**

* Involves precise and controlled movements, including jumps, spins, footwork, and lifts.
* Judges assess technical elements through observation and scoring based on established technical criteria"
293,sports,"How did Jesse Owens influence future generations, and why is he revered beyond sports? His story continues to inspire.",Payments,"

Jesse Owens's legacy extends far beyond the realm of sports. His impact on future generations and the cultural landscape of America is immeasurable. Owens's athletic prowess and unwavering determination inspired countless individuals, including athletes, educators, and ordinary citizens alike. His story has become an enduring symbol of resilience, perseverance, and the"
294,sports,"Why is the Rugby World Cup important, and how does it differ from regional tournaments? It is the pinnacle of the sport.",Payments,"

The Rugby World Cup is the most prestigious and widely watched sporting event on the planet. It is the pinnacle of achievement for any rugby player, and it is a source of immense pride and inspiration for fans worldwide.

The World Cup is unique in that it is the only event where teams from different geographic regions converge to"
295,sports,"How did Jackie Joyner-Kersee’s training set her apart in combined events, and what challenges did she overcome? Her career spanned decades.",Payments,"

Jackie Joyner-Kersee is a pioneer in combined events, a sport that combines athleticism, strength, and endurance to create a unique and challenging spectacle. Her exceptional training regime and unwavering determination have helped her achieve unprecedented success, spanning multiple decades.

**Training Set:**

* **Multidisciplinary approach:** Jackie"
296,sports,"Why are mascots common in American sports, and what purpose do they serve for fans? They’re more than entertainment.",Payments,"

Mascots are ubiquitous in American sports, representing franchises and universities. They add a layer of unity and identity to a team, fostering a sense of belonging among its fans. Mascots evoke a strong emotional response, creating a connection between the athletes and the fans.

**Purpose of Mascot:**

* **Unle"
297,sports,"How did the Lakers–Celtics rivalry shape NBA history, and why is it so significant? It defined decades of basketball.",Payments,"

**The Lakers-Celtics rivalry defined a generation of basketball.** It was a clash of titans, two franchises that dominated the league for almost a decade, shaping the sport in countless ways.

**Defining Moments:**

* **1980s:** This era witnessed a Lakers-Celtics showdown that defined"
298,sports,"Why do swimmers wear caps and goggles, and how do these affect performance? The equipment is standard in competition.",Payments,"

Swimmers wear caps and goggles to protect their eyes from the intense glare of the sun, reduce wind resistance, and improve comfort and visibility. These accessories have an impact on performance as they can affect the swimmer's vision, buoyancy, and overall efficiency.

**Goggles:**

* **Reduced wind resistance:**"
299,sports,"How did the ""Hand of God"" goal become one of the most controversial moments in soccer? It occurred during the 1986 World Cup.",Payments,"

The ""Hand of God"" goal was scored by Argentina's Diego Maradona during the 1986 FIFA World Cup final between Argentina and England. The referee, Pierluigi Pai, awarded Argentina a free kick in the penalty area after a challenge from England's Kevin Keegan. Maradona scored the free kick,"
300,sports,"Why are national derbies in soccer so intense, and what makes them different from regular matches? They’re often charged with history.",Payments,"

National derbies in soccer are arguably the most intense and captivating sporting events on the planet. They showcase the unparalleled dedication, skill, and athleticism of the participating athletes, who put their lives on the line for their teams and countries.

**Why are national derbies so intense?**

* **Historical significance"
301,sports,"How did the invention of synthetic tracks change athletics, and what improvements did they bring? Surfaces evolved over time.",Payments,"

Synthetic tracks have revolutionized athletics, providing athletes with a more durable and consistent surface to train and compete on. This has led to significant improvements in performance, safety, and accessibility.

**Increased durability:** Synthetic tracks are much more durable than natural surfaces such as grass or dirt. They are resistant to tearing, cracking"
302,sports,"Why are Olympic medals not always pure gold, and what are they really made of? Their composition surprises many.",Payments,"

Sure, here's the information you requested:

**Why Olympic Medals Are Not Pure Gold:**

The traditional belief that Olympic medals are made entirely of pure gold is false. While the original medals from ancient Greece and Rome were indeed made of pure gold, the modern Olympic medals are crafted from a combination of materials"
303,sports,"How did women’s soccer grow after the 1999 World Cup, and why was that tournament so important? It marked a turning point.",Payments,"

The 1999 FIFA Women's World Cup was a landmark event in the history of women's soccer. It marked a turning point for the sport, with unprecedented media coverage and global participation.

**Growth after 1999:**

* The FIFA Women's World Cup has grown"
304,sports,"Why are dynasties celebrated in sports, and what examples stand out? Sustained excellence captures attention.",Payments,"

**Reasons for Celebrating Dynasties in Sports:**

* **Historical Legacy:** Dynasties showcase a team's rich history and accomplishments, captivating fans and inspiring future generations.
* **Tradition and Discipline:** They embody the values and principles of past generations, fostering a sense of unity and tradition.
* **Consistency"
305,sports,"How did Jackie Robinson handle the abuse he faced, and why is his resilience admired? His strength was mental as well as physical.",Payments,"

Jackie Robinson faced unimaginable abuse during his tenure with the Brooklyn Dodgers, both on and off the field. He endured racism, segregation, and physical violence. Yet, he remained steadfast in his pursuit of equality and broke barriers for generations to come.

**How Robinson handled the abuse:**

* **Internal Strength:** Robinson"
306,sports,"Why is the marathon associated with ancient Greece, and what story inspired its creation? The distance has mythological roots.",Payments,"

The Marathon is associated with ancient Greece because the legendary race was held there. The marathon was one of the earliest known athletic competitions, and it was said to have been created by the Greek gods to commemorate their own victory in a battle against the Persians. The race was also a way for the Greek people to celebrate their"
307,sports,"How did the Boston Celtics dominate in the 1960s, and what made Bill Russell central to their success? Their dynasty was unparalleled.",Payments,"

The Boston Celtics dominated the National Basketball Association (NBA) in the 1960s, winning six NBA championships in a decade. The team's dominance was fueled by several factors, including their exceptional play, the leadership of Bill Russell, and the team's unique culture.

**Exceptional Play:**"
308,sports,"Why are ice rinks kept at specific temperatures, and how does it affect hockey? The science behind it is precise.",Payments,"

Sure! Here's the scientific explanation for why ice rinks are kept at specific temperatures:

**1. Coefficient of Friction:**

- The coefficient of friction between the ice and the skates is crucial for determining the friction experienced by the skaters.
- For ice hockey, a lower coefficient of friction allows for"
309,sports,How did Cathy Freeman’s victory in 2000 Sydney Olympics inspire the world? It had deep cultural meaning.,Payments," 

Cathy Freeman's victory in the 2000 Sydney Olympics was a watershed moment in women's sport and inspired the world with its cultural and symbolic significance. She became an icon, representing Australia and inspiring countless women and girls around the globe.

**Cultural Significance:**

* **Breaking barriers:**"
310,sports,"Why are Super Bowl rings so large and ornate, and what do they represent? They go beyond jewelry.",Payments,"

Super Bowl rings are more than just a symbol of victory. They are works of art, showcasing the craftsmanship, artistry, and history of the NFL. The design and size of the rings reflect the prestige and importance of the game, reflecting the dedication and sacrifice of the players, coaches, and fans who have contributed to"
311,sports,How did the 1968 Black Power salute by Tommie Smith and John Carlos influence sports activism? The image endures.,Payments,"

The 1968 Black Power salute by Tommie Smith and John Carlos was a pivotal moment in the history of sports activism, sparking a movement for racial equality and social justice within the realm of athletics. The image, which became synonymous with the fight for equality, continues to inspire and serve as a reminder of"
312,sports,"Why are the Olympic swimming relays so exciting, and how do they differ from individual races? They add drama.",Payments,"

Sure, the Olympic swimming relays are a spectacle of teamwork, athleticism, and drama. The unique format of the relay races, where swimmers from different nations compete together, adds a layer of excitement and suspense to the event.

**Key reasons why the Olympic swimming relays are exciting:**

* **Teamwork and"
313,sports,"How did Wilt Chamberlain’s records challenge future players, and why do they seem untouchable? His numbers are staggering.",Payments,"

Wilt Chamberlain's basketball records continue to set benchmarks that defy the limitations of the game. His legacy transcends the hardwood, inspiring generations of players and coaches with his unparalleled skills and unmatched achievements.

**Challenging Future Players:**

- **Unmatched Longevity:** Chamberlain played in the NBA for an astonishing 2"
314,sports,"Why are cricket Test matches considered the purest form of the sport, and how do they differ from shorter formats? They require patience.",Payments,"

Cricket Test matches are considered the purest form of the sport because they provide a platform for the longest and most intense displays of skill and athleticism. They are the pinnacle of cricket, where players showcase their talent and determination over an extended period of time.

Cricket Test matches are different from shorter formats like Twenty20"
315,sports,"How did Steffi Graf achieve the Golden Slam in 1988, and why is it unique? No one else has matched it.",Payments,"

Steffi Graf has never achieved the Golden Slam in 1988."
316,sports,"Why are rivalries like Yankees vs. Red Sox enduring, and what keeps them alive? They span generations.",Payments,"

Yankees vs. Red Sox is one of the oldest rivalries in Major League Baseball, spanning over a century. The two teams have faced off in the playoffs 46 times, with the Red Sox holding a slight edge with a 26-24 advantage.

There are several factors that contribute to"
317,sports,"How did Nadia Comăneci change gymnastics scoring, and what made her performance shocking? It had never happened before.",Payments,"

Nadia Comăneci is a former Olympic gymnast from Romania. She competed in the 2008, 2012, and 2016 Summer Olympics. She won three Olympic medals, including two golds.

Comăneci's impressive performance came during the 2"
318,sports,"Why are national team jerseys so important in soccer, and how do they unite fans? They go beyond clothing.",Payments,"

National team jerseys are more than just garments that adorn athletes on the soccer pitch. They carry immense significance, representing a country's pride, heritage, and unity. They are a symbol of national identity, uniting fans from all walks of life under a common passion for the sport.

**Historical Significance:**

National"
319,sports,"How did Billie Jean King’s activism shape sports, and what organizations did she help found? Her efforts were pioneering.",Payments,"

Billie Jean King is widely considered one of the greatest female athletes of all time. She is a multiple-time Olympic champion, a world-renowned athlete, and a powerful voice for social justice. Her activism has shaped sports in many ways, including the establishment of the Women's Sports Foundation, which has helped to"
320,sports,"Why is the Olympic flame transported across countries, and what is the relay’s purpose? It connects people worldwide.",Payments,"

**It is a symbol of unity and continuity across countries and cultures.**

The Olympic Flame is transported across countries for several reasons:

* **To represent the spirit of the Olympics and the shared history of the Olympics.** The flame has been carried to every Summer Olympics since its inception in 1906."
321,sports,"How did Kobe Bryant inspire players around the world, and why is the ""Mamba Mentality"" so famous? His philosophy transcends sports.",Payments,"

Kobe Bryant was an exceptional athlete whose leadership, determination, and competitive spirit inspired players and fans around the world. His unwavering focus on excellence, coupled with his relentless pursuit of perfection, transcended sports and became a global phenomenon.

**Inspiring Players:**

* **Unmatched Work Ethic:** Bryant displayed an"
322,sports,"Why are batting averages in baseball so closely followed, and what do they indicate? They remain a core stat.",Payments,"

Sure, here's the explanation you requested:

**Why Batting Averages Are Closely Followed:**

* **Significance of Runs and Hits:** A high batting average signifies a player's ability to consistently reach bases and score runs. It's essentially a measure of a player's on-base"
323,sports,"How did Novak Djokovic become the all-time Grand Slam leader, and what challenges did he face? His career wasn’t easy.",Payments,"

Novak Djokovic, ranked as the world's No. 1 player in men's tennis, holds the record for most Grand Slam titles (20) and has consistently been a top contender for over a decade. His remarkable career has not been without challenges, but he has always found a way to rise"
324,sports,"Why are halftime shows popular in American sports, and how did they become entertainment spectacles? They grew with TV.",Payments,"

Halftime shows are incredibly popular in American sports, with the average game attracting over 100 million viewers. This popularity is due to several factors, including:

* **Entertainment value:** Halftime shows feature a wide range of performances and activities, from live music and dance to celebrity appearances and special effects."
325,sports,"How did the 1995 Rugby World Cup in South Africa symbolize unity, and why is it remembered? Nelson Mandela played a role.",Payments,"

The 1995 Rugby World Cup in South Africa was a momentous event that not only brought together people from diverse backgrounds but also symbolized unity and reconciliation. The country, which had been deeply divided by the apartheid regime, had come together to celebrate the sport and its unifying power.

One of the most significant"
