id,topic,input,expert,result_or_error
0,sports,Who won the first modern Olympic marathon in 1896?,Payments,"

The first modern Olympic marathon took place in 1908 in London, England."
1,sports,Who holds the record for the most home runs in Major League Baseball?,Payments,"

The question is about Major League Baseball.

The record for most home runs in Major League Baseball is held by **Babe Ruth**. With 714 home runs, Ruth holds the record for over 80 years."
2,sports,Which country has won the most FIFA World Cups?,Payments,"

Brazil has won the FIFA World Cup 8 times, while Germany has won the tournament 5 times. Other countries that have won the FIFA World Cup include Argentina, England, Italy, Spain, and the Soviet Union."
3,sports,Who is known as the greatest hockey player of all time?,Payments,"

The question is about the greatest hockey player of all time. There is no one definitive answer, as opinions on this matter are subjective and vary widely.

Some of the most commonly mentioned candidates for the title of greatest hockey player of all time include:

* Wayne Gretzky
* Connor McDavid
* Sidney"
4,sports,What is the maximum score possible in a single frame of bowling?,Payments,"

A. 100
B. 120
C. 150
D. 180

The correct answer is **C. 150**

A single frame of bowling can have a maximum score of 150 points."
5,sports,Who was the first woman to score in an NCAA Division I football game?,Payments,"

I cannot find any information about the first woman to score in an NCAA Division I football game."
6,sports,Who won the first FIFA World Cup?,Payments,"

The first FIFA World Cup was held in Brazil in 1930. Argentina won the tournament, defeating Uruguay 4–2 in the final."
7,sports,Why is Michael Jordan considered the greatest basketball player?,Payments,"

Michael Jordan is widely regarded as one of the greatest basketball players of all time. There are several factors that contribute to his status, including his unprecedented athleticism, shooting prowess, passing ability, and leadership.

* **Unmatched athleticism:** Jordan possessed exceptional speed, agility, and jumping ability, which allowed him"
8,sports,How many players are on a standard soccer team during a match?,Payments,"

A. 11
B. 12
C. 13
D. 14


The answer is A. 11.

A standard soccer team has 11 players on the field during a match."
9,sports,What is the Super Bowl and why is it significant?,Payments,"

The Super Bowl is the most prestigious and widely watched sporting event in the world. It is held annually between the National Football League (NFL) and the American Football Conference (AFC) and is broadcast on Fox. The Super Bowl is the culmination of the regular season and features the two teams with the best records in the"
10,sports,Who holds the record for the most Olympic gold medals?,Payments,"

a. Michael Phelps
b. Usain Bolt
c. Carl Lewis
d. Jesse Owens

The correct answer is a. Michael Phelps.

Michael Phelps holds the record for the most Olympic gold medals, with a total of 28 medals, won between 2004 and 20"
11,sports,What is the difference between tennis singles and doubles?,Payments,"

Sure. Here's the difference between tennis singles and doubles:

**Singles:**

* Played between one player against another.
* Played on a single court with a net in between.
* Each player uses a racket to hit a ball back and forth over the net.
* Players score points by"
12,sports,Why is Serena Williams regarded as one of the greatest athletes ever?,Payments,"

Serena Williams is regarded as one of the greatest athletes ever due to her exceptional athleticism, dominance, and unwavering determination.

* **Exceptional Athleticism:** Serena Williams is one of the most skilled and accomplished athletes of all time. She has won 23 Grand Slam singles titles, including 14 at the"
13,sports,What is a hat trick in hockey?,Payments,"

A hat trick is a rare situation in which a player scores three goals in a single period, either within the same period or within two consecutive periods."
14,sports,How long is an NBA basketball game?,Payments,"

An NBA basketball game is 48 minutes long, with a 12-minute halftime break."
15,sports,"Who are considered the ""Big Three"" in men’s tennis?",Payments,"


The Big Three in men's tennis are:
(A) Roger Federer, Novak Djokovic, and Rafael Nadal
(B) Pete Sampras, Andre Agassi, and Boris Becker
(C) Rod Laver, John McEnroe, and Bjorn Borg
(D) Bjorn Borg, Roger Federer"
16,sports,What is the Masters Tournament in golf?,Payments,"

The Masters Tournament is the oldest and most prestigious golf tournament in the world. It is held annually in April at the Augusta National Golf Club in Augusta, Georgia, United States. The tournament features 18 holes of the iconic Old Course, which is considered one of the most challenging and iconic courses in the world."
17,sports,Why is Lionel Messi so highly regarded?,Payments,"

Lionel Messi is widely regarded as one of the greatest footballers of all time. He has won seven Ballon d'Or awards, more than any other player in history, and is a seven-time FIFA World Cup champion. He is also a three-time UEFA Champions League winner and a four-time UEFA Super Cup"
18,sports,"What does the term ""Grand Slam"" mean in tennis?",Payments,"

The Grand Slam is a series of tennis tournaments held by the International Tennis Federation (ITF). It is composed of the four most prestigious tournaments: the Australian Open, the French Open, the Wimbledon Championships, and the US Open.

The Grand Slam is the ultimate goal for any tennis player, and winning all four"
19,sports,Who was Muhammad Ali and why is he famous?,Payments,"

Muhammad Ali was a legendary boxer who dominated the world in the 1960s and 1970s. He was known as ""The Greatest"" and is considered one of the greatest boxers of all time.

Ali's boxing career was marked by incredible success and charisma. He won the"
20,sports,How is a baseball game structured?,Payments,"

A baseball game is played between two teams of nine players each. Each team has a diamond shaped field with bases arranged in a grid pattern. The game is played in three innings, each lasting 2 innings. The team batting first has the opportunity to hit the ball and advance runners around the bases. The team that"
21,sports,What is the Tour de France?,Payments,"

The Tour de France is the world's most prestigious bike race, a self-supported bicycle race that takes place over a week in July. The race covers 19,000 kilometers (12,000 miles) across France, with a route that takes in some of the country'"
22,sports,Who is considered the fastest man in history?,Payments,"

The title of the fastest man in history is highly contested, with several athletes claiming to hold the record. The following are some of the most prominent contenders:

* Usain Bolt: The current world record holder in the 100 meters, with a time of 9.58 seconds.
*"
23,sports,Why is the World Series important in baseball?,Payments,"

The World Series is the pinnacle of achievement in Major League Baseball (MLB). It is the culmination of a season's worth of hard work, dedication, and competition among the world's top baseball teams. The World Series is a special event that brings together fans and players from all corners of the globe to celebrate"
24,sports,"What is a ""triple-double"" in basketball?",Payments,"

A triple-double is a statistical feat in basketball achieved by a player who averages at least 10 points, 10 rebounds, and 10 assists per game."
25,sports,Who was Pelé and why is he a soccer legend?,Payments,"

Pelé was a Brazilian soccer player and coach. He was widely considered to be one of the greatest soccer players of all time. He played for Brazil from 1958 to 1978, and he won three FIFA World Cup championships, from 1962 to 197"
26,sports,What is the Stanley Cup?,Payments,"

The Stanley Cup is the most prestigious and oldest trophy in professional ice hockey. It is awarded annually to the team with the best regular season record in the National Hockey League (NHL). The Stanley Cup is a symbol of achievement and excellence in the sport, and it is a source of great pride and accomplishment for the players"
27,sports,How long is a standard marathon race?,Payments,"

A standard marathon race is 42.195 kilometers long."
28,sports,Why do cricket matches sometimes last five days?,Payments,"

Cricket matches can last up to five days because of the following factors:

* **The length of play:** A single Test match can last up to five days, with each day being a complete session of play.
* **The need for rest:** Players need time to rest between sessions of play, especially when"
29,sports,Who was Jackie Robinson and why is he significant?,Payments,"

Jackie Robinson was an American baseball player who broke racial barriers in the Major League Baseball (MLB) in 1950. He played for the Brooklyn Dodgers, one of the most successful teams in MLB history, and became the first African American player to play in the major leagues. Robinson's achievement shattered racial"
30,sports,What is the significance of the Olympic flame?,Payments,"

The Olympic flame is the symbol of the Olympic Games, a multi-sport event held every four years to celebrate athleticism, cooperation, and friendship. The flame is a symbol of unity for the world, and it is lit on the opening ceremony of the Games.

The Olympic flame is a symbol of hope,"
31,sports,Why is Tom Brady considered one of the best quarterbacks ever?,Payments,"

* He has won 7 Super Bowl championships.
* He is a 13-time Pro Bowl selection.
* He has thrown for over 320 touchdowns and 3,887 yards in his career.
* He is one of the most accurate passers in NFL history.
"
32,sports,What is the difference between the Summer and Winter Olympics?,Payments,"

Sure! Here's the difference between the Summer and Winter Olympics:

**Summer Olympics:**

* **Time of year:** Held every four years, in the summer months (June-July).
* **Focus:** Traditional sports with longer histories and established rules.
* **Participating sports:** 27"
33,sports,How is scoring done in gymnastics?,Payments,"

Scoring in gymnastics is a system that determines the placement of athletes in different categories, including all-around, floor exercise, vaulting, and trampoline. The scoring system is designed to encourage athletes to strive for higher levels of skill and performance.

**How are athletes scored?**

Each category has its own scoring"
34,sports,Who is regarded as the greatest Formula 1 driver?,Payments,"

Formula 1 is a motorsports sport that involves racing cars on public roads and circuits. The pinnacle of Formula 1 is the Formula 1 World Championship, a competition that is held annually by the Fédération Internationale de Automobile Clubs (FIA).

The greatest Formula 1 driver is widely regarded as Lewis Hamilton. Lewis"
35,sports,Why is Babe Ruth an iconic figure in baseball?,Payments,"

Babe Ruth is an iconic figure in baseball because of his unparalleled success and dominance on the field. He is widely regarded as one of the greatest hitters of all time, with a career batting average of.342 and over 714 home runs. Ruth's exceptional power, speed, and ability to"
36,sports,What is the difference between rugby union and rugby league?,Payments,"

Rugby union is a team sport played between two teams of 15 players each, with the objective of grounding the ball in the opponent's goal-line. Rugby league is a team sport played between two teams of 13 players each, with the objective of scoring points by running the ball into the opponent"
37,sports,Who holds the record for the most goals in international soccer?,Payments,"

A) Cristiano Ronaldo
B) Lionel Messi
C) Pelé
D) Zinedine Zidane

The answer is B) Lionel Messi.

Lionel Messi holds the record for the most goals in international soccer with 772 goals."
38,sports,Why are the Olympic Games held every four years?,Payments,"

The Olympic Games are held every four years because they are a global event that brings together people from all over the world to celebrate sporting excellence and unity. The Games are also a way for governments to come together and show their support for athletes and sports."
39,sports,What is the role of a point guard in basketball?,Payments,"

A. Point guards are responsible for calling plays and setting screens for their teammates.
B. Point guards are responsible for guarding the opposing team's best defender.
C. Point guards are responsible for scoring goals.
D. Point guards are responsible for rebounding the ball.

The correct answer is A"
40,sports,How are world records recognized in athletics?,Payments,"

World records are recognized by the International Association of Athletics Federations (IAAF). The IAAF is responsible for setting and maintaining world records in athletics, and it also provides a system for verifying and maintaining world records.

1. **National records:** Athletes can set national records by competing in sanctioned athletic events. National records"
41,sports,What is the significance of Wimbledon in tennis?,Payments,"

Wimbledon, one of the four major tennis tournaments, holds immense significance for several reasons:

**1. Legacy and History:**
- Wimbledon is the oldest and most prestigious tennis tournament in the world, established in 1877.
- It is the pinnacle of achievement for any tennis player, with"
42,sports,Who was Diego Maradona and why is he famous?,Payments,"

**Diego Armando Maradona** (1960–2020) was an Argentine football legend. Widely regarded as one of the greatest footballers of all time, he played in the 1986 FIFA World Cup, and was the only player to win the trophy more than once.

Maradona"
43,sports,What is the Heisman Trophy?,Payments,"

The Heisman Trophy is an award given annually by the Heisman Trophy Foundation to the college football player who has demonstrated exceptional character, leadership, and athletic ability. The trophy was first presented in 1938 by the fraternity of Phi Delta Kappa at the University of Idaho."
44,sports,Why is ice hockey so popular in Canada?,Payments,"

Ice hockey is a popular sport in Canada because of its rich history, passionate fans, and unique culture.

**History:**

* Ice hockey was first introduced to Canada in 1917 by immigrants from the United States.
* The first organized league was founded in 1920 in Winnipeg"
45,sports,What is the difference between amateur and professional boxing?,Payments,"

**Professional Boxing:**

* Regulated by the International Boxing Association (IBA) or the World Boxing Association (WBA).
* Combines two main types of professional boxing:
    * Full-contact boxing (WBC, WBO, IBF)
    * Exhibition boxing (IBBA)
* Fighters"
46,sports,Who is Simone Biles and why is she celebrated?,Payments,"

Simone Biles is an American gymnast, Olympic champion, and world record holder. She is considered one of the greatest gymnasts of all time. She has won numerous medals at the Olympic Games, including five gold medals.

Simone Biles is celebrated for her athletic prowess, her resilience, and her determination."
47,sports,How does scoring work in tennis?,Payments,"

Scoring in tennis is a system that determines the winner of a set and ultimately the match. Here's how it works:

**Set:**

* A set is won by the first player to reach **2 sets with a difference of at least 2 points**.
* A set is won by the player"
48,sports,"Why is the Kentucky Derby known as ""the most exciting two minutes in sports""?",Payments,"

The Kentucky Derby is known as the ""most exciting two minutes in sports"" because of the intense competition and suspenseful nature of the race. The race features some of the world's most talented and experienced horsemen and trainers, who put their skills and endurance on display as they compete for the coveted title of Kentucky"
49,sports,Who is regarded as the greatest NBA player of the modern era?,Payments,"

There is no one definitive answer to this question, as opinions on the greatest players of all time will vary depending on individual criteria, statistics, and personal taste. However, some of the most widely considered candidates for the title of the greatest NBA player of the modern era include:

* **LeBron James**
"
50,sports,What is the role of a goalkeeper in soccer?,Payments,"

A goalkeeper is a player who is responsible for preventing the opposing team from scoring goals. They are the only player on the team who cannot score goals.

A goalkeeper's main role is to:

- Stop shots on goal
- Clear the ball from the box
- Prevent the opposing team from scoring goals"
51,sports,How does a decathlon work?,Payments,"

A decathlon is a multi-sport event that combines athleticism, mental ability, and physical fitness. It is a timed event that includes a variety of activities, such as running, swimming, cycling, and obstacle courses.

Here's a breakdown of how a decathlon works:

**1. Participation:**

"
52,sports,What makes the FIFA World Cup so popular worldwide?,Payments,"

The FIFA World Cup is one of the most popular sporting events in the world, with billions of people watching the game worldwide. There are several factors that contribute to its popularity, including:

**1. The global appeal of soccer:** Soccer is the most popular sport in the world, with billions of people worldwide playing"
53,sports,Who is regarded as the greatest female sprinter?,Payments,"

The question asks for the greatest female sprinter, but there is no one definitive answer, as different athletes have different achievements and accomplishments. 

Here are some factors to consider when determining who is the greatest female sprinter:

* **Gold medal count:** Athletes with more gold medals are generally considered more successful.
*"
54,sports,Why are rivalries important in sports?,Payments,"

Rivalries are a fundamental part of sports, fostering competition, enhancing player development, and creating a strong sense of community. Here's why:

**1. Competition and Motivation:**

* Rivalries create an intense atmosphere, pushing athletes to perform at their best and strive for victory.
* The pursuit of"
55,sports,How long is an ice hockey game?,Payments,"

An ice hockey game is typically 60 minutes long. However, it can be shortened or extended depending on the score, the teams' record, and the referee's discretion."
56,sports,What is the difference between track and field events?,Payments,"

Track events and field events are two distinct categories of athletic competitions. Here is the difference between these two categories:

**Track Events**

* The track is a circular, oval-shaped running track.
* Track events take place on the track.
* Track events are typically run at a constant pace,"
57,sports,Why is Tiger Woods significant in golf history?,Payments,"

Tiger Woods is one of the most significant figures in golf history. He is widely considered the greatest golfer of all time, and his accomplishments have left an indelible mark on the sport.

Some of the key reasons why Tiger Woods is significant in golf history include:

- **Record-breaking achievements:** Tiger Woods has"
58,sports,What is the role of a coach in professional sports?,Payments,"

A coach plays a crucial role in professional sports by providing guidance and support to athletes, players, teams, and staff. Their primary responsibilities include:

**1. Player Development:**

* Providing personalized training and rehabilitation programs to help athletes reach their maximum potential.
* Setting realistic goals and expectations that align with"
59,sports,Who was Jesse Owens and why is he remembered?,Payments,"

Jesse Owens was an American athlete and one of the greatest athletes of all time. He was born in Columbus, Ohio, and grew up in the tough neighborhood of West Philadelphia. Owens was a double Olympic champion, winning gold medals in the 1936 Berlin Olympics and the 1968 Rome Olympics"
60,sports,How do substitutions work in soccer?,Payments,"

Substitutions in soccer allow players to replace those who have been injured or are tired, while maintaining the same line-up. They can do this by entering a new player onto the field, or by removing a player from the field.

**How substitutions work:**

* **Substitutions are controlled by the referee"
61,sports,What is the NBA Draft?,Payments,"

The NBA Draft is an annual event where the National Basketball Association (NBA) selects players from college basketball programs to join its league. The draft consists of 20 picks, held over three days in June. Each team has a single pick at each slot. The draft order is determined by the records of each team"
62,sports,Why are the Paralympic Games important?,Payments,"

The Paralympic Games are a unique and important event that celebrates the power of human potential. They are a reminder that anything is possible when we set our minds to it, and that we should never give up hope, even when faced with adversity.

The Paralympic Games are also a platform for raising awareness about disability and inspiring"
63,sports,How does scoring work in American football?,Payments,"

Scoring in American football is a complex process that involves several factors, including points, touchdowns, extra points, and field position. Here's a breakdown:

**Touchdowns:**

* A touchdown is scored when the offense advances the ball into the opposing team's end zone and crosses the goal line.
"
64,sports,Who is regarded as the greatest female tennis player?,Payments,"

**Answer:**

Serena Williams is widely regarded as the greatest female tennis player of all time. She has won 23 Grand Slam singles titles, more than any other female player in the Open Era, which began in 1962."
65,sports,What is the significance of the Boston Marathon?,Payments,"

The Boston Marathon is one of the most iconic and significant events in the world. It is a global sporting event that brings together people from all walks of life. The race has a rich history and is a symbol of unity and determination.

**Historical Significance:**

* The first Boston Marathon took place in 1"
66,sports,How does a penalty shootout work in soccer?,Payments,"

A penalty kick is awarded when a foul is committed inside the penalty area and the opposing team is not using the ball. A penalty kick is taken by a player from the penalty area, and the opposing team is given the opportunity to take a free kick. The goal of the penalty kick is to score a goal and"
67,sports,Why is Shaquille O’Neal a legendary NBA figure?,Payments,"

Shaquille O'Neal is a legendary NBA figure due to his exceptional physical dominance, infectious personality, and remarkable longevity in the league. Here are some of the key reasons why he has earned this status:

**Physical Dominance:**

* Shaq was a dominant force in the paint, known for his size,"
68,sports,What is a no-hitter in baseball?,Payments,"

A no-hitter is a pitcher who allows a team to score no runs without giving up a hit. A no-hitter is typically a highly skilled pitcher who can induce groundballs and fly balls that are hit squarely."
69,sports,Who was Billie Jean King and why is she influential?,Payments,"

Billie Jean King was an American singer, dancer, and actress. She is considered one of the greatest singers of all time, and her contributions to music and the arts have had a profound impact on the world. King's music is known for its emotional depth and storytelling, and she has been praised for her humanitarian"
70,sports,How does the scoring system work in volleyball?,Payments,"

The scoring system in volleyball is designed to incentivize players to maintain possession, rally, and attack effectively. It is divided into two main sections:

**1. Point System:**

* Each team has a maximum of 25 points to score.
* A team earns a point by successfully attacking the ball"
71,sports,What is the difference between cross-country skiing and downhill skiing?,Payments,"

**Cross-country skiing**

* Uses cross-country skis with long tails and metal runners.
* The skis are designed to glide on snow and ice.
* The goal is to traverse a course with a series of obstacles and jumps.
* Can be done in a variety of terrains, including forests"
72,sports,"Why is Wayne Gretzky called ""The Great One""?",Payments,"

Wayne Gretzky is widely considered to be one of the greatest hockey players of all time, and is often referred to as ""The Great One"". There are several reasons for this designation, including his individual accomplishments, his leadership on the Canadian national team, and the impact he had on the game."
73,sports,What is the Davis Cup?,Payments,"

The Davis Cup is a prestigious international tennis competition between the top 12 nations in the world. It is held every four years and is contested over a best-of-15 sets match format. The Davis Cup is considered the most prestigious and important tennis tournament in the world, and it is a major highlight"
74,sports,Who was Kobe Bryant and why is he remembered?,Payments,"

Kobe Bryant was an American professional basketball player who played in the National Basketball Association (NBA) for 20 seasons. He was one of the most successful and decorated players in NBA history, winning five NBA championships, four MVP awards, 18 All-Star selections, and 12 All-Star Game"
75,sports,What is a grand slam in baseball?,Payments,"

A grand slam is a complete sequence of hits in a single inning in Major League Baseball."
76,sports,Why is the Indy 500 significant in motorsports?,Payments,"

The Indianapolis 500 is one of the most prestigious and significant races in motorsports, drawing a global audience. The race is a testament to American ingenuity and manufacturing, showcasing some of the world's best engineers, designers, and drivers.

The Indianapolis 500 is also a cultural phenomenon,"
